conceptId,idAndFsnTerm
90243001,90243001 | Diathermy of lesion of retina (procedure) |
90164007,90164007 | Trabeculodialysis (procedure) |
90155002,90155002 | Curettage of corneal epithelium with chemocauterization (procedure) |
89978003,89978003 | Intracapsular extraction of lens with iridectomy for dislocated lens (procedure) |
89942008,89942008 | Removal of foreign body of iris by incision (procedure) |
89788006,89788006 | Magnet extraction of foreign body from posterior segment of eye (procedure) |
89622002,89622002 | Removal of blood clot from anterior segment of eye (procedure) |
89176003,89176003 | Implantation of vitreous for retinal reattachment with buckling (procedure) |
89153001,89153001 | Extracapsular extraction of cataract by rotoextraction with aspiration by posterior route (procedure) |
89038007,89038007 | Operative procedure on iris (procedure) |
88840005,88840005 | Freeing of anterior synechiae of iris by injection of air or liquid (procedure) |
88812000,88812000 | Excision of lesion of ciliary body (procedure) |
88752005,88752005 | Formation of pupil by iridectomy (procedure) |
88282000,88282000 | Extracapsular extraction of cataract by mechanical fragmentation with aspiration (procedure) |
88234006,88234006 | Removal of implant of lens (procedure) |
88096002,88096002 | Capsulectomy with extraction of lens (procedure) |
88044000,88044000 | Repair of perforating laceration of sclera not involving uveal tissue (procedure) |
87639009,87639009 | Facilitation of intraocular circulation (procedure) |
87021001,87021001 | Mechanical vitrectomy by pars plana approach (procedure) |
86948006,86948006 | Destruction of lesion of choroid (procedure) |
86077009,86077009 | Operation for glaucoma (procedure) |
85785001,85785001 | Capsulotomy of lens (procedure) |
85645002,85645002 | Repair of scleral staphyloma (procedure) |
85622008,85622008 | Cryoextraction of cataract by intracapsular approach (procedure) |
85257004,85257004 | Destruction of chorioretinal lesion by radiation therapy (procedure) |
85231002,85231002 | Repair of retinal detachment by laser photocoagulation (procedure) |
85145001,85145001 | Removal of foreign body of cornea with slit lamp (procedure) |
85070003,85070003 | Iridectomy with scleral fistulization (procedure) |
84551008,84551008 | Overlapping of sclera for buckling (procedure) |
84542000,84542000 | Removal of foreign body of anterior chamber of eye by incision with use of magnet (procedure) |
84149000,84149000 | Aspiration of cataract by phacoemulsification (procedure) |
84077007,84077007 | Reinforcement of sclera (procedure) |
84072001,84072001 | Transposition of pterygium (procedure) |
84016007,84016007 | Removal of foreign body from lens (procedure) |
83977000,83977000 | Implantation of retinal attachment (procedure) |
83877004,83877004 | Phlebogoniostomy (procedure) |
83868006,83868006 | Iridocapsulectomy (procedure) |
83816004,83816004 | Operative procedure on the orbit and eyeball (procedure) |
83694000,83694000 | Lamellar keratoplasty (procedure) |
83211004,83211004 | Repair of postcataract wound dehiscence with conjunctival flap (procedure) |
83202004,83202004 | Repair of ciliary body (procedure) |
82948008,82948008 | Destruction of chorioretinal lesion by diathermy (procedure) |
82819003,82819003 | Manipulation of eyeball (procedure) |
82736000,82736000 | Trabeculotomy (procedure) |
82643002,82643002 | Suture of conjunctiva (procedure) |
82627009,82627009 | Discission of vitreous strands by anterior approach (procedure) |
82382005,82382005 | Subtotal removal of vitreous by anterior approach with mechanical vitrectomy (procedure) |
82155009,82155009 | Extracapsular extraction of cataract by emulsification with aspiration (procedure) |
82036007,82036007 | Injection of posterior segment of eye (procedure) |
82027008,82027008 | Iridectomy with filtering operation for glaucoma (procedure) |
81924001,81924001 | Destruction of lesion of retina by photocoagulation (procedure) |
81198005,81198005 | Freeing of goniosynechiae with injection of air or liquid (procedure) |
81177005,81177005 | Destruction of lesion of choroid by laser photocoagulation (procedure) |
81085004,81085004 | Destructive procedure of anterior segment of eye (procedure) |
80806006,80806006 | Scleral buckling with air tamponade (procedure) |
80703007,80703007 | Removal of surgically implanted material from posterior segment of eye (procedure) |
80632003,"80632003 | Vitrectomy, complex, multiple procedures (procedure) |"
80000004,80000004 | Cauterization of fistula of cornea (procedure) |
79707009,79707009 | Conjunctivorhinostomy with insertion of stent (procedure) |
79611007,79611007 | Extracapsular extraction of cataract by curette evacuation (procedure) |
79259004,79259004 | Extraction of secondary membrane by needling (procedure) |
79107000,79107000 | Pleating of sclera for buckling (procedure) |
78917001,78917001 | Repair of retina for retinal detachment by photocoagulation (procedure) |
78362007,78362007 | Removal of foreign body from conjunctiva (procedure) |
78290008,78290008 | Magnet extraction of foreign body from iris (procedure) |
78216001,78216001 | Corneoscleral suture with conjunctival flap (procedure) |
78191003,78191003 | Capsulotomy of lens with removal of foreign body by magnet extraction (procedure) |
78110003,78110003 | Destruction of lesion of choroid by implantation of radiation source (procedure) |
77950003,77950003 | Repair of retina for retinal detachment by cryotherapy (procedure) |
77772005,77772005 | Incision and drainage of eyeball (procedure) |
77184003,77184003 | Cauterization of conjunctiva (procedure) |
76949005,76949005 | Gonioscopy (procedure) |
76824005,76824005 | Repair of conjunctiva for late effect of trachoma (procedure) |
76458006,76458006 | Photocoagulation of iris (procedure) |
76240002,76240002 | Lysis of corneovitreal adhesions (procedure) |
76135002,76135002 | Repair of conjunctiva (procedure) |
75985002,75985002 | Serial tonometry-tonography with evaluation (procedure) |
75903006,75903006 | Destruction of lesion of retina by xenon arc photocoagulation (procedure) |
75870009,75870009 | Iridocystectomy (procedure) |
75814005,75814005 | Erysiphake extraction of cataract by inferior temporal route (procedure) |
75792002,75792002 | Transplantation of vitreous (procedure) |
75787004,75787004 | Operative procedure on anterior segment of eye (procedure) |
75734004,75734004 | Removal of foreign body from choroid by incision (procedure) |
75732000,75732000 | Vitrectomy (procedure) |
75588007,75588007 | Excision of lesion of cornea (procedure) |
75396001,75396001 | Conjunctivoplasty with reconstruction of cul-de-sac and extensive rearrangement (procedure) |
75318004,75318004 | Suture of laceration of sclera (procedure) |
75227000,75227000 | Excision and prosthetic replacement of lens (procedure) |
75170007,75170007 | Extraction of lens of eye (procedure) |
74948004,74948004 | Magnet extraction of foreign body from retina (procedure) |
74579006,74579006 | Goniospasis (procedure) |
74490003,74490003 | Mechanical fragmentation of primary membranous cataract (procedure) |
74410004,74410004 | Subconjunctival injection (procedure) |
74220006,"74220006 | Vitrectomy, complex (procedure) |"
74184007,"74184007 | Incisional discission of lens capsule, initial (procedure) |"
73689008,73689008 | Destruction of lesion of iris (procedure) |
73599006,73599006 | Destruction of chorioretinal lesion by photocoagulation (procedure) |
73200001,73200001 | Operative procedure on ciliary body (procedure) |
73070007,73070007 | Destruction of lesion of choroid by cryotherapy (procedure) |
72713004,72713004 | Incision of conjunctiva (procedure) |
72710001,72710001 | Repair of sclera (procedure) |
72528001,72528001 | Implantation of custodis eye (procedure) |
72491000,72491000 | Repair of laceration of cornea with application of tissue glue (procedure) |
72208004,72208004 | Operative procedure on cornea (procedure) |
72199008,72199008 | Removal of foreign body from vitreous by incision (procedure) |
72176009,72176009 | Reattachment of choroid and retina by xenon arc photocoagulation (procedure) |
72019009,72019009 | Mechanical vitrectomy by posterior approach (procedure) |
71306000,71306000 | Lysis of adhesions of vitreous by posterior approach (procedure) |
71091006,71091006 | Cryotherapy of ciliary body (procedure) |
70969005,70969005 | Penetrating keratoplasty with autograft (procedure) |
70796002,70796002 | Closure of fistula of cornea with lamellar homograft (procedure) |
70202005,70202005 | Repair of scleral staphyloma with graft (procedure) |
70107009,70107009 | Repair of ocular lens (procedure) |
69724002,69724002 | Implantation of prosthetic intraocular lens (procedure) |
69360005,69360005 | Extracapsular extraction of cataract by mechanical fragmentation with aspiration by posterior route (procedure) |
69235008,69235008 | Infolding of sclera for buckling (procedure) |
68999001,68999001 | Reattachment of retina by electrocoagulation (procedure) |
68849001,68849001 | Iridotomy by photocoagulation (procedure) |
68366009,68366009 | Release of encircling material of posterior segment of eye (procedure) |
67991000,67991000 | Extracapsular extraction of lens by linear extraction technique (procedure) |
67835007,67835007 | Operative procedure on sclera (procedure) |
67760003,67760003 | Extracapsular extraction of cataract by rotoextraction with aspiration (procedure) |
67559006,67559006 | Expression of conjunctival follicles (procedure) |
67546003,67546003 | Removal of penetrating foreign body from eye (procedure) |
66960000,66960000 | Suture of corneal laceration (procedure) |
66922009,66922009 | Division of goniosynechiae (procedure) |
66655001,"66655001 | Conjunctival flap, bridge (procedure) |"
66542005,66542005 | Zonulolysis with lens extraction (procedure) |
66359001,66359001 | Intracapsular extraction of lens by inferior temporal route (procedure) |
66226002,66226002 | Extraction of after cataract with capsulotomy (procedure) |
66208000,66208000 | Repair of retina for retinal tear or defect by photocoagulation (procedure) |
66134002,66134002 | Magnet extraction of foreign body from cornea (procedure) |
65839000,65839000 | Ophthalmic ultrasonic foreign body localization (procedure) |
65812008,65812008 | Removal of secondary membranous cataract with iridectomy (procedure) |
64971001,64971001 | Fulguration of retina (procedure) |
64943007,64943007 | Destruction of lesion of choroid by photocoagulation (procedure) |
64854001,64854001 | Aspiration of lens (procedure) |
64835001,64835001 | Extraction of after cataract with iridocapsulectomy (procedure) |
64522003,64522003 | Destruction of chorioretinal lesion by implantation of radiation source (procedure) |
64340000,64340000 | Removal of foreign body from retina without use of magnet (procedure) |
63913004,63913004 | Tonography with water provocation (procedure) |
63726006,63726006 | Posterior sclerotomy with removal of vitreous (procedure) |
63523001,63523001 | Peritomy (procedure) |
63506005,63506005 | Destruction of lesion of choroid by radiation therapy (procedure) |
63356004,63356004 | Capsulectomy of lens (procedure) |
63228006,63228006 | Resection of sclera with scleral buckling (procedure) |
63120005,63120005 | Lysis of adhesions of conjunctiva (procedure) |
62935003,62935003 | Incision of cornea (procedure) |
62428002,62428002 | Suture of cornea (procedure) |
62236008,62236008 | Delimiting keratotomy (procedure) |
62196000,62196000 | Destructive procedure of cornea (procedure) |
62178009,62178009 | Cauterization of iris (procedure) |
61779007,61779007 | Reinsertion of implant of eyeball with conjunctival graft (procedure) |
61732007,61732007 | Trephine sclerectomy (procedure) |
61553000,"61553000 | Ophthalmic biometry by ultrasound echography, A-mode (procedure) |"
61220009,"61220009 | Removal of foreign body of external eye, scleral nonperforating (procedure) |"
61194000,61194000 | Reattachment of choroid and retina by coagulation using electrical energy (procedure) |
60712003,60712003 | Excision of lesion of sclera (procedure) |
60656008,60656008 | Corneal transplant (procedure) |
60204005,60204005 | Cauterization of conjunctival lesion (procedure) |
60177007,60177007 | Mechanical vitrectomy (procedure) |
59959006,59959006 | Repair of eye (procedure) |
59943006,59943006 | Cauterization of chalazion of eyelid (procedure) |
59669002,59669002 | Fistulization of sclera by trephination (procedure) |
59590004,59590004 | Excision of eye with implant and attachment of muscles (procedure) |
59465003,59465003 | Destruction of lesion of cornea by cryotherapy (procedure) |
59234009,"59234009 | Iridectomy with corneoscleral section, optical (procedure) |"
58889009,58889009 | Laserpexy (procedure) |
58689006,58689006 | Magnet extraction of foreign body from lens (procedure) |
58519008,58519008 | Implantation of retinal attachment with buckling (procedure) |
58388006,58388006 | Repair of laceration of conjunctiva (procedure) |
58127007,58127007 | Iridectomy with corneoscleral section and cyclectomy (procedure) |
58076004,58076004 | Refractive keratoplasty by laser surgery (procedure) |
57569002,57569002 | Opticociliary neurectomy (procedure) |
57551006,57551006 | Iridotasis (procedure) |
57103007,57103007 | Reattachment of retina by diathermy (procedure) |
56204000,56204000 | Ophthalmodynamometry (procedure) |
56072006,"56072006 | Ophthalmoscopy with medical evaluation, extended, for retinal detachment mapping (procedure) |"
55931003,55931003 | Lysis of anterior adhesions of iris (procedure) |
54885007,54885007 | Extraction of cataract (procedure) |
54766001,"54766001 | Conjunctival flap, total (procedure) |"
54755008,54755008 | Destruction of lesion of eye (procedure) |
54513001,54513001 | Ophthalmic mucous membrane test (procedure) |
54393001,54393001 | Iridectomy with corneal section and cyclectomy (procedure) |
54362002,54362002 | Removal of intraocular foreign body from anterior segment of eye (procedure) |
54305003,54305003 | Lens couching procedure (procedure) |
54211003,54211003 | Nonmagnetic extraction of foreign body from lens without extraction of lens (procedure) |
54085006,54085006 | Removal of foreign body of ciliary body by incision (procedure) |
53698007,"53698007 | Partial removal of vitreous by anterior approach, limbal incision (procedure) |"
53696006,53696006 | Operation on retina (procedure) |
53612009,53612009 | Repair of corneal laceration with conjunctival flap (procedure) |
53570002,53570002 | Removal of foreign body from eye (procedure) |
53528007,53528007 | Curettage of conjunctiva for trachoma follicles (procedure) |
53524009,53524009 | Ophthalmoscopy (procedure) |
53020005,53020005 | Implantation of vitreous for retinal reattachment (procedure) |
52318007,52318007 | Corneoscleral trephination (procedure) |
52150005,52150005 | Lysis of goniosynechiae (procedure) |
51839008,51839008 | Extraction of primary membranous cataract by needling (procedure) |
51811007,51811007 | Incision of hordeolum (procedure) |
51683002,51683002 | Radial keratotomy (procedure) |
51281007,51281007 | Removal of superficial foreign body from conjunctiva (procedure) |
51081001,51081001 | Cauterization of superficial pannus (procedure) |
50737005,50737005 | Magnet extraction of foreign body from vitreous (procedure) |
50538003,"50538003 | Discission of membranous cataract, primary (procedure) |"
50518004,50518004 | Division of vitreous cicatricial bands by posterior approach (procedure) |
50141002,50141002 | Scleral buckling with vitreous implant (procedure) |
50119002,50119002 | Penetrating keratoplasty in aphakia (procedure) |
49999004,49999004 | Irrigation of eye proper (procedure) |
49789002,49789002 | Injection of air in anterior chamber of eye (procedure) |
49289001,49289001 | Injection of vitreous substitute for reattachment of retina (procedure) |
49288009,49288009 | Irrigation of anterior chamber of eye (procedure) |
49257005,49257005 | Destruction of chorioretinal lesion by laser photocoagulation (procedure) |
49181006,49181006 | Paracentesis of anterior chamber of eye with removal of blood by irrigation (procedure) |
48933009,48933009 | Removal of foreign body from posterior segment of eye (procedure) |
48696000,48696000 | Provocative test for increased intraocular pressure for glaucoma (procedure) |
48671003,"48671003 | Injection of vitreous substitute, pars plana approach (procedure) |"
48507008,48507008 | Iridesis (procedure) |
47487006,47487006 | Excision of lesion of iris (procedure) |
47470009,47470009 | Shortening of sclera for repair of retinal detachment (procedure) |
47242009,47242009 | Excision of lesion of anterior chamber of eye (procedure) |
47130006,47130006 | Conjunctivoplasty with extensive rearrangement (procedure) |
46870009,46870009 | P32 tracer study of eye (procedure) |
46718002,46718002 | Cauterization of lesion of cornea using electrical energy (procedure) |
46697004,46697004 | Incision of zeisian gland (procedure) |
46641002,46641002 | Application of eye pad (procedure) |
46562009,46562009 | Incisional discission of secondary membranous cataract and anterior hyaloid (procedure) |
46426006,46426006 | Cryoextraction of cataract by inferior temporal route (procedure) |
46309001,46309001 | Extraction of primary membranous cataract by excision (procedure) |
46275005,46275005 | Outfolding of sclera for buckling (procedure) |
45919008,45919008 | Excision of secondary membrane (procedure) |
45817009,45817009 | Removal of foreign body from retina by incision (procedure) |
45805007,45805007 | Repair of filtering bleb by scleroplasty (procedure) |
45102007,45102007 | Surgical repair of posterior segment of eye (procedure) |
45031008,45031008 | Fulguration of choroid (procedure) |
44958007,44958007 | Lysis of posterior adhesions of iris (procedure) |
44819003,44819003 | Destructive procedure of lens (procedure) |
44716001,44716001 | Biopsy of cornea (procedure) |
44712004,44712004 | Secondary procedure after removal of eyeball (procedure) |
44703001,44703001 | Trabeculotomy ab externo (procedure) |
44592003,44592003 | Cauterization of ulcer of cornea (procedure) |
44410008,44410008 | Incision and expression of conjunctival follicles (procedure) |
44329003,44329003 | Excision of prolapsed iris (procedure) |
44317007,44317007 | Reattachment of choroid and retina by cryotherapy (procedure) |
44291006,44291006 | Cauterization of meibomian gland (procedure) |
44269004,44269004 | Curette evacuation of lens (procedure) |
43908008,43908008 | Magnet extraction of foreign body from choroid (procedure) |
43582002,43582002 | Mechanical vitrectomy by anterior approach (procedure) |
43334009,43334009 | Reformation of chamber of eye (procedure) |
43111005,43111005 | Destruction of lesion of retina by implantation of radiation source (procedure) |
42910002,42910002 | Exploration of choroid (procedure) |
42286009,42286009 | Destructive procedure on posterior segment of eye (procedure) |
42161006,42161006 | Keratocentesis (procedure) |
42156009,42156009 | Incision of abscess of sclera (procedure) |
42101009,42101009 | Penetrating keratoplasty (procedure) |
41681008,41681008 | Destruction of chorioretinal lesion by xenon arc photocoagulation (procedure) |
41515001,41515001 | Coagulation of lesion of retina using electrical energy (procedure) |
41496004,"41496004 | Ophthalmic echography with amplitude quantitation, A-mode (procedure) |"
41480002,41480002 | Excision of prolapsed ciliary body (procedure) |
40997008,40997008 | Trephine sclerectomy with implant (procedure) |
40899005,40899005 | Cauterization of sclera (procedure) |
40833009,40833009 | Keratectomy (procedure) |
40485001,40485001 | Operation on pterygium with corneal graft (procedure) |
40464001,40464001 | Epikeratophakia (procedure) |
40395007,40395007 | Paracentesis of anterior chamber of eye with diagnostic aspiration of aqueous (procedure) |
40163002,40163002 | Extraction of secondary membrane with capsulectomy (procedure) |
40073002,40073002 | Penetrating keratoplasty in pseudophakia (procedure) |
39346000,39346000 | Excision of lesion of conjunctiva (procedure) |
39243005,39243005 | Mechanical fragmentation of cataract with extraction by posterior route (procedure) |
39195006,39195006 | Thermokeratoplasty (procedure) |
39153002,39153002 | Reconstruction of conjunctival cul-de-sac (procedure) |
39130003,39130003 | Placement of collagen shield on cornea (procedure) |
39029006,39029006 | Electromyogram examination of eye (procedure) |
38948000,38948000 | Lamellar keratoplasty with autograft (procedure) |
38722003,38722003 | Excision of ring of conjunctiva around cornea (procedure) |
38646003,38646003 | Transposition of pterygium with graft (procedure) |
38616001,38616001 | Thermosclerectomy (procedure) |
38487005,38487005 | Closure of fistula of cornea with lamellar autograft (procedure) |
38330000,38330000 | Operation on pterygium (procedure) |
37958004,37958004 | Removal of foreign body of sclera by incision (procedure) |
37741003,37741003 | Excision of lesion of anterior segment of eye (procedure) |
37709009,37709009 | Thermocauterization of sclera with iridectomy (procedure) |
37581007,37581007 | Implantation of epikeratoprosthesis (procedure) |
37332006,37332006 | Magnet extraction of foreign body from sclera (procedure) |
37256008,37256008 | Repair of eye for eyeball rupture (procedure) |
37182005,37182005 | Corneoscleral suture (procedure) |
37002005,37002005 | Destruction of chorioretinal lesion by cryotherapy (procedure) |
36844005,"36844005 | Ophthalmoscopy with medical evaluation, extended, with ophthalmodynamometry (procedure) |"
36812006,36812006 | Iridectomy (procedure) |
36783002,36783002 | Paracentesis of anterior chamber of eye with therapeutic release of aqueous (procedure) |
35717002,35717002 | Discission of congenital cataract (procedure) |
35552007,35552007 | Repair of nonperforating laceration of cornea with removal of foreign body (procedure) |
35317000,35317000 | Tonometry-tonography with evaluation (procedure) |
35137007,35137007 | Photocoagulation of ciliary body (procedure) |
35009002,35009002 | Destruction of lesion of retina (procedure) |
34854007,34854007 | Repair of filtering bleb (procedure) |
34524006,34524006 | Anterior sclerotomy with iridectomy (procedure) |
34489002,34489002 | Free graft to conjunctiva (procedure) |
34098008,34098008 | Repair of symblepharon with free graft of conjunctiva (procedure) |
33810006,33810006 | Injection of eye proper (procedure) |
33481008,33481008 | Mechanical fragmentation of secondary membrane (procedure) |
33412005,33412005 | Closure of fistula of cornea (procedure) |
33397002,33397002 | Reattachment of choroid and retina by diathermy (procedure) |
33095001,33095001 | Fistulectomy of cornea (procedure) |
32788008,32788008 | Lamellar resection of sclera with implant (procedure) |
31944008,31944008 | Chemocauterization of corneal epithelium (procedure) |
31705006,31705006 | Extraction of cataract by rotoextraction with aspiration by posterior route (procedure) |
31530007,31530007 | Removal of foreign body of iris without use of magnet (procedure) |
31230008,31230008 | Repair of tear of retina by coagulation using electrical energy (procedure) |
31222007,31222007 | Paracentesis of anterior chamber of eye (procedure) |
30946002,30946002 | Encircling procedure of sclera for buckling (procedure) |
30931009,30931009 | Repair of choroid (procedure) |
30880003,30880003 | Trabeculectomy ab externo (procedure) |
30842004,"30842004 | Ophthalmoscopy with medical evaluation, extended, with fundus photography (procedure) |"
30823003,30823003 | Excision of lesion of cornea by partial keratectomy (procedure) |
30246007,30246007 | Injection of liquid in anterior chamber of eye (procedure) |
30113009,30113009 | Removal of foreign body of anterior chamber of eye by incision (procedure) |
30104007,30104007 | Needling of lens capsule (procedure) |
29942003,29942003 | Iridotomy by stab incision with transfixion for iris bomb (procedure) |
29911008,29911008 | Cryotherapy of iris (procedure) |
29747000,29747000 | Evisceration of ocular contents with implant into scleral shell (procedure) |
29664009,29664009 | Iridectomy with scleral trephination (procedure) |
29137007,29137007 | Indentation of sclera for buckling (procedure) |
28242004,28242004 | Repair of filtering bleb by corneal graft (procedure) |
27998005,27998005 | Repair of laceration of sclera by application of tissue glue (procedure) |
27695006,27695006 | Scarification of conjunctiva (procedure) |
27668001,27668001 | Insertion of keratoprosthesis (procedure) |
27652007,27652007 | Excision of meibomian gland (procedure) |
26786002,26786002 | Scleral buckling (procedure) |
26633008,26633008 | Operation on choroid (procedure) |
25853004,25853004 | Reattachment of choroid and retina by laser photocoagulation (procedure) |
25444001,25444001 | Destruction of lesion of choroid by diathermy (procedure) |
25316003,25316003 | Destruction of lesion of cornea (procedure) |
25302008,25302008 | Biopsy of iris (procedure) |
25019004,25019004 | Reposition of iris (procedure) |
24670001,24670001 | Transplantation of conjunctiva for pterygium (procedure) |
23598001,23598001 | Discission of vitreous strands by posterior approach (procedure) |
23379002,23379002 | Cyclotomy (procedure) |
23112007,23112007 | Repair of retina for retinal tear or defect by xenon arc photocoagulation (procedure) |
22871000,22871000 | Injection of anterior segment of eye (procedure) |
22768003,22768003 | Suture of retina for reattachment (procedure) |
22623003,22623003 | Reconstruction of cornea (procedure) |
22127001,22127001 | Extraction of secondary membrane by mechanical fragmentation (procedure) |
21965005,21965005 | Removal of retinal implant (procedure) |
21748007,21748007 | Mechanical tattooing of cornea (procedure) |
21608006,21608006 | Destruction of cyst of iris (procedure) |
