conceptId,idAndFsnTerm
169294009,169294009 | Half-deep therapy 60-150 kV (procedure) |
169293003,169293003 | Superficial X-ray therapy 10-60 kV (procedure) |
169292008,169292008 | Grenz ray therapy up to 10 kV (procedure) |
169291001,169291001 | X-ray beam therapy (procedure) |
169142004,169142004 | Isotope static scan lung (procedure) |
169115000,169115000 | Photofluorography of lungs (procedure) |
169091007,169091007 | Stereotactic/stereoscopic test - lungs (procedure) |
169061002,169061002 | Serial radiography of lungs (procedure) |
169057008,169057008 | Kymography - lungs (procedure) |
169021003,169021003 | Fluoroscopy and radiography - lungs (procedure) |
169003001,169003001 | Fluoroscopy - lungs (procedure) |
168812006,168812006 | Selective bronchography (procedure) |
168528006,168528006 | Palliative course of radiotherapy (procedure) |
168527001,168527001 | Radiotherapy for inflammation (procedure) |
168526005,168526005 | Radiotherapy for analgesia (procedure) |
168525009,168525009 | Postoperative course of radiotherapy (procedure) |
168524008,168524008 | Radiotherapy - intraoperative control (procedure) |
168523002,168523002 | Preoperative course of radiotherapy (procedure) |
168522007,168522007 | Radiotherapy for lymphatic irradiation (procedure) |
168521000,168521000 | Radiotherapy for hemopoietic irradiation (procedure) |
168520004,168520004 | Radiotherapy for immunosuppression (procedure) |
119756006,119756006 | Lung destructive procedure (procedure) |
119755005,119755005 | Lung reconstruction (procedure) |
119753003,119753003 | Lung closure (procedure) |
119746007,119746007 | Lung excision (procedure) |
119744005,119744005 | Bronchus manipulation (procedure) |
119743004,119743004 | Bronchus transplantation (procedure) |
119741002,119741002 | Bronchus destructive procedure (procedure) |
119738006,119738006 | Bronchus reconstruction (procedure) |
119736005,119736005 | Bronchus closure (procedure) |
119730004,119730004 | Bronchus excision (procedure) |
118640001,118640001 | Radioimmunotherapy (procedure) |
116030005,116030005 | Wedge biopsy of lung (procedure) |
115960007,115960007 | Total skin electron beam therapy (procedure) |
115959002,115959002 | Stereotactic radiosurgery (procedure) |
113117004,113117004 | External beam radiation therapy particulate radiation (procedure) |
112813007,112813007 | Reimplantation of pulmonary artery for hemitruncus repair (procedure) |
91567001,91567001 | Take-down of stoma of bronchus (procedure) |
91160008,91160008 | Transcricoid bronchography (procedure) |
90249002,90249002 | Pneumocentesis (procedure) |
89862001,89862001 | Repair of lung (procedure) |
88628008,88628008 | Ultrasonography of lung (procedure) |
88039007,88039007 | Transplant of lung (procedure) |
87776000,87776000 | Intra-arterial infusion of antineoplastic agent (procedure) |
87674005,"87674005 | Pulmonary ventilation study, total (procedure) |"
87101000,87101000 | Excision of lesion of bronchus (procedure) |
86811003,"86811003 | Pulmonary ventilation study, aerosol (procedure) |"
86112008,86112008 | Bronchoplasty (procedure) |
85257004,85257004 | Destruction of chorioretinal lesion by radiation therapy (procedure) |
84200003,84200003 | Angiography of pulmonary arteries (procedure) |
83794005,83794005 | Extracorporeal photopheresis (procedure) |
82651004,82651004 | Suture of lung (procedure) |
80347004,80347004 | External beam radiation therapy neutrons (procedure) |
79789005,79789005 | Open repair of major bronchial fistula (procedure) |
79653008,79653008 | Local destruction of lesion of bronchus (procedure) |
78603008,78603008 | Biopsy of lung (procedure) |
78110003,78110003 | Destruction of lesion of choroid by implantation of radiation source (procedure) |
77738002,77738002 | Local chemotherapy for malignant neoplasm (procedure) |
77648009,77648009 | Excision of lesion of lung (procedure) |
77613002,77613002 | External beam radiation therapy with iodine-125 (procedure) |
75766009,"75766009 | Pulmonary ventilation study, gaseous (procedure) |"
74023000,74023000 | External beam radiation therapy of 1 to 25 mega electronvolt protons (procedure) |
72109001,72109001 | Repair of bronchus (procedure) |
70446004,70446004 | Chemotherapy administration into pleural cavity requiring thoracentesis (procedure) |
68619000,68619000 | Chemotherapy for non-neoplastic disease (procedure) |
65952009,65952009 | Gamma ray therapy (procedure) |
64978007,64978007 | Radionuclide therapy for hyperthyroidism (procedure) |
64522003,64522003 | Destruction of chorioretinal lesion by implantation of radiation source (procedure) |
64134004,64134004 | Stereotactic focused gamma radiosurgery of cerebrum (procedure) |
63506005,63506005 | Destruction of lesion of choroid by radiation therapy (procedure) |
62867004,62867004 | External beam radiation therapy with radioactive cesium (procedure) |
62843007,62843007 | Manipulation of lung (procedure) |
61339001,61339001 | Catheterization with bronchial brush biopsy (procedure) |
59325001,59325001 | Fine needle biopsy of bronchus (procedure) |
58074001,58074001 | Bronchoplasty with graft repair (procedure) |
57113004,57113004 | Pulmonary ventilation study (procedure) |
56909003,56909003 | Puncture and aspiration of bronchus (procedure) |
55498000,55498000 | Endotracheal bronchography (procedure) |
51534007,51534007 | Oral chemotherapy for malignant neoplasm (procedure) |
50632006,50632006 | Cyclotron external beam radiation therapy (procedure) |
49795001,49795001 | Total pneumonectomy (procedure) |
49528005,49528005 | Local destruction of lesion of lung (procedure) |
49045006,49045006 | Incision of bronchus (procedure) |
47479005,47479005 | Total body irradiation (procedure) |
46412002,46412002 | Apicectomy lung (procedure) |
46044009,46044009 | Megavoltage radiation therapy (procedure) |
45643008,45643008 | External beam radiation therapy using electrons (procedure) |
45558009,45558009 | Incision of lung (procedure) |
43831007,43831007 | Percutaneous core needle biopsy of lung (procedure) |
43111005,43111005 | Destruction of lesion of retina by implantation of radiation source (procedure) |
42340005,42340005 | Pulmonary artery wedge pressure monitoring (regime/therapy) |
39646005,39646005 | Hemibody irradiation (procedure) |
38216008,38216008 | Infusion chemotherapy for malignant neoplasm (procedure) |
38104006,38104006 | External beam radiation therapy by linear accelerator (procedure) |
36679009,36679009 | Vaginal cone irradiation (procedure) |
35295005,35295005 | Percutaneous fine needle biopsy of lung (procedure) |
33356009,33356009 | Betatron external beam radiation therapy (procedure) |
33195004,33195004 | External beam radiation therapy procedure (procedure) |
31652009,31652009 | Intracavitary chemotherapy for malignant neoplasm (procedure) |
31632008,31632008 | Stereotactic focused proton beam on cerebrum (procedure) |
29785002,29785002 | Core needle biopsy of bronchus (procedure) |
29391003,29391003 | Chemotherapy administration into peritoneal cavity requiring paracentesis (procedure) |
25184000,25184000 | Revision of stoma of bronchus (procedure) |
24977001,24977001 | Topical chemotherapy for malignant neoplasm (procedure) |
24599003,24599003 | Pulmonary artery pressure monitoring (regime/therapy) |
22733003,22733003 | Chemotherapy for non-malignant neoplasm (procedure) |
20142006,20142006 | Excision of accessory or ectopic lung tissue (procedure) |
19095002,19095002 | Ligation of bronchus (procedure) |
15648005,15648005 | Banding of pulmonary artery (procedure) |
15015009,"15015009 | Excision of bronchus, wide sleeve (procedure) |"
14681002,14681002 | Reimplantation of lung (procedure) |
12986006,12986006 | Excision of Pancoast tumor of lung (procedure) |
12149006,"12149006 | Chemotherapy administration, subcutaneous, with local anesthesia (procedure) |"
10611004,10611004 | External beam radiation therapy protons (procedure) |
10492003,10492003 | Radionuclide therapy for glandular suppression (procedure) |
6872008,6872008 | Perfusion chemotherapy for malignant neoplasm (procedure) |
5632009,5632009 | Open biopsy of bronchus (procedure) |
5304008,"5304008 | Deep radiation therapy, 200-300 KVP (procedure) |"
4539004,4539004 | Excision of bronchogenic cyst (procedure) |
4114003,4114003 | Parenteral chemotherapy for malignant neoplasm (procedure) |
3654008,3654008 | Lingulectomy of lung (procedure) |
2079001,2079001 | Reimplantation of anomalous pulmonary artery (procedure) |
435001,435001 | Pulmonary inhalation study (procedure) |
