conceptId,idAndFsnTerm
31632008,31632008 | Stereotactic focused proton beam on cerebrum (procedure) |
29391003,29391003 | Chemotherapy administration into peritoneal cavity requiring paracentesis (procedure) |
24977001,24977001 | Topical chemotherapy for malignant neoplasm (procedure) |
24242005,24242005 | Cobalt-60 therapy (procedure) |
22733003,22733003 | Chemotherapy for non-malignant neoplasm (procedure) |
21372000,21372000 | Radium therapy (procedure) |
14473006,14473006 | Surface brachytherapy (procedure) |
12149006,"12149006 | Chemotherapy administration, subcutaneous, with local anesthesia (procedure) |"
10611004,10611004 | External beam radiation therapy protons (procedure) |
10492003,10492003 | Radionuclide therapy for glandular suppression (procedure) |
6872008,6872008 | Perfusion chemotherapy for malignant neoplasm (procedure) |
5304008,"5304008 | Deep radiation therapy, 200-300 KVP (procedure) |"
4114003,4114003 | Parenteral chemotherapy for malignant neoplasm (procedure) |
1127003,1127003 | Interstitial radium application (procedure) |
