snomed,opcs,opcs_term
42624001,G531,G53.1 Open biopsy of lesion of duodenum
25196007,Y704,Y70.4 Primary operations NOC
49870005,H268,H26.8 Other specified endoscopic extirpation of lesion of sigmoid colon using rigid sigmoidoscope
173958005,G712,G71.2 Bypass of ileum by anastomosis of ileum to ileum
84530005,H301,H30.1 Radiological reduction of intussusception of colon using barium enema
119887001,Y251,Y25.1 Suture of laceration of organ NOC
5722009,Y718,Y71.8 Other specified late operations NOC
107944001,H062,H06.2 Extended right hemicolectomy and anastomosis of ileum to colon
241168000,Y971,Y97.1 Radiology with pre and post contrast
445935002,H262,H26.2 Endoscopic cauterisation of lesion of sigmoid colon using rigid sigmoidoscope
71367006,Y208,Y20.8 Other specified biopsy of organ NOC
8180007,H208,H20.8 Other specified endoscopic extirpation of lesion of colon
445892000,H267,H26.7 Endoscopic resection of lesion of sigmoid colon using rigid sigmoidoscope NEC
73761001,H228,H22.8 Other specified diagnostic endoscopic examination of colon
241165002,Y973,Y97.3 Radiology with post contrast
315294004,Y981,Y98.1 Radiology of one body area (or < 20 minutes)
708920006,H331,H33.1 Abdominoperineal excision of rectum and end colostomy
235342007,H234,H23.4 Endoscopic destruction of lesion of lower bowel using fibreoptic sigmoidoscope NEC
238298006,H341,H34.1 Open excision of lesion of rectum
315294004,U174,U17.4 Barium enema
60775008,H569,H56.9 Unspecified other operations on anus
13004001,H261,H26.1 Endoscopic snare resection of lesion of sigmoid colon using rigid sigmoidoscope
708876004,H018,H01.8 Other specified emergency excision of appendix
44642007,H156,H15.6 Reduction of prolapse of colostomy
241629006,Z291,Z29.1 Rectum
710197007,Z281,Z28.1 Appendix
443480008,H299,H29.9 Unspecified subtotal excision of colon
119288004,J361,J36.1 Excision of ampulla of Vater using duodenal approach
419595006,Y971,Y97.1 Radiology with pre and post contrast
386196007,H341,H34.1 Open excision of lesion of rectum
235341000,H341,H34.1 Open excision of lesion of rectum
84604002,H103,H10.3 Sigmoid colectomy and anastomosis NEC
174588001,J343,J34.3 Sphincteroplasty of pancreatic duct using duodenal approach NEC
235349003,H403,H40.3 Trans-sphincteric destruction of lesion of rectum
169007000,Y973,Y97.3 Radiology with post contrast
8903007,T291,T29.1 Excision of umbilicus
3183007,H154,H15.4 Closure of colostomy
431944009,U175,U17.5 Computed tomography of colon
448596007,H339,H33.9 Unspecified excision of rectum
341729004,H175,H17.5 Open relief of strangulation of colon
13327002,H109,H10.9 Unspecified excision of sigmoid colon
175557007,G752,G75.2 Repair of prolapse of ileostomy
709523008,Y981,Y98.1 Radiology of one body area (or < 20 minutes)
235302002,G592,G59.2 Open destruction of lesion of jejunum
31126004,H413,H41.3 Peranal destruction of lesion of rectum
54747001,H084,H08.4 Transverse colectomy and ileostomy HFQ
449194009,H266,H26.6 Endoscopic submucosal resection of lesion of sigmoid colon using rigid sigmoidoscope
53402007,Y519,Y51.9 Unspecified approach to organ through artificial opening into gastrointestinal tract
446223002,H073,H07.3 Right hemicolectomy and anastomosis NEC
46295004,H331,H33.1 Abdominoperineal excision of rectum and end colostomy
169009002,Y983,Y98.3 Radiology of three body areas (or 20-40 minutes)
431935008,Y513,Y51.3 Approach to organ through ileostomy
21795006,Z298,Z29.8 Specified part of bowel NEC
361153005,Y269,Y26.9 Unspecified other repair of organ NOC
168900006,U218,U21.8 Other specified diagnostic imaging procedures
112875007,H418,H41.8 Other specified other operations on rectum through anus
87279008,H266,H26.6 Endoscopic submucosal resection of lesion of sigmoid colon using rigid sigmoidoscope
431943003,Y985,Y98.5 Radiology of > 4 body areas (or > 40 minutes)
90788004,Z291,Z29.1 Rectum
28939002,H206,H20.6 Fibreoptic endoscopic resection of lesion of colon NEC
450461000,H291,H29.1 Subtotal excision of colon and rectum and creation of colonic pouch and anastomosis of colon to anus
446746001,G493,G49.3 Partial excision of duodenum
84952009,H085,H08.5 Transverse colectomy and exteriorisation of bowel NEC
17041004,H031,H03.1 Drainage of abscess of appendix
235589008,J433,J43.3 Endoscopic retrograde cholangiopancreatography and collection of bile
315294004,Y971,Y97.1 Radiology with pre and post contrast
13327002,H074,H07.4 Right hemicolectomy and ileostomy HFQ
431944009,Y971,Y97.1 Radiology with pre and post contrast
66740000,H194,H19.4 Open removal of foreign body from colon
456004,H053,H05.3 Total colectomy and ileostomy NEC
235334006,H335,H33.5 Rectosigmoidectomy and closure of rectal stump and exteriorisation of bowel
1645004,J381,J38.1 Endoscopic sphincterotomy of sphincter of Oddi and removal of calculus HFQ
87677003,H331,H33.1 Abdominoperineal excision of rectum and end colostomy
609279008,H088,H08.8 Other specified excision of transverse colon
32578005,H039,H03.9 Unspecified other operations on appendix
87594008,G763,G76.3 Open relief of obstruction of ileum NEC
384091000119108,Y514,Y51.4 Approach to organ through colostomy
84952009,H068,H06.8 Other specified extended excision of right hemicolon
32044008,H084,H08.4 Transverse colectomy and ileostomy HFQ
442830000,H236,H23.6 Endoscopic resection of lesion of lower bowel using fibreoptic sigmoidoscope NEC
8180007,H228,H22.8 Other specified diagnostic endoscopic examination of colon
235342007,H236,H23.6 Endoscopic resection of lesion of lower bowel using fibreoptic sigmoidoscope NEC
241674004,H258,H25.8 Other specified diagnostic endoscopic examination of lower bowel using fibreoptic sigmoidoscope
174172009,H202,H20.2 Fibreoptic endoscopic cauterisation of lesion of colon
446416000,G803,G80.3 Diagnostic endoscopic balloon examination of ileum
698959000,Y072,Y07.2 Clipping of organ NOC
62539002,H179,H17.9 Unspecified intra-abdominal manipulation of colon
235346005,Y084,Y08.4 Laser destruction of lesion of organ NOC
241163009,U174,U17.4 Barium enema
446170008,H206,H20.6 Fibreoptic endoscopic resection of lesion of colon NEC
431722009,Y534,Y53.4 Approach to organ under fluoroscopic control
174116003,H122,H12.2 Excision of lesion of colon NEC
37593003,G693,G69.3 Ileectomy and anastomosis of ileum to ileum
6025007,H021,H02.1 Interval appendicectomy
235151005,H221,H22.1 Diagnostic fibreoptic endoscopic examination of colon and biopsy of lesion of colon
65291007,H059,H05.9 Unspecified total excision of colon
438215008,Z277,Z27.7 Small intestine
54747001,H101,H10.1 Sigmoid colectomy and end to end anastomosis of ileum to rectum
13004001,H371,H37.1 Endoscopic mucosal resection of lesion of sigmoid colon using rigid sigmoidoscope
235345009,H262,H26.2 Endoscopic cauterisation of lesion of sigmoid colon using rigid sigmoidoscope
87677003,H333,H33.3 Anterior resection of rectum and anastomosis of colon to rectum using staples
174071004,H065,H06.5 Extended right hemicolectomy and end to side anastomosis
446222007,H095,H09.5 Left hemicolectomy and exteriorisation of bowel NEC
174298006,H444,H44.4 Examination of rectum under anaesthetic
68188002,H168,H16.8 Other specified incision of colon
307260009,G528,G52.8 Other specified operations on ulcer of duodenum
6025007,Y752,Y75.2 Laparoscopic approach to abdominal cavity NEC
78133002,H235,H23.5 Endoscopic submucosal resection of lesion of lower bowel using fibreoptic sigmoidoscope
39166002,G531,G53.1 Open biopsy of lesion of duodenum
13327002,H064,H06.4 Extended right hemicolectomy and ileostomy HFQ
286780001,G558,G55.8 Other specified diagnostic endoscopic examination of duodenum
107944001,H114,H11.4 Colectomy and ileostomy NEC
287784004,H043,H04.3 Panproctocolectomy and anastomosis of ileum to anus NEC
235349003,H493,H49.3 Cryotherapy to lesion of anus
173852007,G509,G50.9 Unspecified open extirpation of lesion of duodenum
449106004,H236,H23.6 Endoscopic resection of lesion of lower bowel using fibreoptic sigmoidoscope NEC
448239001,H234,H23.4 Endoscopic destruction of lesion of lower bowel using fibreoptic sigmoidoscope NEC
84952009,H095,H09.5 Left hemicolectomy and exteriorisation of bowel NEC
79433000,Y073,Y07.3 Obliteration of sinus track from organ NOC
8903007,T292,T29.2 Excision of urachus
73509004,H293,H29.3 Subtotal excision of colon and creation of colonic pouch and anastomosis of colon to rectum
45464004,J369,J36.9 Unspecified other operations on ampulla of Vater using duodenal approach
119887001,Y254,Y25.4 Removal of other suture from organ NOC
173902002,G599,G59.9 Unspecified extirpation of lesion of jejunum
314599004,G436,G43.6 Fibreoptic endoscopic injection therapy to lesion of upper gastrointestinal tract NEC
448829002,H408,H40.8 Other specified operations on rectum through anal sphincter
85849005,H153,H15.3 Refashioning of colostomy
116236007,H488,H48.8 Other specified excision of lesion of anus
265402006,H201,H20.1 Fibreoptic endoscopic snare resection of lesion of colon
359591002,Y253,Y25.3 Removal of retained suture from organ NOC
359591002,Y255,Y25.5 Other attention to suture of organ NOC
32044008,H096,H09.6 Left hemicolectomy and end to side anastomosis
241166001,Y973,Y97.3 Radiology with post contrast
58709004,G435,G43.5 Fibreoptic endoscopic destruction of lesion of upper gastrointestinal tract NEC
49870005,H265,H26.5 Endoscopic destruction of lesion of sigmoid colon using rigid sigmoidoscope NEC
274031008,H343,H34.3 Open cryotherapy to lesion of rectum
45464004,J362,J36.2 Biopsy of lesion of ampulla of Vater using duodenal approach
192461000,Z305,Z30.5 Sphincter of Oddi
18329001,H221,H22.1 Diagnostic fibreoptic endoscopic examination of colon and biopsy of lesion of colon
441538004,Y981,Y98.1 Radiology of one body area (or < 20 minutes)
307584002,Z282,Z28.2 Caecum
65291007,H053,H05.3 Total colectomy and ileostomy NEC
128401003,G533,G53.3 Open removal of foreign body from duodenum
44441009,H231,H23.1 Endoscopic snare resection of lesion of lower bowel using fibreoptic sigmoidoscope
9121000,H482,H48.2 Excision of skin tag of anus
45464004,Y061,Y06.1 Marsupialisation of organ NOC
609279008,H116,H11.6 Colectomy and end to side anastomosis NEC
174132000,H142,H14.2 Refashioning of caecostomy
107944001,H099,H09.9 Unspecified excision of left hemicolon
10361000132103,H202,H20.2 Fibreoptic endoscopic cauterisation of lesion of colon
225097004,H625,H62.5 Irrigation of bowel NEC
449265009,Y973,Y97.3 Radiology with post contrast
235337004,H211,H21.1 Fibreoptic endoscopic dilation of colon
22324003,G582,G58.2 Total jejunectomy and anastomosis of duodenum to ileum
73509004,H159,H15.9 Unspecified other exteriorisation of colon
34414001,H468,H46.8 Other specified other operations on rectum
87279008,H122,H12.2 Excision of lesion of colon NEC
107938000,G791,G79.1 Endoscopic extirpation of lesion of ileum
13004001,H281,H28.1 Diagnostic endoscopic examination of sigmoid colon and biopsy of lesion of sigmoid colon using rigid sigmoidoscope
448156002,H332,H33.2 Proctectomy and anastomosis of colon to anus
709523008,Y973,Y97.3 Radiology with post contrast
25196007,H331,H33.1 Abdominoperineal excision of rectum and end colostomy
301699000,H231,H23.1 Endoscopic snare resection of lesion of lower bowel using fibreoptic sigmoidoscope
71367006,Y201,Y20.1 Stereotactic biopsy of lesion of organ NOC
112875007,Y298,Y29.8 Other specified removal of foreign body from organ NOC
107948003,H174,H17.4 Open reduction of volvulus of colon NEC
84952009,H102,H10.2 Sigmoid colectomy and anastomosis of colon to rectum
1299000,Y051,Y05.1 Total excision of organ NOC
446415001,H288,H28.8 Other specified diagnostic endoscopic examination of sigmoid colon using rigid sigmoidoscope
50774009,Y752,Y75.2 Laparoscopic approach to abdominal cavity NEC
448156002,H338,H33.8 Other specified excision of rectum
54747001,H103,H10.3 Sigmoid colectomy and anastomosis NEC
708642005,H358,H35.8 Other specified fixation of rectum for prolapse
1186912002,H152,H15.2 End colostomy
25196007,Y709,Y70.9 Unspecified early operations NOC
80050006,H251,H25.1 Diagnostic endoscopic examination of lower bowel and biopsy of lesion of lower bowel using fibreoptic sigmoidoscope
78925004,G712,G71.2 Bypass of ileum by anastomosis of ileum to ileum
59896001,Y402,Y40.2 Stretching of organ NOC
448592009,H235,H23.5 Endoscopic submucosal resection of lesion of lower bowel using fibreoptic sigmoidoscope
67715004,Y973,Y97.3 Radiology with post contrast
16442821000119108,Y971,Y97.1 Radiology with pre and post contrast
32044008,H119,H11.9 Unspecified other excision of colon
241333009,Y949,Y94.9 Unspecified radiopharmaceutical imaging
68671008,H415,H41.5 Peranal resection of rectum using staples
543008,J348,J34.8 Other specified plastic repair of sphincter of Oddi using duodenal approach
304583001,H064,H06.4 Extended right hemicolectomy and ileostomy HFQ
609279008,H113,H11.3 Colectomy and anastomosis NEC
609279008,H092,H09.2 Left hemicolectomy and end to end anastomosis of colon to colon
60775008,H419,H41.9 Unspecified other operations on rectum through anus
241333009,Y948,Y94.8 Other specified radiopharmaceutical imaging
46569000,H332,H33.2 Proctectomy and anastomosis of colon to anus
23121008,Y131,Y13.1 Cauterisation of lesion of organ NOC
252674007,U178,U17.8 Other specified diagnostic imaging of digestive tract
53402007,Y514,Y51.4 Approach to organ through colostomy
1390003,Y752,Y75.2 Laparoscopic approach to abdominal cavity NEC
274352006,H251,H25.1 Diagnostic endoscopic examination of lower bowel and biopsy of lesion of lower bowel using fibreoptic sigmoidoscope
265455000,J381,J38.1 Endoscopic sphincterotomy of sphincter of Oddi and removal of calculus HFQ
307193005,H075,H07.5 Right hemicolectomy and end to side anastomosis
307245006,H271,H27.1 Endoscopic dilation of sigmoid colon using rigid sigmoidoscope
445986007,Z274,Z27.4 Duodenum
23478009,G761,G76.1 Open reduction of intussusception of ileum
265418000,H354,H35.4 Fixation of rectum using fascia lata
236205009,Z283,Z28.3 Ascending colon
22094003,H469,H46.9 Unspecified other operations on rectum
241336001,Y942,Y94.2 Octreotide imaging
9280007,H469,H46.9 Unspecified other operations on rectum
4862007,Y716,Y71.6 Second revisional operation NOC
21423008,H281,H28.1 Diagnostic endoscopic examination of sigmoid colon and biopsy of lesion of sigmoid colon using rigid sigmoidoscope
235344008,H231,H23.1 Endoscopic snare resection of lesion of lower bowel using fibreoptic sigmoidoscope
235148003,G621,G62.1 Open jejunoscopy
307666008,H299,H29.9 Unspecified subtotal excision of colon
36984000,Y071,Y07.1 Ligation of organ NOC
307510004,G523,G52.3 Oversew of blood vessel of duodenal ulcer
448156002,H412,H41.2 Peranal excision of lesion of rectum
310804003,Y241,Y24.1 Microvascular reconstruction of organ NOC
438775000,G761,G76.1 Open reduction of intussusception of ileum
60775008,H564,H56.4 Excision of anal fissure
448653006,H152,H15.2 End colostomy
173902002,G592,G59.2 Open destruction of lesion of jejunum
288122006,H213,H21.3 Fibreoptic endoscopic removal of foreign body from colon
84952009,H115,H11.5 Colectomy and exteriorisation of bowel NEC
13327002,H106,H10.6 Sigmoid colectomy and end to side anastomosis
174116003,H121,H12.1 Excision of diverticulum of colon
426699005,Z286,Z28.6 Sigmoid colon
13327002,H118,H11.8 Other specified other excision of colon
307193005,H071,H07.1 Right hemicolectomy and end to end anastomosis of ileum to colon
74373008,G785,G78.5 Exclusion of segment of ileum
710197007,Y981,Y98.1 Radiology of one body area (or < 20 minutes)
59896001,Y401,Y40.1 Dilation of stricture of organ NOC
398243002,P237,P23.7 Posterior colporrhaphy with mesh reinforcement
32044008,H109,H10.9 Unspecified excision of sigmoid colon
84604002,H109,H10.9 Unspecified excision of sigmoid colon
116236007,H482,H48.2 Excision of skin tag of anus
235344008,H206,H20.6 Fibreoptic endoscopic resection of lesion of colon NEC
235152003,Y255,Y25.5 Other attention to suture of organ NOC
4829004,G699,G69.9 Unspecified excision of ileum
609279008,H121,H12.1 Excision of diverticulum of colon
75157003,Z291,Z29.1 Rectum
235149006,G621,G62.1 Open jejunoscopy
84952009,H078,H07.8 Other specified other excision of right hemicolon
275012008,H412,H41.2 Peranal excision of lesion of rectum
235345009,H413,H41.3 Peranal destruction of lesion of rectum
235589008,J432,J43.2 Endoscopic retrograde cholangiopancreatography and biopsy of lesion of biliary or pancreatic system NEC
235340004,H412,H41.2 Peranal excision of lesion of rectum
235269006,Y132,Y13.2 Cryotherapy to lesion of organ NOC
235260005,G532,G53.2 Closure of perforation of duodenum NEC
241166001,U174,U17.4 Barium enema
73509004,H291,H29.1 Subtotal excision of colon and rectum and creation of colonic pouch and anastomosis of colon to anus
6019008,H289,H28.9 Unspecified diagnostic endoscopic examination of sigmoid colon using rigid sigmoidoscope
44441009,H232,H23.2 Endoscopic cauterisation of lesion of lower bowel using fibreoptic sigmoidoscope
58365005,G791,G79.1 Endoscopic extirpation of lesion of ileum
19639005,H198,H19.8 Other specified other open operations on colon
6025007,Y755,Y75.5 Laparoscopic ultrasonic approach to abdominal cavity
68188002,H161,H16.1 Drainage of colon
235341000,H349,H34.9 Unspecified open extirpation of lesion of rectum
45220009,H334,H33.4 Anterior resection of rectum and anastomosis NEC
241674004,H248,H24.8 Other specified other therapeutic endoscopic operations on lower bowel using fibreoptic sigmoidoscope
447166008,Y754,Y75.4 Hand assisted minimal access approach to abdominal cavity
235298005,G791,G79.1 Endoscopic extirpation of lesion of ileum
307666008,H052,H05.2 Total colectomy and ileostomy and creation of rectal fistula HFQ
431470004,H149,H14.9 Unspecified exteriorisation of caecum
174619006,J431,J43.1 Endoscopic retrograde cholangiopancreatography and biopsy of lesion of ampulla of Vater
447166008,H062,H06.2 Extended right hemicolectomy and anastomosis of ileum to colon
78133002,H231,H23.1 Endoscopic snare resection of lesion of lower bowel using fibreoptic sigmoidoscope
8773000,Y016,Y01.6 Alloreplacement of organ from cadaver NOC
84952009,H101,H10.1 Sigmoid colectomy and end to end anastomosis of ileum to rectum
448156002,H401,H40.1 Trans-sphincteric excision of mucosa of rectum
315325005,H095,H09.5 Left hemicolectomy and exteriorisation of bowel NEC
710197007,Y973,Y97.3 Radiology with post contrast
34414001,Y301,Y30.1 Incision of lesion of organ NOC
26925005,H086,H08.6 Transverse colectomy and end to side anastomosis
90976006,G659,G65.9 Unspecified diagnostic endoscopic examination of jejunum
49870005,H206,H20.6 Fibreoptic endoscopic resection of lesion of colon NEC
26390003,H052,H05.2 Total colectomy and ileostomy and creation of rectal fistula HFQ
359594005,Y258,Y25.8 Other specified suture of organ NOC
71367006,Y204,Y20.4 Fine needle aspiration NOC
726096009,U179,U17.9 Unspecified diagnostic imaging of digestive tract
65291007,H052,H05.2 Total colectomy and ileostomy and creation of rectal fistula HFQ
51346007,G693,G69.3 Ileectomy and anastomosis of ileum to ileum
446169007,H304,H30.4 Intubation of colon NEC
36984000,G789,G78.9 Unspecified other open operations on ileum
18329001,H251,H25.1 Diagnostic endoscopic examination of lower bowel and biopsy of lesion of lower bowel using fibreoptic sigmoidoscope
10088002,Y716,Y71.6 Second revisional operation NOC
359591002,G535,G53.5 Incision of duodenum NEC
384091000119108,Y985,Y98.5 Radiology of > 4 body areas (or > 40 minutes)
81214004,Y082,Y08.2 Laser excision of lesion of organ NOC
359603000,G608,G60.8 Other specified artificial opening into jejunum
431670008,G604,G60.4 Attention to jejunostomy tube
24420007,H252,H25.2 Diagnostic endoscopic examination of lower bowel and sampling for bacterial overgrowth using fibreoptic sigmoidoscope
241336001,Y938,Y93.8 Other specified gallium-67 imaging
75312003,H293,H29.3 Subtotal excision of colon and creation of colonic pouch and anastomosis of colon to rectum
169006009,Y971,Y97.1 Radiology with pre and post contrast
446746001,G499,G49.9 Unspecified excision of duodenum
66740000,H192,H19.2 Fixation of colon
28939002,H231,H23.1 Endoscopic snare resection of lesion of lower bowel using fibreoptic sigmoidoscope
299693003,G651,G65.1 Diagnostic endoscopic examination of jejunum and biopsy of lesion of jejunum
32578005,H038,H03.8 Other specified other operations on appendix
288122006,H272,H27.2 Endoscopic removal of foreign body from sigmoid colon using rigid sigmoidoscope
419773005,Y981,Y98.1 Radiology of one body area (or < 20 minutes)
87279008,H206,H20.6 Fibreoptic endoscopic resection of lesion of colon NEC
287784004,H041,H04.1 Panproctocolectomy and ileostomy
174041007,H013,H01.3 Emergency excision of normal appendix
44441009,H234,H23.4 Endoscopic destruction of lesion of lower bowel using fibreoptic sigmoidoscope NEC
36984000,G788,G78.8 Other specified other open operations on ileum
84952009,H063,H06.3 Extended right hemicolectomy and anastomosis NEC
174288000,H422,H42.2 Perineal plication of levator ani muscles and anal sphincters
73872003,H444,H44.4 Examination of rectum under anaesthetic
609279008,H102,H10.2 Sigmoid colectomy and anastomosis of colon to rectum
27397009,Y331,Y33.1 Acupuncture of organ NOC
359548007,G781,G78.1 Open biopsy of lesion of ileum
241333009,Y931,Y93.1 Gallium-67 imaging scan
13327002,Y524,Y52.4 Peranal transrectal approach to organ
716694009,U211,U21.1 Magnetic resonance imaging NEC
26925005,H089,H08.9 Unspecified excision of transverse colon
12827003,H338,H33.8 Other specified excision of rectum
431214001,U212,U21.2 Computed tomography NEC
81214004,Y081,Y08.1 Laser excision of organ NOC
32578005,H032,H03.2 Drainage of appendix NEC
83599002,G535,G53.5 Incision of duodenum NEC
60775008,H561,H56.1 Biopsy of lesion of anus
287784004,H042,H04.2 Panproctocolectomy and anastomosis of ileum to anus and creation of pouch HFQ
54747001,H073,H07.3 Right hemicolectomy and anastomosis NEC
14690009,H131,H13.1 Bypass of colon by anastomosis of ileum to colon
75312003,H299,H29.9 Unspecified subtotal excision of colon
75420000,G538,G53.8 Other specified other open operations on duodenum
68671008,Y128,Y12.8 Other specified chemical destruction of lesion of organ NOC
22324003,G583,G58.3 Total jejunectomy and anastomosis of duodenum to colon
448360009,Y171,Y17.1 Electrocauterisation of lesion of organ NOC
241674004,H239,H23.9 Unspecified endoscopic extirpation of lesion of lower bowel using fibreoptic sigmoidoscope
67715004,Z274,Z27.4 Duodenum
116237003,H412,H41.2 Peranal excision of lesion of rectum
44642007,H155,H15.5 Dilation of colostomy
174595005,G752,G75.2 Repair of prolapse of ileostomy
13327002,H084,H08.4 Transverse colectomy and ileostomy HFQ
112875007,H411,H41.1 Rectosigmoidectomy and peranal anastomosis
107944001,H059,H05.9 Unspecified total excision of colon
68065001,G602,G60.2 Refashioning of jejunostomy
173960007,G712,G71.2 Bypass of ileum by anastomosis of ileum to ileum
13004001,H264,H26.4 Endoscopic cryotherapy to lesion of sigmoid colon using rigid sigmoidoscope
235348006,H348,H34.8 Other specified open extirpation of lesion of rectum
235263007,G542,G54.2 Endoscopic dilation of duodenum
235294007,G792,G79.2 Endoscopic dilation of ileum
174272000,H403,H40.3 Trans-sphincteric destruction of lesion of rectum
448829002,H468,H46.8 Other specified other operations on rectum
13004001,H263,H26.3 Endoscopic laser destruction of lesion of sigmoid colon using rigid sigmoidoscope
782838000,Y281,Y28.1 Insertion of synthetic mesh into organ NOC
235148003,G808,G80.8 Other specified diagnostic endoscopic examination of ileum
44441009,H244,H24.4 Endoscopic insertion of expanding metal stent into lower bowel using fibreoptic sigmoidoscope
73509004,H151,H15.1 Loop colostomy
23478009,G769,G76.9 Unspecified intra-abdominal manipulation of ileum
34414001,Y308,Y30.8 Other specified incision of organ NOC
174619006,J432,J43.2 Endoscopic retrograde cholangiopancreatography and biopsy of lesion of biliary or pancreatic system NEC
235152003,G522,G52.2 Suture of ulcer of duodenum NEC
235147008,G803,G80.3 Diagnostic endoscopic balloon examination of ileum
698959000,G798,G79.8 Other specified therapeutic endoscopic operations on ileum
289060008,H425,H42.5 Excision of mucosal prolapse of rectum NEC
1299000,H028,H02.8 Other specified other excision of appendix
307261008,G521,G52.1 Closure of perforated ulcer of duodenum
40826009,G802,G80.2 Wireless capsule endoscopy
543008,J341,J34.1 Sphincteroplasty of bile duct and pancreatic duct using duodenal approach
174012003,G793,G79.3 Endoscopic insertion of tubal prosthesis into ileum
609282003,H278,H27.8 Other specified other therapeutic endoscopic operations on sigmoid colon using rigid sigmoidoscope
708876004,H021,H02.1 Interval appendicectomy
609279008,H109,H10.9 Unspecified excision of sigmoid colon
84952009,H119,H11.9 Unspecified other excision of colon
116236007,H483,H48.3 Excision of perianal wart
9280007,H411,H41.1 Rectosigmoidectomy and peranal anastomosis
41330009,H099,H09.9 Unspecified excision of left hemicolon
236783000,G712,G71.2 Bypass of ileum by anastomosis of ileum to ileum
241336001,Y944,Y94.4 Diethylenetriamine pentacetic acid imaging
359584000,G538,G53.8 Other specified other open operations on duodenum
5722009,H135,H13.5 Bypass of colon by anastomosis of colon to rectum NEC
445938000,Y171,Y17.1 Electrocauterisation of lesion of organ NOC
287807002,H265,H26.5 Endoscopic destruction of lesion of sigmoid colon using rigid sigmoidoscope NEC
49870005,H239,H23.9 Unspecified endoscopic extirpation of lesion of lower bowel using fibreoptic sigmoidoscope
445892000,H231,H23.1 Endoscopic snare resection of lesion of lower bowel using fibreoptic sigmoidoscope
174116003,H128,H12.8 Other specified extirpation of lesion of colon
609279008,H075,H07.5 Right hemicolectomy and end to side anastomosis
116236007,H345,H34.5 Open destruction of lesion of rectum NEC
235584003,J391,J39.1 Endoscopic sphincterotomy of accessory ampulla of Vater
