snomed,opcs,opcs_term
69538006,Y059,Y05.9 Unspecified excision of organ NOC
307511000,G522,G52.2 Suture of ulcer of duodenum NEC
174208002,H262,H26.2 Endoscopic cauterisation of lesion of sigmoid colon using rigid sigmoidoscope
235259000,G532,G53.2 Closure of perforation of duodenum NEC
60362005,Z286,Z28.6 Sigmoid colon
384091000119108,U174,U17.4 Barium enema
265407000,H263,H26.3 Endoscopic laser destruction of lesion of sigmoid colon using rigid sigmoidoscope
13004001,H269,H26.9 Unspecified endoscopic extirpation of lesion of sigmoid colon using rigid sigmoidoscope
75312003,G743,G74.3 Creation of defunctioning ileostomy
51346007,G694,G69.4 Ileectomy and anastomosis of ileum to colon
174039006,H013,H01.3 Emergency excision of normal appendix
361153005,H152,H15.2 End colostomy
176007002,M851,M85.1 Endoscopic examination of intestinal conduit
32956007,Y012,Y01.2 Alloreplacement of organ NOC
443037006,Y533,Y53.3 Approach to organ under computed tomography scan control
446885004,G802,G80.2 Wireless capsule endoscopy
174207007,H371,H37.1 Endoscopic mucosal resection of lesion of sigmoid colon using rigid sigmoidoscope
90856004,G694,G69.4 Ileectomy and anastomosis of ileum to colon
73759005,G493,G49.3 Partial excision of duodenum
449194009,H267,H26.7 Endoscopic resection of lesion of sigmoid colon using rigid sigmoidoscope NEC
240959006,U174,U17.4 Barium enema
235585002,J431,J43.1 Endoscopic retrograde cholangiopancreatography and biopsy of lesion of ampulla of Vater
174249002,H343,H34.3 Open cryotherapy to lesion of rectum
235149006,G643,G64.3 Endoscopic insertion of tubal prosthesis into jejunum
440032004,H358,H35.8 Other specified fixation of rectum for prolapse
235585002,J439,J43.9 Unspecified diagnostic endoscopic retrograde examination of bile duct and pancreatic duct
384091000119108,Y981,Y98.1 Radiology of one body area (or < 20 minutes)
107948003,H178,H17.8 Other specified intra-abdominal manipulation of colon
307586000,Y752,Y75.2 Laparoscopic approach to abdominal cavity NEC
235151005,H188,H18.8 Other specified open endoscopic operations on colon
66740000,H199,H19.9 Unspecified other open operations on colon
173949003,G693,G69.3 Ileectomy and anastomosis of ileum to ileum
450353006,H442,H44.2 Manual reduction of prolapse of rectum
33759004,Y255,Y25.5 Other attention to suture of organ NOC
6019008,H228,H22.8 Other specified diagnostic endoscopic examination of colon
174071004,H061,H06.1 Extended right hemicolectomy and end to end anastomosis
33649007,H192,H19.2 Fixation of colon
287784004,H048,H04.8 Other specified total excision of colon and rectum
51346007,G698,G69.8 Other specified excision of ileum
80146002,H013,H01.3 Emergency excision of normal appendix
426775000,Y539,Y53.9 Unspecified approach to organ under image control
87594008,G764,G76.4 Plication of ileum
65291007,H048,H04.8 Other specified total excision of colon and rectum
81214004,Y086,Y08.6 Laser incision of organ NOC
241477001,Y985,Y98.5 Radiology of > 4 body areas (or > 40 minutes)
174619006,J391,J39.1 Endoscopic sphincterotomy of accessory ampulla of Vater
174162006,H191,H19.1 Open biopsy of lesion of colon
119887001,G784,G78.4 Closure of perforation of ileum
711421003,Y971,Y97.1 Radiology with pre and post contrast
169006009,U215,U21.5 Contrast fluoroscopy NEC
307511000,G529,G52.9 Unspecified operations on ulcer of duodenum
13004001,H267,H26.7 Endoscopic resection of lesion of sigmoid colon using rigid sigmoidoscope NEC
54747001,H115,H11.5 Colectomy and exteriorisation of bowel NEC
241333009,U178,U17.8 Other specified diagnostic imaging of digestive tract
13327002,H108,H10.8 Other specified excision of sigmoid colon
168843004,U174,U17.4 Barium enema
301700004,H261,H26.1 Endoscopic snare resection of lesion of sigmoid colon using rigid sigmoidoscope
287784004,H333,H33.3 Anterior resection of rectum and anastomosis of colon to rectum using staples
446170008,H201,H20.1 Fibreoptic endoscopic snare resection of lesion of colon
609279008,H106,H10.6 Sigmoid colectomy and end to side anastomosis
54747001,H079,H07.9 Unspecified other excision of right hemicolon
609279008,H074,H07.4 Right hemicolectomy and ileostomy HFQ
54686006,H281,H28.1 Diagnostic endoscopic examination of sigmoid colon and biopsy of lesion of sigmoid colon using rigid sigmoidoscope
68065001,G608,G60.8 Other specified artificial opening into jejunum
235150006,H228,H22.8 Other specified diagnostic endoscopic examination of colon
5722009,Y712,Y71.2 Secondary operations NOC
8180007,H229,H22.9 Unspecified diagnostic endoscopic examination of colon
66782001,G753,G75.3 Closure of ileostomy
315327002,H105,H10.5 Sigmoid colectomy and exteriorisation of bowel NEC
119287009,H221,H22.1 Diagnostic fibreoptic endoscopic examination of colon and biopsy of lesion of colon
4862007,H132,H13.2 Bypass of colon by anastomosis of caecum to sigmoid colon
235149006,G628,G62.8 Other specified open endoscopic operations on jejunum
445935002,H232,H23.2 Endoscopic cauterisation of lesion of lower bowel using fibreoptic sigmoidoscope
307561009,G742,G74.2 Creation of temporary ileostomy
447021001,Y395,Y39.5 Tattooing of organ NOC
1186912002,H159,H15.9 Unspecified other exteriorisation of colon
174153009,H175,H17.5 Open relief of strangulation of colon
425616008,G681,G68.1 Allotransplantation of ileum
241334003,Y943,Y94.3 Metaiodobenzylguanidine imaging
9121000,H128,H12.8 Other specified extirpation of lesion of colon
44441009,H259,H25.9 Unspecified diagnostic endoscopic examination of lower bowel using fibreoptic sigmoidoscope
286780001,Y515,Y51.5 Approach to organ through appendicostomy
84952009,H083,H08.3 Transverse colectomy and anastomosis NEC
609282003,Y119,Y11.9 Unspecified other destruction of organ NOC
446223002,H064,H06.4 Extended right hemicolectomy and ileostomy HFQ
710203005,H301,H30.1 Radiological reduction of intussusception of colon using barium enema
235349003,H208,H20.8 Other specified endoscopic extirpation of lesion of colon
265404007,H233,H23.3 Endoscopic laser destruction of lesion of lower bowel using fibreoptic sigmoidoscope
359594005,G523,G52.3 Oversew of blood vessel of duodenal ulcer
708642005,H352,H35.2 Posterior fixation of rectum using prosthetic material
25196007,H337,H33.7 Perineal resection of rectum HFQ
445863004,U217,U21.7 Plain x-ray NEC
73921006,H368,H36.8 Other specified other abdominal operations for prolapse of rectum
241335002,U178,U17.8 Other specified diagnostic imaging of digestive tract
450501004,H621,H62.1 Laser recanalisation of bowel NEC
1299000,Y054,Y05.4 Ex vivo resection of organ NOC
438215008,Y698,Y69.8 Other specified harvest of other tissue
173858006,G512,G51.2 Bypass of duodenum by anastomosis of duodenum to duodenum
33759004,H192,H19.2 Fixation of colon
367436000,G742,G74.2 Creation of temporary ileostomy
13004001,H268,H26.8 Other specified endoscopic extirpation of lesion of sigmoid colon using rigid sigmoidoscope
27397009,G543,G54.3 Endoscopic insertion of tubal prosthesis into duodenum
60362005,Y254,Y25.4 Removal of other suture from organ NOC
32044008,H085,H08.5 Transverse colectomy and exteriorisation of bowel NEC
174198003,Z287,Z28.7 Colon NEC
716235000,Y973,Y97.3 Radiology with post contrast
431943003,Y513,Y51.3 Approach to organ through ileostomy
241674004,H231,H23.1 Endoscopic snare resection of lesion of lower bowel using fibreoptic sigmoidoscope
764577000,Y981,Y98.1 Radiology of one body area (or < 20 minutes)
444688002,H351,H35.1 Anterior fixation of rectum
64744006,G631,G63.1 Open biopsy of lesion of jejunum
609279008,H111,H11.1 Colectomy and end to end anastomosis of colon to colon NEC
27397009,G572,G57.2 Intubation of duodenum NEC
73978003,G699,G69.9 Unspecified excision of ileum
252674007,Y938,Y93.8 Other specified gallium-67 imaging
281413005,G532,G53.2 Closure of perforation of duodenum NEC
17671008,H336,H33.6 Anterior resection of rectum and exteriorisation of bowel
22094003,H464,H46.4 Intubation of rectum NEC
14690009,H191,H19.1 Open biopsy of lesion of colon
26925005,H083,H08.3 Transverse colectomy and anastomosis NEC
62539002,H178,H17.8 Other specified intra-abdominal manipulation of colon
398135004,H143,H14.3 Closure of caecostomy
301089009,G542,G54.2 Endoscopic dilation of duodenum
252674007,Y943,Y94.3 Metaiodobenzylguanidine imaging
445892000,H236,H23.6 Endoscopic resection of lesion of lower bowel using fibreoptic sigmoidoscope NEC
42624001,G534,G53.4 Open insertion of tubal prosthesis into duodenum
8180007,H211,H21.1 Fibreoptic endoscopic dilation of colon
82619000,H091,H09.1 Left hemicolectomy and end to end anastomosis of colon to rectum
361152000,H157,H15.7 Percutaneous endoscopic sigmoid colostomy
398135004,H148,H14.8 Other specified exteriorisation of caecum
433246009,Y949,Y94.9 Unspecified radiopharmaceutical imaging
449194009,H261,H26.1 Endoscopic snare resection of lesion of sigmoid colon using rigid sigmoidoscope
37593003,G691,G69.1 Ileectomy and anastomosis of stomach to ileum
116236007,H122,H12.2 Excision of lesion of colon NEC
359591002,G539,G53.9 Unspecified other open operations on duodenum
444783004,H229,H22.9 Unspecified diagnostic endoscopic examination of colon
56078005,Y067,Y06.7 Radiofrequency excision of lesion of organ NOC
174289008,H423,H42.3 Insertion of supralevator sling
241337005,U178,U17.8 Other specified diagnostic imaging of digestive tract
235255006,G498,G49.8 Other specified excision of duodenum
174228003,H305,H30.5 Irrigation of colon
13893002,H038,H03.8 Other specified other operations on appendix
426585001,Y532,Y53.2 Approach to organ under ultrasonic control
235148003,G792,G79.2 Endoscopic dilation of ileum
18339007,H442,H44.2 Manual reduction of prolapse of rectum
87594008,H174,H17.4 Open reduction of volvulus of colon NEC
241164003,Y971,Y97.1 Radiology with pre and post contrast
265414003,H339,H33.9 Unspecified excision of rectum
112872005,H191,H19.1 Open biopsy of lesion of colon
314592008,H334,H33.4 Anterior resection of rectum and anastomosis NEC
241165002,Y981,Y98.1 Radiology of one body area (or < 20 minutes)
25196007,H334,H33.4 Anterior resection of rectum and anastomosis NEC
312497000,H338,H33.8 Other specified excision of rectum
307586000,H084,H08.4 Transverse colectomy and ileostomy HFQ
23478009,G763,G76.3 Open relief of obstruction of ileum NEC
73978003,G698,G69.8 Other specified excision of ileum
41500002,U173,U17.3 Barium swallow
448360009,H262,H26.2 Endoscopic cauterisation of lesion of sigmoid colon using rigid sigmoidoscope
174210000,Z291,Z29.1 Rectum
235344008,H207,H20.7 Fibreoptic endoscopic mucosal resection of lesion of colon
6025007,H013,H01.3 Emergency excision of normal appendix
287784004,H331,H33.1 Abdominoperineal excision of rectum and end colostomy
56078005,Y062,Y06.2 Deroofing of cyst of organ NOC
173852007,G502,G50.2 Open destruction of lesion of duodenum
241161006,Y981,Y98.1 Radiology of one body area (or < 20 minutes)
107944001,H082,H08.2 Transverse colectomy and anastomosis of ileum to colon
359584000,G539,G53.9 Unspecified other open operations on duodenum
310804003,G585,G58.5 Partial jejunectomy and anastomosis of duodenum to colon
60362005,H192,H19.2 Fixation of colon
81214004,Y083,Y08.3 Laser destruction of organ NOC
43519002,G641,G64.1 Endoscopic extirpation of lesion of jejunum
289060008,H401,H40.1 Trans-sphincteric excision of mucosa of rectum
699721006,Y751,Y75.1 Laparoscopically assisted approach to abdominal cavity
69538006,Y058,Y05.8 Other specified excision of organ NOC
6025007,H019,H01.9 Unspecified emergency excision of appendix
174197008,Z291,Z29.1 Rectum
703071008,Y534,Y53.4 Approach to organ under fluoroscopic control
449106004,H201,H20.1 Fibreoptic endoscopic snare resection of lesion of colon
445863004,Y971,Y97.1 Radiology with pre and post contrast
238298006,H412,H41.2 Peranal excision of lesion of rectum
192461000,Y408,Y40.8 Other specified dilation of organ NOC
174299003,H445,H44.5 Massage of rectum
447166008,H061,H06.1 Extended right hemicolectomy and end to end anastomosis
419773005,Y973,Y97.3 Radiology with post contrast
359584000,G533,G53.3 Open removal of foreign body from duodenum
33759004,Y252,Y25.2 Resuture of organ NOC
14690009,H134,H13.4 Bypass of colon by anastomosis of transverse colon to rectum
252674007,Y939,Y93.9 Unspecified gallium-67 imaging
84952009,H104,H10.4 Sigmoid colectomy and ileostomy HFQ
609279008,H112,H11.2 Colectomy and side to side anastomosis of ileum to colon NEC
307666008,H292,H29.2 Subtotal excision of colon and rectum and creation of colonic pouch NEC
51408001,H413,H41.3 Peranal destruction of lesion of rectum
446416000,Y509,Y50.9 Unspecified approach through abdominal cavity
235345009,H342,H34.2 Open cauterisation of lesion of rectum
10088002,Y717,Y71.7 Third or greater revisional operation NOC
397160002,H156,H15.6 Reduction of prolapse of colostomy
241674004,H241,H24.1 Endoscopic dilation of lower bowel using fibreoptic sigmoidoscope
431462009,Y971,Y97.1 Radiology with pre and post contrast
175557007,G756,G75.6 Resiting of ileostomy
174594009,J353,J35.3 Sphincterotomy of pancreatic duct using duodenal approach NEC
235264001,Y401,Y40.1 Dilation of stricture of organ NOC
307193005,H073,H07.3 Right hemicolectomy and anastomosis NEC
21795006,Z294,Z29.4 Colorectal
10371000132109,H261,H26.1 Endoscopic snare resection of lesion of sigmoid colon using rigid sigmoidoscope
173922003,G631,G63.1 Open biopsy of lesion of jejunum
314610005,H412,H41.2 Peranal excision of lesion of rectum
84952009,H118,H11.8 Other specified other excision of colon
32044008,H112,H11.2 Colectomy and side to side anastomosis of ileum to colon NEC
173972001,G738,G73.8 Other specified attention to connection of ileum
8773000,Y018,Y01.8 Other specified replacement of organ NOC
287993008,H171,H17.1 Open reduction of intussusception of colon
44061005,H288,H28.8 Other specified diagnostic endoscopic examination of sigmoid colon using rigid sigmoidoscope
174248005,H342,H34.2 Open cauterisation of lesion of rectum
449265009,Z287,Z28.7 Colon NEC
241337005,Y944,Y94.4 Diethylenetriamine pentacetic acid imaging
307261008,G784,G78.4 Closure of perforation of ileum
24420007,H281,H28.1 Diagnostic endoscopic examination of sigmoid colon and biopsy of lesion of sigmoid colon using rigid sigmoidoscope
274323008,H221,H22.1 Diagnostic fibreoptic endoscopic examination of colon and biopsy of lesion of colon
431462009,U215,U21.5 Contrast fluoroscopy NEC
446170008,H261,H26.1 Endoscopic snare resection of lesion of sigmoid colon using rigid sigmoidoscope
609279008,H118,H11.8 Other specified other excision of colon
235343002,H203,H20.3 Fibreoptic endoscopic laser destruction of lesion of colon
168843004,Y514,Y51.4 Approach to organ through colostomy
36984000,Y078,Y07.8 Other specified obliteration of cavity of organ NOC
12350003,H181,H18.1 Open colonoscopy
39166002,Y073,Y07.3 Obliteration of sinus track from organ NOC
235342007,H237,H23.7 Endoscopic mucosal resection of lesion of lower bowel using fibreoptic sigmoidoscope
5722009,H132,H13.2 Bypass of colon by anastomosis of caecum to sigmoid colon
1054002,J381,J38.1 Endoscopic sphincterotomy of sphincter of Oddi and removal of calculus HFQ
119887001,G789,G78.9 Unspecified other open operations on ileum
235303007,G592,G59.2 Open destruction of lesion of jejunum
418181007,Y971,Y97.1 Radiology with pre and post contrast
275017002,H418,H41.8 Other specified other operations on rectum through anus
446414002,H252,H25.2 Diagnostic endoscopic examination of lower bowel and sampling for bacterial overgrowth using fibreoptic sigmoidoscope
82730006,H024,H02.4 Incidental appendicectomy
107944001,H112,H11.2 Colectomy and side to side anastomosis of ileum to colon NEC
174121000,H139,H13.9 Unspecified bypass of colon
235149006,G792,G79.2 Endoscopic dilation of ileum
13327002,H099,H09.9 Unspecified excision of left hemicolon
446416000,G799,G79.9 Unspecified therapeutic endoscopic operations on ileum
174619006,J433,J43.3 Endoscopic retrograde cholangiopancreatography and collection of bile
235316007,Y515,Y51.5 Approach to organ through appendicostomy
431462009,Z287,Z28.7 Colon NEC
241335002,Y944,Y94.4 Diethylenetriamine pentacetic acid imaging
431334003,Y931,Y93.1 Gallium-67 imaging scan
27397009,G535,G53.5 Incision of duodenum NEC
54747001,H108,H10.8 Other specified excision of sigmoid colon
44119001,G712,G71.2 Bypass of ileum by anastomosis of ileum to ileum
6221005,H198,H19.8 Other specified other open operations on colon
63003009,H562,H56.2 Lateral sphincterotomy of anus
128401003,Y168,Y16.8 Other specified connection of organ NOC
359860002,H191,H19.1 Open biopsy of lesion of colon
307261008,G532,G53.2 Closure of perforation of duodenum NEC
13327002,H103,H10.3 Sigmoid colectomy and anastomosis NEC
708876004,H023,H02.3 Prophylactic appendicectomy NEC
235378002,Y284,Y28.4 Insertion of mesh into organ NOC
173928004,G641,G64.1 Endoscopic extirpation of lesion of jejunum
61218006,G701,G70.1 Excision of Meckel's diverticulum
241333009,Y944,Y94.4 Diethylenetriamine pentacetic acid imaging
45464004,Y066,Y06.6 Vacuum excision of lesion of organ NOC
44441009,H252,H25.2 Diagnostic endoscopic examination of lower bowel and sampling for bacterial overgrowth using fibreoptic sigmoidoscope
78133002,H205,H20.5 Fibreoptic endoscopic submucosal resection of lesion of colon
9280007,H412,H41.2 Peranal excision of lesion of rectum
9121000,H344,H34.4 Open laser destruction of lesion of rectum
41500002,Y973,Y97.3 Radiology with post contrast
450461000,H294,H29.4 Subtotal excision of colon and creation of colonic pouch NEC
128401003,G532,G53.2 Closure of perforation of duodenum NEC
235152003,G532,G53.2 Closure of perforation of duodenum NEC
359583006,Y515,Y51.5 Approach to organ through appendicostomy
397160002,H105,H10.5 Sigmoid colectomy and exteriorisation of bowel NEC
543008,J342,J34.2 Sphincteroplasty of bile duct using duodenal approach NEC
235399004,G768,G76.8 Other specified intra-abdominal manipulation of ileum
310804003,G584,G58.4 Partial jejunectomy and anastomosis of jejunum to ileum
431935008,Y973,Y97.3 Radiology with post contrast
73509004,H294,H29.4 Subtotal excision of colon and creation of colonic pouch NEC
18329001,Y204,Y20.4 Fine needle aspiration NOC
782838000,H355,H35.5 Anterior fixation of rectum using prosthetic material
1337002,H144,H14.4 Appendicocaecostomy
8180007,H213,H21.3 Fibreoptic endoscopic removal of foreign body from colon
241163009,Y973,Y97.3 Radiology with post contrast
446414002,H251,H25.1 Diagnostic endoscopic examination of lower bowel and biopsy of lesion of lower bowel using fibreoptic sigmoidoscope
28939002,H205,H20.5 Fibreoptic endoscopic submucosal resection of lesion of colon
49870005,H207,H20.7 Fibreoptic endoscopic mucosal resection of lesion of colon
307583008,H069,H06.9 Unspecified extended excision of right hemicolon
84952009,H081,H08.1 Transverse colectomy and end to end anastomosis
26390003,H059,H05.9 Unspecified total excision of colon
431935008,Y971,Y97.1 Radiology with pre and post contrast
116236007,H128,H12.8 Other specified extirpation of lesion of colon
168843004,Y971,Y97.1 Radiology with pre and post contrast
446228006,H091,H09.1 Left hemicolectomy and end to end anastomosis of colon to rectum
68791007,G809,G80.9 Unspecified diagnostic endoscopic examination of ileum
235307008,G719,G71.9 Unspecified bypass of ileum
66343001,G701,G70.1 Excision of Meckel's diverticulum
307586000,H088,H08.8 Other specified excision of transverse colon
310804003,G618,G61.8 Other specified bypass of jejunum
84530005,H461,H46.1 Radiological reduction of intussusception of rectum using barium enema
609279008,H086,H08.6 Transverse colectomy and end to side anastomosis
235171001,G589,G58.9 Unspecified excision of jejunum
445892000,H261,H26.1 Endoscopic snare resection of lesion of sigmoid colon using rigid sigmoidoscope
174191009,Z287,Z28.7 Colon NEC
44642007,H293,H29.3 Subtotal excision of colon and creation of colonic pouch and anastomosis of colon to rectum
235148003,G649,G64.9 Unspecified therapeutic endoscopic operations on jejunum
13004001,H265,H26.5 Endoscopic destruction of lesion of sigmoid colon using rigid sigmoidoscope NEC
265404007,H237,H23.7 Endoscopic mucosal resection of lesion of lower bowel using fibreoptic sigmoidoscope
5722009,Y714,Y71.4 Failed minimal access approach converted to open
50774009,H071,H07.1 Right hemicolectomy and end to end anastomosis of ileum to colon
84952009,H088,H08.8 Other specified excision of transverse colon
241335002,Y942,Y94.2 Octreotide imaging
22324003,G588,G58.8 Other specified excision of jejunum
6025007,H022,H02.2 Planned delayed appendicectomy NEC
14690009,H198,H19.8 Other specified other open operations on colon
235148003,G799,G79.9 Unspecified therapeutic endoscopic operations on ileum
444783004,H259,H25.9 Unspecified diagnostic endoscopic examination of lower bowel using fibreoptic sigmoidoscope
446222007,H098,H09.8 Other specified excision of left hemicolon
708627007,Y752,Y75.2 Laparoscopic approach to abdominal cavity NEC
773136004,H371,H37.1 Endoscopic mucosal resection of lesion of sigmoid colon using rigid sigmoidoscope
78133002,H371,H37.1 Endoscopic mucosal resection of lesion of sigmoid colon using rigid sigmoidoscope
241334003,Y938,Y93.8 Other specified gallium-67 imaging
73921006,H354,H35.4 Fixation of rectum using fascia lata
265407000,H267,H26.7 Endoscopic resection of lesion of sigmoid colon using rigid sigmoidoscope NEC
63003009,H563,H56.3 Incision of septum of anus
24420007,H258,H25.8 Other specified diagnostic endoscopic examination of lower bowel using fibreoptic sigmoidoscope
87279008,H235,H23.5 Endoscopic submucosal resection of lesion of lower bowel using fibreoptic sigmoidoscope
49870005,H231,H23.1 Endoscopic snare resection of lesion of lower bowel using fibreoptic sigmoidoscope
87594008,G762,G76.2 Open relief of strangulation of ileum
73509004,H292,H29.2 Subtotal excision of colon and rectum and creation of colonic pouch NEC
79433000,H198,H19.8 Other specified other open operations on colon
40826009,G809,G80.9 Unspecified diagnostic endoscopic examination of ileum
359571009,H078,H07.8 Other specified other excision of right hemicolon
10254002,Y069,Y06.9 Unspecified excision of lesion of organ NOC
78133002,H236,H23.6 Endoscopic resection of lesion of lower bowel using fibreoptic sigmoidoscope NEC
235148003,G793,G79.3 Endoscopic insertion of tubal prosthesis into ileum
235588000,J361,J36.1 Excision of ampulla of Vater using duodenal approach
609279008,H061,H06.1 Extended right hemicolectomy and end to end anastomosis
426585001,Y531,Y53.1 Approach to organ under radiological control
367436000,G748,G74.8 Other specified creation of artificial opening into ileum
307648003,H104,H10.4 Sigmoid colectomy and ileostomy HFQ
236205009,Z285,Z28.5 Descending colon
36984000,Y075,Y07.5 Occlusion of organ NOC
241166001,Y971,Y97.1 Radiology with pre and post contrast
16448009,H468,H46.8 Other specified other operations on rectum
32044008,H063,H06.3 Extended right hemicolectomy and anastomosis NEC
397160002,H158,H15.8 Other specified other exteriorisation of colon
43519002,G592,G59.2 Open destruction of lesion of jejunum
448156002,H336,H33.6 Anterior resection of rectum and exteriorisation of bowel
866199004,Z298,Z29.8 Specified part of bowel NEC
444688002,H358,H35.8 Other specified fixation of rectum for prolapse
107948003,H179,H17.9 Unspecified intra-abdominal manipulation of colon
174190005,Z291,Z29.1 Rectum
168836005,Y981,Y98.1 Radiology of one body area (or < 20 minutes)
449265009,U211,U21.1 Magnetic resonance imaging NEC
274031008,H412,H41.2 Peranal excision of lesion of rectum
41939004,G643,G64.3 Endoscopic insertion of tubal prosthesis into jejunum
426775000,Y532,Y53.2 Approach to organ under ultrasonic control
310804003,G612,G61.2 Bypass of jejunum by anastomosis of jejunum to ileum
44441009,H238,H23.8 Other specified endoscopic extirpation of lesion of lower bowel using fibreoptic sigmoidoscope
446886003,G808,G80.8 Other specified diagnostic endoscopic examination of ileum
54747001,H098,H09.8 Other specified excision of left hemicolon
235344008,H232,H23.2 Endoscopic cauterisation of lesion of lower bowel using fibreoptic sigmoidoscope
361152000,H151,H15.1 Loop colostomy
449194009,H235,H23.5 Endoscopic submucosal resection of lesion of lower bowel using fibreoptic sigmoidoscope
609279008,H069,H06.9 Unspecified extended excision of right hemicolon
310804003,G619,G61.9 Unspecified bypass of jejunum
419344005,Z277,Z27.7 Small intestine
431470004,Y534,Y53.4 Approach to organ under fluoroscopic control
446746001,G423,G42.3 Fibreoptic endoscopic mucosal resection of lesion of upper gastrointestinal tract
287806006,P134,P13.4 Closure of fistula of female perineum
265402006,H205,H20.5 Fibreoptic endoscopic submucosal resection of lesion of colon
173930002,G643,G64.3 Endoscopic insertion of tubal prosthesis into jejunum
9895003,H123,H12.3 Destruction of lesion of colon NEC
32044008,H062,H06.2 Extended right hemicolectomy and anastomosis of ileum to colon
41939004,Y519,Y51.9 Unspecified approach to organ through artificial opening into gastrointestinal tract
39166002,G538,G53.8 Other specified other open operations on duodenum
426585001,Y537,Y53.7 Approach to organ under magnetic resonance imaging control
446416000,Y502,Y50.2 Laparotomy approach NEC
265404007,H239,H23.9 Unspecified endoscopic extirpation of lesion of lower bowel using fibreoptic sigmoidoscope
708920006,H334,H33.4 Anterior resection of rectum and anastomosis NEC
9215005,H169,H16.9 Unspecified incision of colon
63003009,H561,H56.1 Biopsy of lesion of anus
26390003,H051,H05.1 Total colectomy and anastomosis of ileum to rectum
307511000,G521,G52.1 Closure of perforated ulcer of duodenum
56283009,G688,G68.8 Other specified transplantation of ileum
236783000,G713,G71.3 Bypass of ileum by anastomosis of ileum to caecum
5722009,H138,H13.8 Other specified bypass of colon
28939002,H261,H26.1 Endoscopic snare resection of lesion of sigmoid colon using rigid sigmoidoscope
