conceptId,idAndFsnTerm
21596009,21596009 | Repair of uveal hernia (procedure) |
21593001,21593001 | Ophthalmodynamography (procedure) |
21491001,21491001 | Removal of foreign body of ciliary body without use of magnet (procedure) |
21123000,21123000 | Iridosclerectomy (procedure) |
20975004,20975004 | Tattooing of cornea (procedure) |
20647004,20647004 | Removal of foreign body from vitreous without use of magnet (procedure) |
20466006,20466006 | Excision of pterygium with graft (procedure) |
20452001,20452001 | Reattachment of choroid and retina (procedure) |
20403000,20403000 | Iridocyclectomy (procedure) |
20397006,20397006 | Chemical tattooing of cornea (procedure) |
20067007,20067007 | Ocular fundus photography (procedure) |
20019002,20019002 | Rolling of conjunctiva (procedure) |
19875009,19875009 | Diagnostic aspiration of vitreous (procedure) |
19740002,19740002 | Extracapsular extraction of lens by inferior temporal route (procedure) |
19731001,19731001 | Ultrasound study of eye (procedure) |
19320007,19320007 | Nonexcisional destruction of lesion of ciliary body (procedure) |
19208002,19208002 | Extraction of secondary membrane by discission (procedure) |
18752000,18752000 | Magnet extraction of intraocular foreign body from anterior chamber of eye (procedure) |
18551005,18551005 | Incision of conjunctiva with drainage of cyst (procedure) |
18476009,18476009 | Intracapsular extraction of lens with iridectomy and enzymes (procedure) |
18405007,"18405007 | Iridectomy with corneal section, optical (procedure) |"
18274005,18274005 | Reopening of iris in anterior chamber of eye (procedure) |
18188000,18188000 | Ophthalmoscopy under general anesthesia (procedure) |
18137003,18137003 | Extracapsular extraction of lens by aspiration and irrigation technique (procedure) |
17868003,17868003 | Incisional discission of anterior hyaloid (procedure) |
17632005,17632005 | Division of vitreous cicatricial bands by anterior approach (procedure) |
17606004,17606004 | Sclerectomy (procedure) |
17348004,17348004 | Operative procedure on posterior segment of eye (procedure) |
17179006,17179006 | Refractive keratoplasty (procedure) |
16658002,16658002 | Repair of retina for retinal tear or defect by cryotherapy (procedure) |
16511003,16511003 | Donor keratectomy (procedure) |
15915007,15915007 | Destruction of lesion of retina by laser photocoagulation (procedure) |
15912005,15912005 | Destruction of lesion of conjunctiva (procedure) |
15366008,15366008 | Ciliectomy of ciliary body (procedure) |
15090003,15090003 | Reattachment of choroid and retina by photocoagulation (procedure) |
14881004,14881004 | Tonography with provocative tests (procedure) |
14727005,14727005 | Closure of filtering bleb (procedure) |
14707009,14707009 | Lamellar resection of sclera for retinal reattachment (procedure) |
14480008,14480008 | Incision of tarsal gland (procedure) |
14400005,14400005 | Lysis of adhesions of vitreous by anterior approach (procedure) |
13955006,13955006 | Operation on posterior chamber of eye (procedure) |
13927007,13927007 | Posterior sclerotomy with iridectomy (procedure) |
13793006,13793006 | Extracapsular extraction of lens (procedure) |
13767004,13767004 | Removal of foreign body from choroid without use of magnet (procedure) |
13346001,13346001 | Operative procedure on anterior chamber of eye (procedure) |
13303004,13303004 | Posterior sclerotomy (procedure) |
13097002,13097002 | Constriction of globe for scleral buckling (procedure) |
12868007,12868007 | Revision of operative wound of anterior segment of eye (procedure) |
12651006,12651006 | Sclerectomy for retinal reattachment (procedure) |
12163000,12163000 | Needling of secondary cataract (procedure) |
12113005,12113005 | Scleral buckling with vitrectomy (procedure) |
11912002,11912002 | Scraping of trachoma follicles (procedure) |
11895000,11895000 | Tracer study of eye (procedure) |
11819005,11819005 | Ocular thermography (procedure) |
10831003,10831003 | Direct closure of laceration of conjunctiva with nonperforating scleral laceration (procedure) |
10807008,10807008 | Scleral reinforcement with graft (procedure) |
10529001,10529001 | Repair of filtering bleb by suture with conjunctival flap (procedure) |
10178000,10178000 | Extracapsular extraction of cataract by inferior temporal route (procedure) |
10006000,10006000 | Repair of retinal detachment with xenon arc photocoagulation (procedure) |
9812004,9812004 | Injection of lens (procedure) |
9754005,9754005 | Repair of laceration of sclera with synchronous repair of conjunctiva (procedure) |
9722001,9722001 | Removal of implanted material from anterior segment of eye (procedure) |
9555008,9555008 | Incision of chalazion (procedure) |
9255007,9255007 | Removal of foreign body from anterior chamber of eye without use of magnet (procedure) |
9137006,"9137006 | Discission of membranous cataract, secondary (procedure) |"
8920006,8920006 | Repair of retina for retinal detachment (procedure) |
8891002,8891002 | Partial removal of vitreous by anterior approach (procedure) |
8813000,8813000 | Removal of intraocular foreign body from anterior segment of eye with use of magnet (procedure) |
8803008,8803008 | Iridosclerotomy (procedure) |
8693001,8693001 | Radionuclide identification of eye tumor (procedure) |
8561003,8561003 | Destruction of epithelial downgrowth of anterior chamber of eye (procedure) |
8255002,8255002 | Repair of filtering bleb by suture (procedure) |
7898005,7898005 | Destruction of lesion of retina by cryotherapy (procedure) |
7798001,7798001 | Conjunctivoplasty with conjunctival graft (procedure) |
7663009,7663009 | Repair of injury of eyeball (procedure) |
7553005,7553005 | Excisional biopsy of eye (procedure) |
7268007,7268007 | Injection of vitreous substitute (procedure) |
6889000,6889000 | Shortening of sclera by scleral buckling (procedure) |
6615001,6615001 | Electroretinography (procedure) |
6486000,6486000 | Curettage of sclera (procedure) |
6438007,6438007 | Exploration of ciliary body (procedure) |
6307005,6307005 | Keratophakia (procedure) |
6005008,6005008 | Transplantation of vitreous by anterior approach (procedure) |
5961007,5961007 | Division of blood vessels of cornea (procedure) |
5671007,5671007 | Magnet extraction of foreign body from ciliary body (procedure) |
5130002,5130002 | Extraction of primary membranous cataract by discission (procedure) |
4877004,4877004 | Extracapsular extraction of lens with iridectomy (procedure) |
4593001,4593001 | Cauterization of sclera with iridectomy (procedure) |
4581005,4581005 | Coreoplasty (procedure) |
4516005,4516005 | Iridencleisis and iridotasis (procedure) |
4503005,4503005 | Removal of foreign body of sclera without use of magnet (procedure) |
4350002,4350002 | Removal of implant of cornea (procedure) |
4344007,4344007 | Cryopexy (procedure) |
4323007,4323007 | Destruction of lesion of sclera (procedure) |
4143006,4143006 | Injection of anterior chamber of eye (procedure) |
3938007,3938007 | Cerclage for retinal reattachment (procedure) |
3700004,3700004 | Erysiphake extraction of cataract by intracapsular approach (procedure) |
3664004,3664004 | Closure of scleral fistula (procedure) |
3605001,3605001 | Reduction of ciliary body (procedure) |
3499006,3499006 | Aspiration of vitreous with replacement (procedure) |
3249005,3249005 | Surgical construction of filtration bleb (procedure) |
3047001,3047001 | Kowa fundus photography (procedure) |
2914003,2914003 | Anterior sclerotomy (procedure) |
2536007,2536007 | Injection of medication in anterior chamber of eye (procedure) |
1753001,1753001 | Resection of uveal tissue (procedure) |
1746005,1746005 | Scleral buckling with implant (procedure) |
1683003,1683003 | Direct closure of laceration of conjunctiva (procedure) |
1413003,1413003 | Penetrating keratoplasty with homograft (procedure) |
1019009,1019009 | Removal of corneal epithelium (procedure) |
881009,881009 | Cyclodialysis (procedure) |
295001,295001 | Nonexcisional destruction of cyst of ciliary body (procedure) |
