snomed,opcs,opcs_term
54747001,H074,H07.4 Right hemicolectomy and ileostomy HFQ
241336001,Y943,Y94.3 Metaiodobenzylguanidine imaging
715914001,Y022,Y02.2 Insertion of prosthesis into organ NOC
235364003,H333,H33.3 Anterior resection of rectum and anastomosis of colon to rectum using staples
431470004,H148,H14.8 Other specified exteriorisation of caecum
443908009,H337,H33.7 Perineal resection of rectum HFQ
445938000,Z274,Z27.4 Duodenum
241162004,Y973,Y97.3 Radiology with post contrast
708627007,G694,G69.4 Ileectomy and anastomosis of ileum to colon
85815002,Y973,Y97.3 Radiology with post contrast
281413005,G538,G53.8 Other specified other open operations on duodenum
367436000,G749,G74.9 Unspecified creation of artificial opening into ileum
87594008,H175,H17.5 Open relief of strangulation of colon
4558008,H333,H33.3 Anterior resection of rectum and anastomosis of colon to rectum using staples
128401003,G539,G53.9 Unspecified other open operations on duodenum
235302002,G641,G64.1 Endoscopic extirpation of lesion of jejunum
274382000,G809,G80.9 Unspecified diagnostic endoscopic examination of ileum
174594009,J352,J35.2 Sphincterotomy of bile duct using duodenal approach NEC
235152003,Y259,Y25.9 Unspecified suture of organ NOC
386196007,H343,H34.3 Open cryotherapy to lesion of rectum
1801001,G451,G45.1 Fibreoptic endoscopic examination of upper gastrointestinal tract and biopsy of lesion of upper gastrointestinal tract
40826009,G808,G80.8 Other specified diagnostic endoscopic examination of ileum
50774009,H062,H06.2 Extended right hemicolectomy and anastomosis of ileum to colon
1645004,J359,J35.9 Unspecified incision of sphincter of Oddi using duodenal approach
235581006,J341,J34.1 Sphincteroplasty of bile duct and pancreatic duct using duodenal approach
307583008,H063,H06.3 Extended right hemicolectomy and anastomosis NEC
445954002,Y971,Y97.1 Radiology with pre and post contrast
307584002,H193,H19.3 Enterorrhaphy of colon
419344005,Y971,Y97.1 Radiology with pre and post contrast
43750003,Y069,Y06.9 Unspecified excision of lesion of organ NOC
21423008,H258,H25.8 Other specified diagnostic endoscopic examination of lower bowel using fibreoptic sigmoidoscope
241337005,Y939,Y93.9 Unspecified gallium-67 imaging
433246009,Y943,Y94.3 Metaiodobenzylguanidine imaging
274031008,H349,H34.9 Unspecified open extirpation of lesion of rectum
44441009,H235,H23.5 Endoscopic submucosal resection of lesion of lower bowel using fibreoptic sigmoidoscope
29205000,H421,H42.1 Insertion of encircling suture around perianal sphincter
174602009,J361,J36.1 Excision of ampulla of Vater using duodenal approach
84952009,H089,H08.9 Unspecified excision of transverse colon
33179004,Y255,Y25.5 Other attention to suture of organ NOC
17041004,Y309,Y30.9 Unspecified incision of organ NOC
235591000,Y082,Y08.2 Laser excision of lesion of organ NOC
14771009,H413,H41.3 Peranal destruction of lesion of rectum
307241002,H271,H27.1 Endoscopic dilation of sigmoid colon using rigid sigmoidoscope
430798009,H415,H41.5 Peranal resection of rectum using staples
708913004,H331,H33.1 Abdominoperineal excision of rectum and end colostomy
32325005,G783,G78.3 Removal of foreign body from ileum
235152003,G523,G52.3 Oversew of blood vessel of duodenal ulcer
17671008,H159,H15.9 Unspecified other exteriorisation of colon
175557007,G755,G75.5 Reduction of prolapse of ileostomy
235341000,H348,H34.8 Other specified open extirpation of lesion of rectum
41939004,Y518,Y51.8 Other specified approach to organ through artificial opening into gastrointestinal tract
418210005,Y973,Y97.3 Radiology with post contrast
63003009,H443,H44.3 Manual evacuation of impacted faeces from rectum
13327002,H113,H11.3 Colectomy and anastomosis NEC
398243002,P231,P23.1 Anterior and posterior colporrhaphy NEC
275230005,G522,G52.2 Suture of ulcer of duodenum NEC
68791007,G801,G80.1 Diagnostic endoscopic examination of ileum and biopsy of lesion of ileum
90788004,H153,H15.3 Refashioning of colostomy
235171001,G618,G61.8 Other specified bypass of jejunum
235346005,H233,H23.3 Endoscopic laser destruction of lesion of lower bowel using fibreoptic sigmoidoscope
37412006,H135,H13.5 Bypass of colon by anastomosis of colon to rectum NEC
56078005,Y063,Y06.3 Enucleation of lesion of organ NOC
307558008,G648,G64.8 Other specified therapeutic endoscopic operations on jejunum
361173000,H232,H23.2 Endoscopic cauterisation of lesion of lower bowel using fibreoptic sigmoidoscope
359539002,G781,G78.1 Open biopsy of lesion of ileum
107938000,G699,G69.9 Unspecified excision of ileum
33759004,Y258,Y25.8 Other specified suture of organ NOC
609279008,Y763,Y76.3 Endoscopic approach to other body cavity
36508007,G541,G54.1 Endoscopic extirpation of lesion of duodenum
265402006,H203,H20.3 Fibreoptic endoscopic laser destruction of lesion of colon
359594005,G532,G53.2 Closure of perforation of duodenum NEC
359583006,G641,G64.1 Endoscopic extirpation of lesion of jejunum
60775008,H418,H41.8 Other specified other operations on rectum through anus
78133002,H201,H20.1 Fibreoptic endoscopic snare resection of lesion of colon
708645007,G522,G52.2 Suture of ulcer of duodenum NEC
241674004,H242,H24.2 Endoscopic coagulation of blood vessel of lower bowel using fibreoptic sigmoidoscope
169006009,Y983,Y98.3 Radiology of three body areas (or 20-40 minutes)
715914001,H198,H19.8 Other specified other open operations on colon
73759005,G492,G49.2 Total excision of duodenum
359583006,G658,G65.8 Other specified diagnostic endoscopic examination of jejunum
299693003,G673,G67.3 Passage of Crosby capsule into jejunum for biopsy of mucosa of jejunum
235299002,G641,G64.1 Endoscopic extirpation of lesion of jejunum
45464004,J361,J36.1 Excision of ampulla of Vater using duodenal approach
431935008,Y981,Y98.1 Radiology of one body area (or < 20 minutes)
359591002,Y251,Y25.1 Suture of laceration of organ NOC
12749000,Y538,Y53.8 Other specified approach to organ under image control
446362009,H212,H21.2 Fibreoptic endoscopic coagulation of blood vessel of colon
235348006,H208,H20.8 Other specified endoscopic extirpation of lesion of colon
307193005,G694,G69.4 Ileectomy and anastomosis of ileum to colon
174198003,Z286,Z28.6 Sigmoid colon
42624001,G536,G53.6 Correction of malrotation of duodenum
307586000,H089,H08.9 Unspecified excision of transverse colon
446415001,Y501,Y50.1 Transperitoneal approach to spine
448360009,H232,H23.2 Endoscopic cauterisation of lesion of lower bowel using fibreoptic sigmoidoscope
128401003,G534,G53.4 Open insertion of tubal prosthesis into duodenum
235147008,G809,G80.9 Unspecified diagnostic endoscopic examination of ileum
447979003,Y171,Y17.1 Electrocauterisation of lesion of organ NOC
241477001,U216,U21.6 Ultrasound scan NEC
446414002,H281,H28.1 Diagnostic endoscopic examination of sigmoid colon and biopsy of lesion of sigmoid colon using rigid sigmoidoscope
39166002,Y074,Y07.4 Obliteration of diverticulum of organ NOC
449106004,H266,H26.6 Endoscopic submucosal resection of lesion of sigmoid colon using rigid sigmoidoscope
42624001,G532,G53.2 Closure of perforation of duodenum NEC
303582002,H123,H12.3 Destruction of lesion of colon NEC
9280007,H414,H41.4 Peranal mucosal proctectomy and endoanal anastomosis
609282003,H248,H24.8 Other specified other therapeutic endoscopic operations on lower bowel using fibreoptic sigmoidoscope
235378002,Y282,Y28.2 Insertion of biological mesh into organ NOC
17041004,H032,H03.2 Drainage of appendix NEC
13004001,H278,H27.8 Other specified other therapeutic endoscopic operations on sigmoid colon using rigid sigmoidoscope
431334003,Y944,Y94.4 Diethylenetriamine pentacetic acid imaging
307666008,H294,H29.4 Subtotal excision of colon and creation of colonic pouch NEC
715313002,Y534,Y53.4 Approach to organ under fluoroscopic control
715275000,Y534,Y53.4 Approach to organ under fluoroscopic control
235344008,H204,H20.4 Fibreoptic endoscopic destruction of lesion of colon NEC
361152000,Y711,Y71.1 Subsequent stage of staged operations NOC
84952009,H074,H07.4 Right hemicolectomy and ileostomy HFQ
241166001,Z298,Z29.8 Specified part of bowel NEC
265455000,J433,J43.3 Endoscopic retrograde cholangiopancreatography and collection of bile
235325001,H098,H09.8 Other specified excision of left hemicolon
361152000,Y713,Y71.3 Revisional operations NOC
426585001,Y533,Y53.3 Approach to organ under computed tomography scan control
446222007,H092,H09.2 Left hemicolectomy and end to end anastomosis of colon to colon
14690009,H133,H13.3 Bypass of colon by anastomosis of transverse colon to sigmoid colon
235593002,J362,J36.2 Biopsy of lesion of ampulla of Vater using duodenal approach
174322004,H413,H41.3 Peranal destruction of lesion of rectum
235151005,H189,H18.9 Unspecified open endoscopic operations on colon
36984000,G782,G78.2 Strictureplasty of ileum
446414002,H289,H28.9 Unspecified diagnostic endoscopic examination of sigmoid colon using rigid sigmoidoscope
235340004,H201,H20.1 Fibreoptic endoscopic snare resection of lesion of colon
168900006,Y973,Y97.3 Radiology with post contrast
1186912002,H151,H15.1 Loop colostomy
116240003,J362,J36.2 Biopsy of lesion of ampulla of Vater using duodenal approach
73509004,H152,H15.2 End colostomy
54747001,H095,H09.5 Left hemicolectomy and exteriorisation of bowel NEC
711356000,G572,G57.2 Intubation of duodenum NEC
446170008,H235,H23.5 Endoscopic submucosal resection of lesion of lower bowel using fibreoptic sigmoidoscope
54747001,H111,H11.1 Colectomy and end to end anastomosis of colon to colon NEC
444688002,H352,H35.2 Posterior fixation of rectum using prosthetic material
39166002,Y071,Y07.1 Ligation of organ NOC
43750003,G435,G43.5 Fibreoptic endoscopic destruction of lesion of upper gastrointestinal tract NEC
235147008,G649,G64.9 Unspecified therapeutic endoscopic operations on jejunum
71367006,Y205,Y20.5 Percutaneous biopsy NOC
386196007,H345,H34.5 Open destruction of lesion of rectum NEC
23968004,H115,H11.5 Colectomy and exteriorisation of bowel NEC
2743004,G793,G79.3 Endoscopic insertion of tubal prosthesis into ileum
49870005,H263,H26.3 Endoscopic laser destruction of lesion of sigmoid colon using rigid sigmoidoscope
419773005,U173,U17.3 Barium swallow
9215005,H161,H16.1 Drainage of colon
16442821000119108,U215,U21.5 Contrast fluoroscopy NEC
13893002,Y073,Y07.3 Obliteration of sinus track from organ NOC
44642007,H157,H15.7 Percutaneous endoscopic sigmoid colostomy
307583008,H079,H07.9 Unspecified other excision of right hemicolon
85849005,H158,H15.8 Other specified other exteriorisation of colon
75157003,H403,H40.3 Trans-sphincteric destruction of lesion of rectum
32044008,H089,H08.9 Unspecified excision of transverse colon
398801000,H152,H15.2 End colostomy
235342007,H239,H23.9 Unspecified endoscopic extirpation of lesion of lower bowel using fibreoptic sigmoidoscope
36984000,G786,G78.6 Open intubation of ileum
47705001,H468,H46.8 Other specified other operations on rectum
56078005,Y065,Y06.5 Gamma wave excision of lesion of organ NOC
50250005,Y131,Y13.1 Cauterisation of lesion of organ NOC
24420007,H288,H28.8 Other specified diagnostic endoscopic examination of sigmoid colon using rigid sigmoidoscope
75108001,H468,H46.8 Other specified other operations on rectum
68671008,H411,H41.1 Rectosigmoidectomy and peranal anastomosis
609279008,H098,H09.8 Other specified excision of left hemicolon
8180007,H202,H20.2 Fibreoptic endoscopic cauterisation of lesion of colon
235152003,Y253,Y25.3 Removal of retained suture from organ NOC
447977001,H202,H20.2 Fibreoptic endoscopic cauterisation of lesion of colon
84952009,H091,H09.1 Left hemicolectomy and end to end anastomosis of colon to rectum
398801000,H158,H15.8 Other specified other exteriorisation of colon
84952009,H099,H09.9 Unspecified excision of left hemicolon
173923008,G633,G63.3 Closure of perforation of jejunum
46295004,H337,H33.7 Perineal resection of rectum HFQ
68671008,H418,H41.8 Other specified other operations on rectum through anus
173902002,G591,G59.1 Excision of lesion of jejunum
80146002,H029,H02.9 Unspecified other excision of appendix
235589008,J439,J43.9 Unspecified diagnostic endoscopic retrograde examination of bile duct and pancreatic duct
8324006,Y229,Y22.9 Unspecified drainage of organ NOC
6190006,H192,H19.2 Fixation of colon
770699008,Y534,Y53.4 Approach to organ under fluoroscopic control
235147008,G792,G79.2 Endoscopic dilation of ileum
307193005,G693,G69.3 Ileectomy and anastomosis of ileum to ileum
235589008,J398,J39.8 Other specified other therapeutic endoscopic operations on ampulla of Vater
23478009,G764,G76.4 Plication of ileum
107944001,H088,H08.8 Other specified excision of transverse colon
782836001,Y281,Y28.1 Insertion of synthetic mesh into organ NOC
173950003,G694,G69.4 Ileectomy and anastomosis of ileum to colon
10254002,G702,G70.2 Excision of lesion of ileum NEC
68065001,G601,G60.1 Creation of jejunostomy
60892005,G584,G58.4 Partial jejunectomy and anastomosis of jejunum to ileum
398135004,H149,H14.9 Unspecified exteriorisation of caecum
169009002,Y971,Y97.1 Radiology with pre and post contrast
418181007,Y981,Y98.1 Radiology of one body area (or < 20 minutes)
83226002,G549,G54.9 Unspecified therapeutic endoscopic operations on duodenum
419595006,Y973,Y97.3 Radiology with post contrast
341729004,H178,H17.8 Other specified intra-abdominal manipulation of colon
34264006,H181,H18.1 Open colonoscopy
304587000,Y711,Y71.1 Subsequent stage of staged operations NOC
168847003,Y971,Y97.1 Radiology with pre and post contrast
174594009,J351,J35.1 Sphincterotomy of bile duct and pancreatic duct using duodenal approach
235151005,H181,H18.1 Open colonoscopy
307241002,H211,H21.1 Fibreoptic endoscopic dilation of colon
74373008,G789,G78.9 Unspecified other open operations on ileum
4862007,Y717,Y71.7 Third or greater revisional operation NOC
241334003,Y944,Y94.4 Diethylenetriamine pentacetic acid imaging
384091000119108,Y973,Y97.3 Radiology with post contrast
44061005,Y519,Y51.9 Unspecified approach to organ through artificial opening into gastrointestinal tract
75905004,H102,H10.2 Sigmoid colectomy and anastomosis of colon to rectum
359584000,G531,G53.1 Open biopsy of lesion of duodenum
426585001,Y536,Y53.6 Approach to organ under video control
174171002,H201,H20.1 Fibreoptic endoscopic snare resection of lesion of colon
235346005,H263,H26.3 Endoscopic laser destruction of lesion of sigmoid colon using rigid sigmoidoscope
22094003,Y301,Y30.1 Incision of lesion of organ NOC
73921006,H351,H35.1 Anterior fixation of rectum
192461000,J398,J39.8 Other specified other therapeutic endoscopic operations on ampulla of Vater
13327002,H114,H11.4 Colectomy and ileostomy NEC
46569000,H338,H33.8 Other specified excision of rectum
128401003,G538,G53.8 Other specified other open operations on duodenum
386196007,H123,H12.3 Destruction of lesion of colon NEC
25196007,Y702,Y70.2 Immediate operations NOC
49870005,H371,H37.1 Endoscopic mucosal resection of lesion of sigmoid colon using rigid sigmoidoscope
21795006,Y219,Y21.9 Unspecified cytology of organ NOC
91679005,G638,G63.8 Other specified other open operations on jejunum
236205009,Z287,Z28.7 Colon NEC
27010001,H299,H29.9 Unspecified subtotal excision of colon
169006009,Y973,Y97.3 Radiology with post contrast
53003006,H118,H11.8 Other specified other excision of colon
235356009,H215,H21.5 Fibreoptic endoscopic decompression of colon
6726004,H031,H03.1 Drainage of abscess of appendix
235365002,H411,H41.1 Rectosigmoidectomy and peranal anastomosis
1299000,Y053,Y05.3 Excision of sinus track from organ NOC
241674004,H233,H23.3 Endoscopic laser destruction of lesion of lower bowel using fibreoptic sigmoidoscope
1337002,H157,H15.7 Percutaneous endoscopic sigmoid colostomy
36984000,Y072,Y07.2 Clipping of organ NOC
307368004,G788,G78.8 Other specified other open operations on ileum
6221005,H193,H19.3 Enterorrhaphy of colon
441538004,Y973,Y97.3 Radiology with post contrast
50012009,H192,H19.2 Fixation of colon
43750003,G541,G54.1 Endoscopic extirpation of lesion of duodenum
235313004,H023,H02.3 Prophylactic appendicectomy NEC
169006009,Z277,Z27.7 Small intestine
34414001,Y309,Y30.9 Unspecified incision of organ NOC
44119001,G693,G69.3 Ileectomy and anastomosis of ileum to ileum
62539002,H171,H17.1 Open reduction of intussusception of colon
265402006,H207,H20.7 Fibreoptic endoscopic mucosal resection of lesion of colon
84952009,H103,H10.3 Sigmoid colectomy and anastomosis NEC
54747001,H078,H07.8 Other specified other excision of right hemicolon
771556003,Y971,Y97.1 Radiology with pre and post contrast
361152000,H156,H15.6 Reduction of prolapse of colostomy
361152000,H141,H14.1 Tube caecostomy
287993008,H172,H17.2 Open reduction of volvulus of caecum
235338009,H211,H21.1 Fibreoptic endoscopic dilation of colon
33759004,H193,H19.3 Enterorrhaphy of colon
32044008,H082,H08.2 Transverse colectomy and anastomosis of ileum to colon
85815002,Z274,Z27.4 Duodenum
359591002,G532,G53.2 Closure of perforation of duodenum NEC
235261009,G551,G55.1 Diagnostic endoscopic examination of duodenum and biopsy of lesion of duodenum
450353006,H418,H41.8 Other specified other operations on rectum through anus
609279008,H068,H06.8 Other specified extended excision of right hemicolon
301698008,H261,H26.1 Endoscopic snare resection of lesion of sigmoid colon using rigid sigmoidoscope
10590008,H413,H41.3 Peranal destruction of lesion of rectum
235270007,Z274,Z27.4 Duodenum
49870005,H234,H23.4 Endoscopic destruction of lesion of lower bowel using fibreoptic sigmoidoscope NEC
307666008,H293,H29.3 Subtotal excision of colon and creation of colonic pouch and anastomosis of colon to rectum
173903007,G591,G59.1 Excision of lesion of jejunum
41939004,Y515,Y51.5 Approach to organ through appendicostomy
782837005,H355,H35.5 Anterior fixation of rectum using prosthetic material
274324002,H281,H28.1 Diagnostic endoscopic examination of sigmoid colon and biopsy of lesion of sigmoid colon using rigid sigmoidoscope
361173000,H403,H40.3 Trans-sphincteric destruction of lesion of rectum
112872005,H192,H19.2 Fixation of colon
191532000,Y409,Y40.9 Unspecified dilation of organ NOC
8773000,Y015,Y01.5 Alloreplacement of organ from cadaver heart non-beating NOC
359571009,H071,H07.1 Right hemicolectomy and end to end anastomosis of ileum to colon
53402007,G808,G80.8 Other specified diagnostic endoscopic examination of ileum
76164006,H281,H28.1 Diagnostic endoscopic examination of sigmoid colon and biopsy of lesion of sigmoid colon using rigid sigmoidoscope
708876004,H012,H01.2 Emergency excision of abnormal appendix NEC
81214004,H413,H41.3 Peranal destruction of lesion of rectum
341729004,H173,H17.3 Open reduction of volvulus of sigmoid colon
60775008,H414,H41.4 Peranal mucosal proctectomy and endoanal anastomosis
307666008,H298,H29.8 Other specified subtotal excision of colon
265402006,H208,H20.8 Other specified endoscopic extirpation of lesion of colon
46295004,H334,H33.4 Anterior resection of rectum and anastomosis NEC
88354009,G632,G63.2 Incision of jejunum
174173004,H203,H20.3 Fibreoptic endoscopic laser destruction of lesion of colon
235333000,H335,H33.5 Rectosigmoidectomy and closure of rectal stump and exteriorisation of bowel
235589008,J368,J36.8 Other specified other operations on ampulla of Vater using duodenal approach
89311007,G651,G65.1 Diagnostic endoscopic examination of jejunum and biopsy of lesion of jejunum
287784004,H342,H34.2 Open cauterisation of lesion of rectum
708631001,H334,H33.4 Anterior resection of rectum and anastomosis NEC
866199004,Y981,Y98.1 Radiology of one body area (or < 20 minutes)
235153008,H265,H26.5 Endoscopic destruction of lesion of sigmoid colon using rigid sigmoidoscope NEC
41939004,G641,G64.1 Endoscopic extirpation of lesion of jejunum
397160002,H152,H15.2 End colostomy
275011001,H355,H35.5 Anterior fixation of rectum using prosthetic material
716694009,Y971,Y97.1 Radiology with pre and post contrast
72811008,Z286,Z28.6 Sigmoid colon
10590008,H202,H20.2 Fibreoptic endoscopic cauterisation of lesion of colon
37402004,H031,H03.1 Drainage of abscess of appendix
173902002,G598,G59.8 Other specified extirpation of lesion of jejunum
429820004,Y971,Y97.1 Radiology with pre and post contrast
708631001,Y751,Y75.1 Laparoscopically assisted approach to abdominal cavity
341729004,G761,G76.1 Open reduction of intussusception of ileum
173911002,G619,G61.9 Unspecified bypass of jejunum
235153008,H278,H27.8 Other specified other therapeutic endoscopic operations on sigmoid colon using rigid sigmoidoscope
341729004,G762,G76.2 Open relief of strangulation of ileum
173947001,G691,G69.1 Ileectomy and anastomosis of stomach to ileum
446228006,H095,H09.5 Left hemicolectomy and exteriorisation of bowel NEC
49870005,H205,H20.5 Fibreoptic endoscopic submucosal resection of lesion of colon
359583006,G651,G65.1 Diagnostic endoscopic examination of jejunum and biopsy of lesion of jejunum
39166002,Y079,Y07.9 Unspecified obliteration of cavity of organ NOC
9280007,H418,H41.8 Other specified other operations on rectum through anus
708627007,G692,G69.2 Ileectomy and anastomosis of duodenum to ileum
174250002,H344,H34.4 Open laser destruction of lesion of rectum
49870005,H261,H26.1 Endoscopic snare resection of lesion of sigmoid colon using rigid sigmoidoscope
174190005,Z287,Z28.7 Colon NEC
33179004,Y251,Y25.1 Suture of laceration of organ NOC
63003009,H448,H44.8 Other specified manipulation of rectum
445891007,G784,G78.4 Closure of perforation of ileum
23968004,H113,H11.3 Colectomy and anastomosis NEC
446228006,H098,H09.8 Other specified excision of left hemicolon
54747001,H119,H11.9 Unspecified other excision of colon
419595006,Y983,Y98.3 Radiology of three body areas (or 20-40 minutes)
271489009,G621,G62.1 Open jejunoscopy
27397009,G549,G54.9 Unspecified therapeutic endoscopic operations on duodenum
1645004,J382,J38.2 Endoscopic sphincterotomy of sphincter of Oddi and insertion of tubal prosthesis into bile duct
76164006,H191,H19.1 Open biopsy of lesion of colon
54357003,G694,G69.4 Ileectomy and anastomosis of ileum to colon
708631001,H333,H33.3 Anterior resection of rectum and anastomosis of colon to rectum using staples
431935008,U174,U17.4 Barium enema
287784004,H049,H04.9 Unspecified total excision of colon and rectum
107938000,G691,G69.1 Ileectomy and anastomosis of stomach to ileum
418181007,Z287,Z28.7 Colon NEC
287806006,N248,N24.8 Other specified operations on male perineum
87279008,H267,H26.7 Endoscopic resection of lesion of sigmoid colon using rigid sigmoidoscope NEC
44061005,Y512,Y51.2 Approach to organ through gastrostomy
84952009,H082,H08.2 Transverse colectomy and anastomosis of ileum to colon
307583008,H064,H06.4 Extended right hemicolectomy and ileostomy HFQ
274351004,H191,H19.1 Open biopsy of lesion of colon
87594008,H179,H17.9 Unspecified intra-abdominal manipulation of colon
443480008,Y751,Y75.1 Laparoscopically assisted approach to abdominal cavity
235592007,J362,J36.2 Biopsy of lesion of ampulla of Vater using duodenal approach
235379005,H368,H36.8 Other specified other abdominal operations for prolapse of rectum
235269006,G435,G43.5 Fibreoptic endoscopic destruction of lesion of upper gastrointestinal tract NEC
174041007,H011,H01.1 Emergency excision of abnormal appendix and drainage HFQ
42904002,Z291,Z29.1 Rectum
4829004,G693,G69.3 Ileectomy and anastomosis of ileum to ileum
307558008,G674,G67.4 Intubation of jejunum NEC
359584000,G536,G53.6 Correction of malrotation of duodenum
1801001,G551,G55.1 Diagnostic endoscopic examination of duodenum and biopsy of lesion of duodenum
367436000,G741,G74.1 Creation of continent ileostomy
6019008,H229,H22.9 Unspecified diagnostic endoscopic examination of colon
173874001,G542,G54.2 Endoscopic dilation of duodenum
287993008,H176,H17.6 Open relief of obstruction of colon NEC
449106004,H231,H23.1 Endoscopic snare resection of lesion of lower bowel using fibreoptic sigmoidoscope
68188002,H163,H16.3 Colotomy
9121000,H341,H34.1 Open excision of lesion of rectum
18329001,H191,H19.1 Open biopsy of lesion of colon
445975005,G541,G54.1 Endoscopic extirpation of lesion of duodenum
6025007,H011,H01.1 Emergency excision of abnormal appendix and drainage HFQ
235341000,H342,H34.2 Open cauterisation of lesion of rectum
449265009,Y971,Y97.1 Radiology with pre and post contrast
28939002,H235,H23.5 Endoscopic submucosal resection of lesion of lower bowel using fibreoptic sigmoidoscope
265402006,H204,H20.4 Fibreoptic endoscopic destruction of lesion of colon NEC
41939004,G658,G65.8 Other specified diagnostic endoscopic examination of jejunum
445954002,U175,U17.5 Computed tomography of colon
708876004,H011,H01.1 Emergency excision of abnormal appendix and drainage HFQ
173985003,G751,G75.1 Refashioning of ileostomy
252674007,Y948,Y94.8 Other specified radiopharmaceutical imaging
609279008,H062,H06.2 Extended right hemicolectomy and anastomosis of ileum to colon
119286000,G781,G78.1 Open biopsy of lesion of ileum
174198003,Z291,Z29.1 Rectum
386225006,H625,H62.5 Irrigation of bowel NEC
69538006,J369,J36.9 Unspecified other operations on ampulla of Vater using duodenal approach
74539002,H175,H17.5 Open relief of strangulation of colon
235148003,G801,G80.1 Diagnostic endoscopic examination of ileum and biopsy of lesion of ileum
307658004,H151,H15.1 Loop colostomy
361152000,H153,H15.3 Refashioning of colostomy
361153005,H154,H15.4 Closure of colostomy
241335002,Y948,Y94.8 Other specified radiopharmaceutical imaging
235591000,J398,J39.8 Other specified other therapeutic endoscopic operations on ampulla of Vater
62539002,H175,H17.5 Open relief of strangulation of colon
12749000,Y531,Y53.1 Approach to organ under radiological control
449106004,Z291,Z29.1 Rectum
26925005,H082,H08.2 Transverse colectomy and anastomosis of ileum to colon
54747001,H099,H09.9 Unspecified excision of left hemicolon
18047003,G788,G78.8 Other specified other open operations on ileum
446415001,H228,H22.8 Other specified diagnostic endoscopic examination of colon
174197008,Z287,Z28.7 Colon NEC
