conceptId,idAndFsnTerm
50080231000188105,50080231000188105 | Radiotherapy to face (procedure) |
50080191000188103,50080191000188103 | External beam radiation therapy of bone (procedure) |
50080181000188101,50080181000188101 | Brachytherapy of bone (procedure) |
16554931000119102,16554931000119102 | Intravenous radionuclide therapy using radium 223 dichloride (procedure) |
16554781000119103,16554781000119103 | Intravenous radionuclide therapy using strontium 89 (procedure) |
16332841000119106,16332841000119106 | Computed tomography angiography of pulmonary artery with contrast (procedure) |
1103661000000108,1103661000000108 | Radioligand therapy using lutetium (177-Lu) labeled somatostatin analog (procedure) |
829831000000100,829831000000100 | Insertion of fiducial marker into lung using computed tomography guidance (procedure) |
721081000124101,721081000124101 | External beam radiotherapy with abdominal compression (procedure) |
721071000124104,721071000124104 | External beam radiotherapy with free breathing (procedure) |
721061000124106,721061000124106 | External beam radiotherapy with respiratory gating (procedure) |
721051000124109,721051000124109 | External beam radiotherapy with breath hold (procedure) |
721031000124102,721031000124102 | External beam radiotherapy without respiratory motion management (procedure) |
589631000119102,589631000119102 | Intravenous radioimmunotherapy using monoclonal antibodies (procedure) |
427561000119104,427561000119104 | Intravenous radionuclide therapy using samarium Sm 153 lexidronam (procedure) |
427541000119103,427541000119103 | Intravenous radionuclide therapy (procedure) |
11331000224100,11331000224100 | Tomotherapy (procedure) |
61000087103,61000087103 | Fluoroscopic bronchography of right bronchus (procedure) |
51000087101,51000087101 | Fluoroscopic bronchography of left bronchus (procedure) |
1297350006,1297350006 | Surface guided radiation therapy (procedure) |
1297069006,1297069006 | Fractionated dose radiotherapy (procedure) |
1290228009,1290228009 | Administration of antineoplastic agent via subcutaneous route (procedure) |
1290226008,1290226008 | Administration of antineoplastic agent via intravenous route (procedure) |
1287742003,1287742003 | Radiotherapy (procedure) |
1287682002,1287682002 | Intraoperative external beam radiation therapy using electrons for malignant neoplasm of cecum and/or colon and/or rectum (procedure) |
1286802009,1286802009 | External beam radiotherapy using internal target volume approach (procedure) |
1286801002,1286801002 | Real time tumor tracking external beam radiotherapy (procedure) |
1269317006,1269317006 | Radiotherapy to urinary bladder (procedure) |
1264389002,1264389002 | Radiation therapy to oral cavity (procedure) |
1263784000,1263784000 | Radioligand therapy using lutetium (177-Lu) vipivotide tetraxetan (procedure) |
1263392007,1263392007 | Extracorporeal irradiation of tumor bearing bone and reimplantation (procedure) |
1259200004,1259200004 | Neoadjuvant antineoplastic chemotherapy (procedure) |
1255904006,1255904006 | Administration of palliative antineoplastic agent (procedure) |
1255834000,1255834000 | Administration of antineoplastic chemotherapy into peritoneal cavity (procedure) |
1255831008,1255831008 | Chemotherapy for malignant neoplastic disease using targeted agent (procedure) |
1255359001,1255359001 | Fractionated dose stereotactic radiation therapy (procedure) |
1254742000,1254742000 | Delayed intensification antineoplastic therapy regimen (regime/therapy) |
1254741007,1254741007 | Intensification antineoplastic therapy regimen (regime/therapy) |
1204242009,1204242009 | External beam radiation therapy using particle scanning technique (procedure) |
1172516002,1172516002 | High-dose chemotherapy with stem cell transplant (procedure) |
1163157007,1163157007 | Ultra high dose rate radiotherapy (procedure) |
1162782007,1162782007 | Three dimensional external beam radiation therapy (procedure) |
1156530009,1156530009 | Volumetric modulated arc therapy (procedure) |
1156529004,1156529004 | External beam radiation therapy using particle passive scattering technique (procedure) |
1156528007,1156528007 | External beam radiation therapy using particle spot scanning technique (procedure) |
1156526006,1156526006 | Two dimensional external beam radiation therapy (procedure) |
1156525005,1156525005 | Mixed beam external beam radiation therapy (procedure) |
1156524009,1156524009 | Intensity modulated external beam neutron radiation therapy (procedure) |
1156506007,1156506007 | External beam radiation therapy using photons (procedure) |
1156505006,1156505006 | External beam radiation therapy using carbon ions (procedure) |
1148692008,1148692008 | Radiation therapy following chemotherapy (procedure) |
1141994004,"1141994004 | Rituximab, cyclophosphamide, etoposide, vincristine, prednisone antineoplastic chemotherapy regimen (regime/therapy) |"
1119345001,1119345001 | Radiography of right bronchus with contrast (procedure) |
1119344002,1119344002 | Radiography of left bronchus with contrast (procedure) |
897713009,897713009 | Antineoplastic chemoimmunotherapy (regime/therapy) |
890093004,890093004 | Administration of multiple antineoplastic agents (procedure) |
879915007,879915007 | Radiotherapy to bone (procedure) |
870385001,870385001 | Hypofractionated radiation therapy (procedure) |
870380006,870380006 | Lung ultrasound surface wave elastography (procedure) |
870250004,"870250004 | Fluorouracil, leucovorin, irinotecan and oxaliplatin antineoplastic chemotherapy regimen (regime/therapy) |"
870249004,"870249004 | Folinic acid, fluorouracil and irinotecan antineoplastic chemotherapy regimen (regime/therapy) |"
830156009,830156009 | Administration of hyperthermic antineoplastic agent into thoracic cavity (procedure) |
830155008,830155008 | Administration of hyperthermic antineoplastic agent into peritoneal cavity (procedure) |
816151001,816151001 | Administration of consolidation antineoplastic agent (procedure) |
785707001,785707001 | Hypofractionated radiation therapy of entire breast (procedure) |
785706005,785706005 | Hypofractionated radiation therapy of prostate (procedure) |
782204001,782204001 | Superficial radiation therapy (procedure) |
770700009,770700009 | Insertion of stent into bronchus using fluoroscopic guidance (procedure) |
765042000,765042000 | Angiography of right pulmonary artery (procedure) |
765041007,765041007 | Angiography of left pulmonary artery (procedure) |
764864002,764864002 | Radionuclide imaging of lung ventilation using technetium (99m-Tc) technegas (procedure) |
736974006,736974006 | Excision of middle lobe of right lung (procedure) |
735016006,735016006 | Complete excision of right lung (procedure) |
735015005,735015005 | Complete excision of left lung (procedure) |
726549007,726549007 | Radioimmunoguided surgery (procedure) |
726428009,726428009 | Lobectomy of upper lobe of right lung (procedure) |
726427004,726427004 | Lobectomy of upper lobe of left lung (procedure) |
726426008,726426008 | Lobectomy of lower lobe of left lung (procedure) |
726425007,726425007 | Lobectomy of lower lobe of right lung (procedure) |
722491009,"722491009 | Rituximab, cyclophosphamide, doxorubicin, vincristine and prednisone chemotherapy regimen (regime/therapy) |"
722482005,"722482005 | Doxorubicin, bleomycin, vinblastine and dacarbazine chemotherapy regimen (regime/therapy) |"
722472009,"722472009 | Rituximab, ifosfamide, carboplatin and etoposide chemotherapy regimen (regime/therapy) |"
721044005,721044005 | Dual energy computed tomography angiography of pulmonary artery with contrast (procedure) |
720379009,720379009 | Hepatic arterial infusion chemotherapy (procedure) |
716872004,716872004 | Antineoplastic chemotherapy regimen (regime/therapy) |
714029009,714029009 | Preoperative high dose brachytherapy (procedure) |
713162006,713162006 | Removal of lung from cadaver donor (procedure) |
712746000,712746000 | Total body electron beam therapy (procedure) |
711299007,711299007 | Radiotherapy to thorax (procedure) |
708884000,708884000 | Excision of emphysematous bleb of lung (procedure) |
708861007,708861007 | Percutaneous cryoablation of lung (procedure) |
708812005,708812005 | Percutaneous drainage of lung using imaging guidance (procedure) |
703423002,703423002 | Combined chemotherapy and radiation therapy (procedure) |
702544007,702544007 | Harvesting of lobe of lung from living donor (procedure) |
700496000,700496000 | Postoperative administration of antineoplastic agent into peritoneal cavity (procedure) |
473237008,473237008 | Stereotactic radiosurgery for acoustic neuroma (procedure) |
450873006,450873006 | Plication of emphysematous bleb of lung (procedure) |
450827009,450827009 | Induction chemotherapy (procedure) |
450608000,450608000 | Destruction of lesion of lung (procedure) |
450348001,450348001 | Biopsy of lesion of lung (procedure) |
449290006,449290006 | Megavoltage radiation therapy using photons and electrons (procedure) |
448538005,448538005 | Harvesting of lobe of lung from donor (procedure) |
448523009,448523009 | Endoscopic ultrasonography of lung (procedure) |
448461009,448461009 | Stereotactic radiation therapy using megavoltage radiation (procedure) |
448385000,448385000 | Megavoltage radiation therapy using photons (procedure) |
448294009,448294009 | External radiation therapy using superficial radiation (procedure) |
448287006,448287006 | Excision of polyp of bronchus (procedure) |
447975009,447975009 | Sleeve resection of bronchus and anastomosis (procedure) |
447912004,447912004 | Fractionated dose stereotactic radiosurgery using linear accelerator system (procedure) |
447751001,447751001 | Endoscopic excision of polyp of bronchus (procedure) |
447704003,447704003 | Single dose stereotactic radiosurgery using linear accelerator system (procedure) |
446504008,446504008 | Stereotactic destruction of lesion using gamma radiation (procedure) |
445232009,445232009 | Boost radiation therapy (procedure) |
443396005,443396005 | Pneumonostomy with open drainage of abscess of lung using computed tomography guidance (procedure) |
442303003,442303003 | Deflation of lung (procedure) |
442226007,442226007 | Partial reinflation of lung (procedure) |
441799006,441799006 | Intensity modulated radiation therapy (procedure) |
441783000,441783000 | Three-dimensional conformal radiation therapy (procedure) |
441677009,441677009 | Imaging of lung (procedure) |
441624004,441624004 | Single photon emission computed tomography of ventilation of lung (procedure) |
440466000,440466000 | Single photon emission computed tomography of lung (procedure) |
438629002,438629002 | High dose rate electronic brachytherapy (procedure) |
433857008,433857008 | Fluoroscopic angiography of pulmonary artery using contrast with insertion of stent graft (procedure) |
433240003,433240003 | Percutaneous thrombolysis of pulmonary artery using fluoroscopic guidance (procedure) |
433224001,433224001 | Radionuclide rhenium 186 hydroxyethylidene diphosphonate therapy (procedure) |
433030005,433030005 | Replacement of pulmonary artery catheter using fluoroscopic guidance with contrast (procedure) |
432231006,432231006 | Fine needle aspiration biopsy of lung (procedure) |
432074001,432074001 | Removal of pulmonary artery catheter using fluoroscopic guidance with contrast (procedure) |
432067006,432067006 | Fluoroscopic angiography of pulmonary artery using contrast with insertion of stent (procedure) |
431596004,431596004 | Percutaneous mechanical thrombectomy of pulmonary artery using fluoroscopic guidance with contrast (procedure) |
431489004,431489004 | Fluoroscopic angiography of pulmonary artery with contrast with pressure measurement (procedure) |
431430006,431430006 | Radionuclide imaging of lung for pulmonary aspiration (procedure) |
431216004,431216004 | Insertion of catheter into pulmonary artery using fluoroscopic guidance with contrast (procedure) |
429774000,429774000 | Radiotherapy to abdomen (procedure) |
429609002,429609002 | Lung volume reduction surgery (procedure) |
429584001,429584001 | Stereotactic radiosurgery of brain tissue (procedure) |
429579007,429579007 | Radiotherapy to axilla (procedure) |
429122009,429122009 | Percutaneous transluminal balloon angioplasty with insertion of stent into pulmonary artery (procedure) |
428923005,428923005 | Radiotherapy to breast (procedure) |
428831001,428831001 | Radiotherapy to perineum (procedure) |
428829005,428829005 | Radiotherapy to pelvis (procedure) |
428624002,428624002 | Radiotherapy to chest wall (procedure) |
428416002,428416002 | Radiotherapy to neck (procedure) |
428412000,428412000 | Radiotherapy to head (procedure) |
427800005,427800005 | Removal of foreign body of lung by incision (procedure) |
427138007,427138007 | Repair of anomalous pulmonary artery origin from ascending aorta (procedure) |
426987001,426987001 | Percutaneous radiofrequency ablation of lesion of lung (procedure) |
426436008,426436008 | Repair of pulmonary arterial sling (procedure) |
426332009,426332009 | External beam radiation therapy to lesion of retina (procedure) |
425948009,425948009 | Percutaneous angioplasty of pulmonary artery (procedure) |
425437006,425437006 | Ligation of pulmonary artery (procedure) |
418876000,418876000 | Fluoroscopic bronchography (procedure) |
418786005,418786005 | Magnetic resonance angiography of pulmonary artery (procedure) |
418549007,418549007 | Fluoroscopic angiography of pulmonary artery with contrast (procedure) |
399042005,399042005 | Chemotherapy cycle (procedure) |
398194002,398194002 | Suture of laceration of bronchus (procedure) |
397840008,397840008 | Bronchorrhaphy (procedure) |
397398007,397398007 | Catheterization of bronchus with lavage (procedure) |
397396006,397396006 | Aspiration of bronchus with lavage (procedure) |
397395005,397395005 | Lavage of bronchus (procedure) |
395096001,395096001 | Stereotactic radiotherapy (procedure) |
395075008,395075008 | Iridium wire therapy (procedure) |
394935005,394935005 | Combined postoperative chemotherapy and radiotherapy (procedure) |
394934009,394934009 | Combined preoperative chemotherapy and radiotherapy (procedure) |
394895009,394895009 | Postoperative chemotherapy (procedure) |
394894008,394894008 | Pre-operative chemotherapy (procedure) |
387748005,387748005 | Cauterization of lung lesion (procedure) |
387747000,387747000 | Cauterization of lung (procedure) |
367336001,367336001 | Chemotherapy (procedure) |
363688001,363688001 | Administration of antineoplastic agent (procedure) |
359623004,359623004 | Total lobectomy of lung (procedure) |
359618004,359618004 | Segmental lobectomy (procedure) |
359615001,359615001 | Partial lobectomy of lung (procedure) |
337877003,337877003 | Thoracotomy for excision of emphysematous bleb of lung (procedure) |
336863008,336863008 | Excision of cyst of lung (procedure) |
315601005,315601005 | Ambulatory chemotherapy (procedure) |
314606007,314606007 | Postoperative course of deep X-ray therapy (procedure) |
314605006,314605006 | Preoperative course of deep X-ray therapy (procedure) |
314604005,314604005 | Palliative course of deep X-ray therapy (procedure) |
312849006,312849006 | Biopsy of bronchus (procedure) |
312248006,312248006 | Heavy ion external beam radiation therapy (procedure) |
310832007,310832007 | Stapling of bronchus (procedure) |
310394000,310394000 | Stapling of lung laceration (procedure) |
310393006,310393006 | Suture of lung laceration (procedure) |
303931008,303931008 | Lung X-ray (procedure) |
301083005,301083005 | Embolization of pulmonary artery (procedure) |
300976007,300976007 | Radiotherapy to lesion of canthus (procedure) |
287465001,287465001 | Percutaneous needle biopsy lung (procedure) |
287310004,287310004 | Lung tumor excision (procedure) |
287309009,287309009 | Lung cyst removal (procedure) |
287306002,287306002 | Exploration of bronchus (procedure) |
287305003,287305003 | Removal of foreign body from bronchus by incision (procedure) |
287298008,287298008 | Lung plastic operation (procedure) |
287296007,287296007 | Dilation of bronchus (procedure) |
277437006,277437006 | Bronchial revascularization (procedure) |
277182002,277182002 | Resection of pulmonary artery (procedure) |
274319000,274319000 | Needle biopsy of lung (procedure) |
266719004,266719004 | Oral chemotherapy (procedure) |
266701008,266701008 | Lung collapse prevention (procedure) |
265761001,265761001 | Intramuscular chemotherapy (procedure) |
261566003,261566003 | Tangential pulmonary artery resection (procedure) |
261563006,261563006 | Sleeve pulmonary artery resection (procedure) |
241616006,241616006 | Magnetic resonance imaging of lungs (procedure) |
241542003,241542003 | Computed tomography of lungs with diagnostic pneumothorax (procedure) |
241541005,241541005 | High resolution computed tomography of lungs (procedure) |
241540006,241540006 | Computed tomography of lungs (procedure) |
241304008,241304008 | Radionuclide lung permeability study (procedure) |
241303002,241303002 | Radionuclide mucociliary clearance study (procedure) |
241302007,241302007 | Diethylenetriaminepentaacetate aerosol ventilation study (procedure) |
241299007,241299007 | Xenon-127 ventilation study (procedure) |
241298004,241298004 | Xenon-133 ventilation study (procedure) |
241297009,241297009 | Xenon ventilation study (procedure) |
241293008,241293008 | Radionuclide study of lung (procedure) |
241227002,241227002 | Selective angiography of pulmonary artery (procedure) |
241226006,241226006 | Pulmonary angiography by main pulmonary artery injection (procedure) |
241053004,241053004 | Radiographic measurement of lung volume (procedure) |
233216008,233216008 | Excision of vegetations from pulmonary trunk (procedure) |
233214006,233214006 | Angioplasty of pulmonary artery (procedure) |
233213000,233213000 | Reconstruction of pulmonary artery (procedure) |
233211003,233211003 | Resection and end-to-end anastomosis of pulmonary trunk (procedure) |
233209007,233209007 | Reimplantation of pulmonary artery (procedure) |
233208004,233208004 | Pulmonary trunk and artery banding operation (procedure) |
232697001,232697001 | Lung reinflation (procedure) |
232661005,232661005 | Removal of lung from donor (procedure) |
232660006,232660006 | Bilateral sequential single lung transplant (procedure) |
232657004,232657004 | Single lung transplant (procedure) |
232656008,232656008 | Intercostal puncture of lung bulla (procedure) |
232655007,232655007 | Aspiration of lung lesion (procedure) |
232653000,232653000 | Repair of lung laceration (procedure) |
232652005,232652005 | Cavernostomizing of bulla of lung (procedure) |
232651003,232651003 | Excision of bulla of lung (procedure) |
232650002,232650002 | Oversewing of bulla of lung (procedure) |
232649002,232649002 | Repair of bulla of lung (procedure) |
232648005,232648005 | Excision of lung sequestration (procedure) |
232647000,232647000 | Pneumonectomy with tracheobronchoplasty (procedure) |
232646009,232646009 | Completion pneumonectomy (procedure) |
232644007,232644007 | Extrapleural pneumonectomy (procedure) |
232643001,232643001 | Intrapericardial pneumonectomy (procedure) |
232642006,232642006 | Extrapericardial pneumonectomy (procedure) |
232641004,232641004 | Lobectomy of lung with excision of part of adjacent lobe (procedure) |
232640003,232640003 | Lobectomy with bronchoplastic procedure (procedure) |
232639000,232639000 | Excision of segment of left lower lobe (procedure) |
232638008,232638008 | Excision of segment of left upper lobe (procedure) |
232637003,232637003 | Excision of segment of right lower lobe (procedure) |
232636007,232636007 | Excision of segment of middle lobe of right lung (procedure) |
232635006,232635006 | Excision of segment of right upper lobe (procedure) |
232634005,232634005 | Multiple wedge excisions of lung (procedure) |
232633004,232633004 | Single wedge excision of lung (procedure) |
232632009,232632009 | Wedge excision of lung (procedure) |
232631002,232631002 | Enucleation of lung lesion (procedure) |
232628003,232628003 | Open biopsy of lung (procedure) |
232625000,232625000 | Repair of ruptured bronchus (procedure) |
232624001,232624001 | Open excision of bronchial lesion (procedure) |
232623007,232623007 | Open biopsy of bronchial lesion (procedure) |
232622002,232622002 | Open procedure to bronchus (procedure) |
231764006,231764006 | Radiotherapy to retina (procedure) |
231737005,231737005 | Radiotherapy to ciliary body (procedure) |
231596001,231596001 | Radiotherapy to lesion of eyelid (procedure) |
231585009,231585009 | Radiotherapy to lesion of lateral canthus (procedure) |
231568007,231568007 | Radiotherapy to lesion of medial canthus (procedure) |
231544004,231544004 | Radiotherapy to orbital lesion (procedure) |
230914000,230914000 | Stereotactic radiosurgery of intracranial cavernous angioma (procedure) |
230913006,230913006 | Stereotactic radiosurgery of intracranial venous malformation (procedure) |
230912001,230912001 | Stereotactic radiosurgery of intracranial arteriovenous malformation (procedure) |
230911008,230911008 | Stereotactic radiosurgery of lesion of intracranial vasculature (procedure) |
230857009,230857009 | Injection of chemotherapeutic substance into subcutaneous reservoir (procedure) |
228676000,228676000 | Hiletron neutron external beam radiation therapy (procedure) |
228675001,228675001 | Deuterium on tritium neutron external beam radiation therapy (procedure) |
228674002,228674002 | Cyclotron neutron external beam radiation therapy (procedure) |
228673008,228673008 | Strontium 90 electron external beam radiation therapy (procedure) |
228672003,228672003 | Microtron electron external beam radiation therapy (procedure) |
228671005,228671005 | Linear accelerator electron external beam radiation therapy (procedure) |
228667007,228667007 | Stereotactic cobalt external beam radiation therapy (procedure) |
228666003,228666003 | External beam radiation therapy with dual headed cobalt unit (procedure) |
228664000,228664000 | Van der Graaff X-ray therapy (procedure) |
228663006,228663006 | Microtron X-ray therapy (procedure) |
228662001,228662001 | Betatron X-ray therapy (procedure) |
228661008,228661008 | Grenz ray therapy (procedure) |
228660009,228660009 | Contact therapy (procedure) |
182975000,182975000 | Tuberculosis chemotherapy (procedure) |
175267003,175267003 | Percutaneous transluminal embolization of pulmonary artery (procedure) |
175263004,175263004 | Open embolization of pulmonary artery (procedure) |
175254001,175254001 | Repair of pulmonary artery using prosthesis (procedure) |
175253007,175253007 | Repair of pulmonary artery (procedure) |
173191000,173191000 | Aspiration biopsy of lesion of lung (procedure) |
173190004,173190004 | Needle biopsy of lesion of lung (procedure) |
173185002,173185002 | Deflation of bulla of lung (procedure) |
173184003,173184003 | Ligation of bulla of lung (procedure) |
173179009,173179009 | Open cauterization of lesion of lung (procedure) |
173178001,173178001 | Open excision of lesion of lung (procedure) |
173177006,173177006 | Open decortication of lesion of lung (procedure) |
173176002,173176002 | Open extirpation of lesion of lung (procedure) |
173172000,173172000 | Excision of segment of lung (procedure) |
173171007,173171007 | Lobectomy of lung (procedure) |
173170008,173170008 | Bilobectomy of lung (procedure) |
173102001,173102001 | Open destruction of lesion of bronchus (procedure) |
173098009,173098009 | Partial extirpation of bronchus (procedure) |
172408001,172408001 | Radiotherapy of corneal lesion (procedure) |
172286002,172286002 | Radiotherapy to lacrimal gland (procedure) |
171809001,171809001 | Radiotherapy to lesion of peripheral nerve (procedure) |
171765004,171765004 | Intrathecal injection of chemotherapeutic agent (procedure) |
169407006,169407006 | Radiosensitizing measure (procedure) |
169403005,169403005 | Radiochemotherapy: into cavity (procedure) |
169402000,169402000 | Radiochemotherapy: local artery (procedure) |
169401007,169401007 | Radiochemotherapy: for immunosuppression (procedure) |
169400008,169400008 | Radiochemotherapy via intravenous route (procedure) |
169399001,169399001 | Radiochemotherapy via oral route (procedure) |
169398009,169398009 | Radiochemotherapy: to stop spread (procedure) |
169397004,169397004 | Radiochemotherapy: local infiltration (procedure) |
169396008,169396008 | Radiomimetic chemotherapy (procedure) |
169336005,169336005 | External beam radiation therapy with chemotherapy (procedure) |
169335009,169335009 | External beam - surgery with chemotherapy (procedure) |
169334008,169334008 | External beam - surgery with postoperative radiotherapy (procedure) |
169333002,169333002 | External beam - surgery with preoperative radiotherapy (procedure) |
169332007,169332007 | External beam radiation therapy with internal radiotherapy (procedure) |
169331000,169331000 | Combined radiotherapy (procedure) |
169318005,169318005 | Fast neutron therapy (procedure) |
169317000,169317000 | Neutron capture therapy (procedure) |
169315008,169315008 | Deuteron therapy (procedure) |
169314007,169314007 | Proton therapy (procedure) |
169311004,169311004 | Positron therapy (procedure) |
169310003,169310003 | Betatron electron therapy (procedure) |
169309008,169309008 | Linear accelerator electrons (procedure) |
169307005,169307005 | Fast-electron therapy (procedure) |
169304003,169304003 | Van der Graaff photon therapy (procedure) |
169303009,169303009 | Betatron photon therapy (procedure) |
169302004,169302004 | Linear accelerator photon therapy (procedure) |
169301006,169301006 | High-energy beam therapy (procedure) |
169298007,169298007 | Intracavitary X-ray therapy (procedure) |
169297002,169297002 | Short distance X-ray therapy (procedure) |
169296006,169296006 | Ultrahard X-rays 400-2000 kV (procedure) |
169295005,169295005 | Deep X-ray therapy 150-400 kV (procedure) |
