,concept_code_y,concept_name_y,icd
110748,04.05,Gasserian ganglionectomy,04.05
110814,14.52,Repair of retinal detachment with cryotherapy,14.52
110869,87.05,Contrast dacryocystogram,87.05
110975,67.33,Destruction of lesion of cervix by cryosurgery,67.33
111000,35.41,Enlargement of existing atrial septal defect,35.41
111099,29.0,Pharyngotomy,29.0
111291,34.09,Other incision of pleura,34.09
111303,66.96,Dilation of fallopian tube,66.96
111350,15.1,Operations on one extraocular muscle involving temporary detachment from globe,15.1
111351,15.19,Other operations on one extraocular muscle involving temporary detachment from globe,15.19
111623,28.0,Incision and drainage of tonsil and peritonsillar structures,28.0
111829,76.45,Other total ostectomy of other facial bone,76.45
111847,09.51,Incision of lacrimal punctum,09.51
111925,46.76,Closure of fistula of large intestine,46.76
112015,18.12,Biopsy of external ear,18.12
112120,33.42,Closure of bronchial fistula,33.42
112202,45.25,Closed [endoscopic] biopsy of large intestine,45.25
112296,22.5,Other nasal sinusotomy,22.5
112297,22.50,"Sinusotomy, not otherwise specified",22.50
112317,47.0,Appendectomy,47.0
112318,47.09,Other appendectomy,47.09
112418,88.52,Angiocardiography of right heart structures,88.52
112490,37.32,Excision of aneurysm of heart,37.32
112510,15.7,Repair of injury of extraocular muscle,15.7
112585,30.29,Other partial laryngectomy,30.29
112760,23.3,Restoration of tooth by inlay,23.3
112780,02.92,Repair of brain,02.92
112956,08.24,"Excision of major lesion of eyelid, full-thickness",08.24
112977,48.33,Destruction of rectal lesion or tissue by laser,48.33
113014,01.31,Incision of cerebral meninges,01.31
113028,36.2,Heart revascularization by arterial implant,36.2
113029,36.3,Other heart revascularization,36.3
113030,36.39,Other heart revascularization,36.39
113050,07.53,Partial excision of pineal gland,07.53
113105,55.4,Partial nephrectomy,55.4
113230,07.21,Excision of lesion of adrenal gland,07.21
113265,21.02,Control of epistaxis by posterior (and anterior) packing,21.02
113306,66.11,Biopsy of fallopian tube,66.11
113331,53.81,Plication of the diaphragm,53.81
113367,76.01,Sequestrectomy of facial bone,76.01
113385,26.41,Suture of laceration of salivary gland,26.41
113429,09.91,Obliteration of lacrimal punctum,09.91
113449,42.85,Repair of esophageal stricture,42.85
113460,26.4,Repair of salivary gland or duct,26.4
113579,07.14,"Biopsy of pituitary gland, transsphenoidal approach",07.14
113589,96.29,Reduction of intussusception of alimentary tract,96.29
113698,15.12,Advancement of one extraocular muscle,15.12
113720,50.12,Open biopsy of liver,50.12
113748,45.75,Open and other left hemicolectomy,45.75
113873,47.1,Incidental appendectomy,47.1
113874,47.11,Laparoscopic incidental appendectomy,47.11
113875,47.19,Other incidental appendectomy,47.19
113927,39.63,Cardioplegia,39.63
113937,01.23,Reopening of craniotomy site,01.23
114082,29.31,Cricopharyngeal myotomy,29.31
114135,65.3,Unilateral oophorectomy,65.3
114136,65.39,Other unilateral oophorectomy,65.39
114137,65.52,Other removal of remaining ovary,65.52
114225,35.03,"Closed heart valvotomy, pulmonary valve",35.03
114368,45.01,Incision of duodenum,45.01
114463,27.73,Repair of uvula,27.73
114589,11.31,Transposition of pterygium,11.31
114613,12.88,Other scleral reinforcement,12.88
114633,96.32,Gastric freezing,96.32
114799,07.93,Repair of thymus,07.93
114815,34.6,Scarification of pleura,34.6
114844,45.76,Open and other sigmoidectomy,45.76
114950,89.56,Carotid pulse tracing with ECG lead,89.56
114979,57.12,Lysis of intraluminal adhesions with incision into bladder,57.12
115156,12.93,Removal or destruction of epithelial downgrowth from anterior chamber,12.93
115163,12.86,Other repair of scleral staphyloma,12.86
115213,33.22,Fiber-optic bronchoscopy,33.22
115265,57.31,Cystoscopy through artificial stoma,57.31
115322,46.03,Exteriorization of large intestine,46.03
115376,87.32,Other contrast bronchogram,87.32
115414,50.3,Lobectomy of liver,50.3
115459,89.35,Transillumination of nasal sinuses,89.35
115516,07.61,"Partial excision of pituitary gland, transfrontal approach",07.61
115558,07.44,Repair of adrenal gland,07.44
115581,87.06,Contrast radiogram of nasopharynx,87.06
115633,41.2,Splenotomy,41.2
115667,16.51,Exenteration of orbit with removal of adjacent structures,16.51
115734,89.57,Apexcardiogram (with ECG lead),89.57
116256,55.21,Nephroscopy,55.21
116364,67.0,Dilation of cervical canal,67.0
116400,46.80,"Intra-abdominal manipulation of intestine, not otherwise specified",46.80
116428,12.5,Facilitation of intraocular circulation,12.5
116429,12.59,Other facilitation of intraocular circulation,12.59
116464,48.35,Local excision of rectal lesion or tissue,48.35
116465,48.6,Other resection of rectum,48.6
116466,48.69,Other resection of rectum,48.69
116625,33.5,Lung transplant,33.5
116626,33.50,"Lung transplantation, not otherwise specified",33.50
116684,35.26,Open and other replacement of pulmonary valve,35.26
116698,35.07,Endovascular replacement of pulmonary valve,35.07
116699,35.08,Transapical replacement of pulmonary valve,35.08
116730,22.64,Sphenoidectomy,22.64
116781,86.51,Replantation of scalp,86.51
116822,76.43,Other reconstruction of mandible,76.43
116965,12.44,Excision of lesion of ciliary body,12.44
116975,42.51,Intrathoracic esophagoesophagostomy,42.51
116976,42.61,Antesternal esophagoesophagostomy,42.61
117096,99.93,Rectal massage (for levator spasm),99.93
117235,14.4,Repair of retinal detachment with scleral buckling and implant,14.4
117236,14.5,Other repair of retinal detachment,14.5
117237,14.59,Other repair of retinal detachment,14.59
117488,22.31,Radical maxillary antrotomy,22.31
117522,35.53,"Repair of ventricular septal defect with prosthesis, open technique",35.53
117523,35.55,"Repair of ventricular septal defect with prosthesis, closed technique",35.55
117549,72.3,High forceps operation,72.3
117550,72.39,Other high forceps operation,72.39
117569,33.49,Other repair and plastic operations on lung,33.49
117757,09.43,Probing of nasolacrimal duct,09.43
117776,33.93,Puncture of lung,33.93
117952,45.63,Total removal of small intestine,45.63
118115,45.41,Excision of lesion or tissue of large intestine,45.41
118219,12.66,Postoperative revision of scleral fistulization procedure,12.66
118255,15.11,Recession of one extraocular muscle,15.11
118289,34.91,Thoracentesis,34.91
118369,21.62,Fracture of the turbinates,21.62
118409,19.2,Revision of stapedectomy,19.2
118410,19.29,Other revision of stapedectomy,19.29
118578,44.68,Laparoscopic gastroplasty,44.68
118608,52.6,Total pancreatectomy,52.6
118668,75.50,"Repair of current obstetric laceration of uterus, not otherwise specified",75.50
118669,75.52,Repair of current obstetric laceration of corpus uteri,75.52
118744,76.95,Other manipulation of temporomandibular joint,76.95
118810,45.49,Other destruction of lesion of large intestine,45.49
