,concept_code_y,concept_name_y,icd
139233,82.58,Other hand muscle transfer or transplantation,82.58
139309,68.0,Hysterotomy,68.0
139374,22.61,Excision of lesion of maxillary sinus with Caldwell-Luc approach,22.61
139442,75.61,Repair of current obstetric laceration of bladder and urethra,75.61
139624,25.94,Other glossotomy,25.94
139894,84.65,"Insertion of total spinal disc prosthesis, lumbosacral",84.65
140150,37.28,Intracardiac echocardiography,37.28
140237,80.53,Repair of the anulus fibrosus with graft or prosthesis,80.53
140238,80.54,Other and unspecified repair of the anulus fibrosus,80.54
140239,84.60,"Insertion of spinal disc prosthesis, not otherwise specified",84.60
141277,84.63,"Insertion of spinal disc prosthesis, thoracic",84.63
141741,01.3,Incision of brain and cerebral meninges,01.3
141742,01.39,Other incision of brain,01.39
142069,79.45,"Closed reduction of separated epiphysis, femur",79.45
142329,85.76,"Gluteal artery perforator (GAP) flap, free",85.76
142427,84.62,"Insertion of total spinal disc prosthesis, cervical",84.62
142714,60.96,Transurethral destruction of prostate tissue by microwave thermotherapy,60.96
142715,60.97,Other transurethral destruction of prostate tissue by other thermotherapy,60.97
142944,93.08,Electromyography,93.08
143084,84.81,Revision of interspinous process device(s),84.81
143130,93.90,Non-invasive mechanical ventilation,93.90
143178,03.52,Repair of spinal myelomeningocele,03.52
144315,23.41,Application of crown,23.41
144717,32.22,Lung volume reduction surgery,32.22
145327,95.44,Clinical vestibular function tests,95.44
145431,56.32,Closed percutaneous biopsy of ureter,56.32
145432,56.34,Open biopsy of ureter,56.34
145685,07.15,"Biopsy of pituitary gland, unspecified approach",07.15
146555,79.34,"Open reduction of fracture with internal fixation, phalanges of hand",79.34
146682,50.13,Transjugular liver biopsy,50.13
148916,81.65,Percutaneous vertebroplasty,81.65
152491,63.93,Incision of spermatic cord,63.93
152567,17.63,Laser interstitial thermal therapy [LITT] of lesion or tissue of liver under guidance,17.63
152878,08.37,Reduction of overcorrection of ptosis,08.37
152896,14.73,Mechanical vitrectomy by anterior approach,14.73
154680,77.32,"Other division of bone, humerus",77.32
155629,55.34,Laparoscopic ablation of renal lesion or tissue,55.34
157901,16.81,Repair of wound of orbit,16.81
158115,86.4,Radical excision of skin lesion,86.4
158133,92.15,Pulmonary scan,92.15
158327,68.71,Laparoscopic radical vaginal hysterectomy [LRVH],68.71
158380,87.02,Other contrast radiogram of brain and skull,87.02
158381,92.12,Scan of other sites of head,92.12
158424,35.21,Open and other replacement of aortic valve with tissue graft,35.21
158690,76.5,Temporomandibular arthroplasty,76.5
158783,61.2,Excision of hydrocele (of tunica vaginalis),61.2
160031,76.92,Insertion of synthetic implant in facial bone,76.92
160310,12.13,Excision of prolapsed iris,12.13
161293,66.71,Simple suture of fallopian tube,66.71
161427,32.20,Thoracoscopic excision of lesion or tissue of lung,32.20
161607,65.24,Laparoscopic wedge resection of ovary,65.24
161747,55.83,Closure of other fistula of kidney,55.83
162034,00.86,"Resurfacing hip, partial, femoral head",00.86
162395,66.62,Salpingectomy with removal of tubal pregnancy,66.62
162419,09.6,Excision of lacrimal sac and passage,09.6
162471,88.93,Magnetic resonance imaging of spinal canal,88.93
162618,07.17,Biopsy of pineal gland,07.17
162631,07.71,Exploration of pituitary fossa,07.71
162694,86.27,"Debridement of nail, nail bed, or nail fold",86.27
162999,23.73,Apicoectomy,23.73
163010,24.32,Suture of laceration of gum,24.32
163310,87.11,Full-mouth x-ray of teeth,87.11
163627,65.41,Laparoscopic unilateral salpingo-oophorectomy,65.41
163628,65.63,Laparoscopic removal of both ovaries and tubes at same operative episode,65.63
163723,68.41,Laparoscopic total abdominal hysterectomy,68.41
163745,15.01,Biopsy of extraocular muscle or tendon,15.01
163942,56.82,Suture of laceration of ureter,56.82
164051,27.21,Biopsy of bony palate,27.21
164720,87.94,Contrast vasogram,87.94
164942,20.22,Incision of petrous pyramid air cells,20.22
164953,12.54,Trabeculotomy ab externo,12.54
164966,02.13,Ligation of meningeal vessel,02.13
165156,55.31,Marsupialization of kidney lesion,55.31
165209,09.2,Excision of lesion or tissue of lacrimal gland,09.2
165210,09.20,"Excision of lacrimal gland, not otherwise specified",09.20
165211,09.21,Excision of lesion of lacrimal gland,09.21
165242,11.22,Biopsy of cornea,11.22
165420,13.71,"Insertion of intraocular lens prosthesis at time of cataract extraction, one-stage",13.71
165653,59.5,Retropubic urethral suspension,59.5
166256,35.92,Creation of conduit between right ventricle and pulmonary artery,35.92
166812,80.98,"Other excision of joint, foot and toe",80.98
167462,78.15,"Application of external fixator device, femur",78.15
167490,78.12,"Application of external fixator device, humerus",78.12
167522,76.11,Biopsy of facial bone,76.11
167933,38.01,"Incision of vessel, intracranial vessels",38.01
167988,77.25,"Wedge osteotomy, femur",77.25
168000,05.24,Presacral sympathectomy,05.24
168368,89.24,Uroflowmetry [UFR],89.24
168418,80.35,"Biopsy of joint structure, hip",80.35
168731,38.51,"Ligation and stripping of varicose veins, intracranial vessels",38.51
168937,49.71,Suture of laceration of anus,49.71
169074,78.2,Limb shortening procedures,78.2
169075,78.20,"Limb shortening procedures, unspecified site",78.20
169076,78.23,"Limb shortening procedures, radius and ulna",78.23
169078,78.27,"Limb shortening procedures, tibia and fibula",78.27
169079,78.28,"Limb shortening procedures, tarsals and metatarsals",78.28
169080,78.29,"Limb shortening procedures, other bones",78.29
169096,78.22,"Limb shortening procedures, humerus",78.22
169118,76.94,Open reduction of temporomandibular dislocation,76.94
169228,77.35,"Other division of bone, femur",77.35
169256,78.32,"Limb lengthening procedures, humerus",78.32
169336,77.36,"Other division of bone, patella",77.36
169388,84.53,Implantation of internal limb lengthening device with kinetic distraction,84.53
169389,84.54,Implantation of other internal limb lengthening device,84.54
169414,81.04,"Dorsal and dorsolumbar fusion of the anterior column, anterior technique",81.04
169440,81.05,"Dorsal and dorsolumbar fusion of the posterior column, posterior technique",81.05
169725,38.69,"Other excision of vessels, lower limb veins",38.69
169978,38.41,"Resection of vessel with replacement, intracranial vessels",38.41
169979,38.61,"Other excision of vessels, intracranial vessels",38.61
170076,38.59,"Ligation and stripping of varicose veins, lower limb veins",38.59
170198,78.16,"Application of external fixator device, patella",78.16
170704,81.94,Suture of capsule or ligament of ankle and foot,81.94
171686,25.5,Repair of tongue and glossoplasty,25.5
171687,25.59,Other repair and plastic operations on tongue,25.59
171795,65.01,Laparoscopic oophorotomy,65.01
171796,65.31,Laparoscopic unilateral oophorectomy,65.31
171797,65.53,Laparoscopic removal of both ovaries at same operative episode,65.53
171798,65.54,Laparoscopic removal of remaining ovary,65.54
172224,23.2,Restoration of tooth by filling,23.2
172436,32.23,Open ablation of lung lesion or tissue,32.23
172437,32.24,Percutaneous ablation of lung lesion or tissue,32.24
172438,32.25,Thoracoscopic ablation of lung lesion or tissue,32.25
172439,32.26,Other and unspecified ablation of lung lesion or tissue,32.26
172856,89.42,Masters' two-step stress test,89.42
173164,32.21,Plication of emphysematous bleb,32.21
173449,12.63,Iridencleisis and iridotasis,12.63
173470,27.41,Labial frenectomy,27.41
173634,76.67,Reduction genioplasty,76.67
173698,85.55,Fat graft to breast,85.55
173719,22.01,Puncture of nasal sinus for aspiration or lavage,22.01
173760,33.1,Incision of lung,33.1
173834,77.05,"Sequestrectomy, femur",77.05
173938,12.35,Coreoplasty,12.35
174067,29.51,Suture of laceration of pharynx,29.51
174572,89.22,Cystometrogram,89.22
175063,02.11,Simple suture of dura mater of brain,02.11
175084,78.45,"Other repair or plastic operations on bone, femur",78.45
175145,21.06,Control of epistaxis by ligation of the external carotid artery,21.06
175271,26.32,Complete sialoadenectomy,26.32
175294,49.7,Repair of anus,49.7
175295,49.73,Closure of anal fistula,49.73
175296,49.74,Gracilis muscle transplant for anal incontinence,49.74
175297,49.75,Implantation or revision of artificial anal sphincter,49.75
175461,79.1,Closed reduction of fracture with internal fixation,79.1
175462,79.10,"Closed reduction of fracture with internal fixation, unspecified site",79.10
175463,79.19,"Closed reduction of fracture with internal fixation, other specified bone",79.19
175581,27.22,Biopsy of uvula and soft palate,27.22
175729,60.94,Control of (postoperative) hemorrhage of prostate,60.94
175807,04.44,Release of tarsal tunnel,04.44
175831,19.53,Type III tympanoplasty,19.53
175965,65.94,Ovarian denervation,65.94
175979,00.74,"Hip bearing surface, metal-on-polyethylene",00.74
175980,00.75,"Hip bearing surface, metal-on-metal",00.75
175981,00.76,"Hip bearing surface, ceramic-on-ceramic",00.76
175982,00.77,"Hip bearing surface, ceramic-on-polyethylene",00.77
175983,81.40,"Repair of hip, not elsewhere classified",81.40
176049,12.42,Excision of lesion of iris,12.42
176085,04.43,Release of carpal tunnel,04.43
176158,79.55,"Open reduction of separated epiphysis, femur",79.55
176441,28.5,Excision of lingual tonsil,28.5
176503,08.64,Reconstruction of eyelid with tarsoconjunctival flap,08.64
176514,30.22,Vocal cordectomy,30.22
176542,59.1,Incision of perivesical tissue,59.1
176543,59.11,Other lysis of perivesical adhesions,59.11
176544,59.19,Other incision of perivesical tissue,59.19
176588,82.54,Reattachment of muscle of hand,82.54
176657,27.91,Labial frenotomy,27.91
176926,65.12,Other biopsy of ovary,65.12
177096,88.36,Lymphangiogram of lower limb,88.36
177134,77.74,"Excision of bone for graft, carpals and metacarpals",77.74
177276,33.0,Incision of bronchus,33.0
177349,75.7,"Manual exploration of uterine cavity, postpartum",75.7
177433,14.24,Destruction of chorioretinal lesion by laser photocoagulation,14.24
177434,14.25,Destruction of chorioretinal lesion by photocoagulation of unspecified type,14.25
177523,55.95,Local perfusion of kidney,55.95
177600,35.93,Creation of conduit between left ventricle and aorta,35.93
177706,89.23,Urethral sphincter electromyogram,89.23
177736,33.31,Destruction of phrenic nerve for collapse of lung,33.31
177758,79.88,Open reduction of dislocation of foot and toe,79.88
177780,69.41,Suture of laceration of uterus,69.41
177914,88.56,Coronary arteriography using two catheters,88.56
178014,32.5,Pneumonectomy,32.5
178015,32.59,Other and unspecified pneumonectomy,32.59
178083,88.37,Other soft tissue x-ray of lower limb,88.37
178115,02.03,Formation of cranial bone flap,02.03
178254,96.51,Irrigation of eye,96.51
178276,66.8,Insufflation of fallopian tube,66.8
178314,03.96,Percutaneous denervation of facet,03.96
178446,77.73,"Excision of bone for graft, radius and ulna",77.73
178478,81.61,"360 degree spinal fusion, single incision approach",81.61
178550,35.23,Open and other replacement of mitral valve with tissue graft,35.23
178707,20.4,Mastoidectomy,20.4
178708,20.49,Other mastoidectomy,20.49
178862,15.13,Resection of one extraocular muscle,15.13
178930,70.11,Hymenotomy,70.11
179015,80.77,"Synovectomy, ankle",80.77
179078,67.12,Other cervical biopsy,67.12
179138,68.21,Division of endometrial synechiae,68.21
179715,30.21,Epiglottidectomy,30.21
179851,21.6,Turbinectomy,21.6
179852,21.61,Turbinectomy by diathermy or cryosurgery,21.61
179853,21.69,Other turbinectomy,21.69
179879,79.52,"Open reduction of separated epiphysis, radius and ulna",79.52
179892,77.0,Sequestrectomy,77.0
179893,77.00,"Sequestrectomy, unspecified site",77.00
179894,77.01,"Sequestrectomy, scapula, clavicle, and thorax [ribs and sternum]",77.01
179895,77.07,"Sequestrectomy, tibia and fibula",77.07
179896,77.08,"Sequestrectomy, tarsals and metatarsals",77.08
179897,77.09,"Sequestrectomy, other bones",77.09
179954,78.05,"Bone graft, femur",78.05
180050,49.41,Reduction of hemorrhoids,49.41
180067,80.96,"Other excision of joint, knee",80.96
180114,63.51,Suture of laceration of spermatic cord and epididymis,63.51
180153,56.42,Total ureterectomy,56.42
180228,11.75,Radial keratotomy,11.75
180413,67.5,Repair of internal cervical os,67.5
180415,67.59,Other repair of internal cervical os,67.59
180526,21.86,Limited rhinoplasty,21.86
180542,56.41,Partial ureterectomy,56.41
180830,58.41,Suture of laceration of urethra,58.41
181070,07.6,Hypophysectomy,07.6
181196,81.51,Total hip replacement,81.51
181363,53.7,"Repair of diaphragmatic hernia, abdominal approach",53.7
181364,53.71,"Laparoscopic repair of diaphragmatic hernia, abdominal approach",53.71
181365,53.72,"Other and open repair of diaphragmatic hernia, abdominal approach",53.72
181366,53.75,"Repair of diaphragmatic hernia, abdominal approach, not otherwise specified",53.75
181422,35.72,Other and unspecified repair of ventricular septal defect,35.72
181545,35.24,Open and other replacement of mitral valve,35.24
181637,76.61,Closed osteoplasty [osteotomy] of mandibular ramus,76.61
181795,58.4,Repair of urethra,58.4
181796,58.43,Closure of other fistula of urethra,58.43
181797,58.45,Repair of hypospadias or epispadias,58.45
181799,58.49,Other repair of urethra,58.49
181915,01.53,Lobectomy of brain,01.53
181950,22.0,Aspiration and lavage of nasal sinus,22.0
181951,22.00,"Aspiration and lavage of nasal sinus, not otherwise specified",22.00
181984,16.21,Ophthalmoscopy,16.21
182060,11.53,Repair of corneal laceration or wound with conjunctival flap,11.53
182142,21.81,Suture of laceration of nose,21.81
182154,88.53,Angiocardiography of left heart structures,88.53
182218,03.51,Repair of spinal meningocele,03.51
182389,57.85,Cystourethroplasty and plastic repair of bladder neck,57.85
182544,50.23,Open ablation of liver lesion or tissue,50.23
182545,50.24,Percutaneous ablation of liver lesion or tissue,50.24
182546,50.25,Laparoscopic ablation of liver lesion or tissue,50.25
182547,50.26,Other and unspecified ablation of liver lesion or tissue,50.26
182548,50.29,Other destruction of lesion of liver,50.29
182582,50.0,Hepatotomy,50.0
182691,02.04,Bone graft to skull,02.04
182803,88.26,Other skeletal x-ray of pelvis and hip,88.26
182804,88.27,"Skeletal x-ray of thigh, knee, and lower leg",88.27
182805,88.28,Skeletal x-ray of ankle and foot,88.28
182806,88.29,"Skeletal x-ray of lower limb, not otherwise specified",88.29
182967,80.52,Intervertebral chemonucleolysis,80.52
183038,67.2,Conization of cervix,67.2
183069,89.14,Electroencephalogram,89.14
183471,72.53,Total breech extraction with forceps to aftercoming head,72.53
183530,88.78,Diagnostic ultrasound of gravid uterus,88.78
183562,23.1,Surgical removal of tooth,23.1
183563,23.19,Other surgical extraction of tooth,23.19
183650,79.28,"Open reduction of fracture without internal fixation, phalanges of foot",79.28
183684,35.27,Open and other replacement of tricuspid valve with tissue graft,35.27
183799,80.17,"Other arthrotomy, ankle",80.17
183800,80.47,"Division of joint capsule, ligament, or cartilage, ankle",80.47
183871,87.84,Percutaneous hysterogram,87.84
183897,87.31,Endotracheal bronchogram,87.31
183912,87.71,Computerized axial tomography of kidney,87.71
184076,15.6,Revision of extraocular muscle surgery,15.6
184130,81.0,Spinal fusion,81.0
184131,81.00,"Spinal fusion, not otherwise specified",81.00
184132,81.02,"Other cervical fusion of the anterior column, anterior technique",81.02
184133,81.03,"Other cervical fusion of the posterior column, posterior technique",81.03
184136,84.51,Insertion of interbody spinal fusion device,84.51
184266,66.01,Salpingotomy,66.01
184351,87.17,Other x-ray of skull,87.17
184464,08.35,Repair of blepharoptosis by tarsal technique,08.35
184669,33.25,Open biopsy of bronchus,33.25
184774,04.74,Other anastomosis of cranial or peripheral nerve,04.74
184794,01.6,Excision of lesion of skull,01.6
184866,57.83,Repair of fistula involving bladder and intestine,57.83
184939,56.84,Closure of other fistula of ureter,56.84
185008,20.92,Revision of mastoidectomy,20.92
185063,60.72,Incision of seminal vesicle,60.72
185077,63.53,Transplantation of spermatic cord,63.53
185190,05.2,Sympathectomy,05.2
185191,05.29,Other sympathectomy and ganglionectomy,05.29
185288,14.51,Repair of retinal detachment with diathermy,14.51
185396,70.14,Other vaginotomy,70.14
185465,74.2,Extraperitoneal cesarean section,74.2
185503,77.67,"Local excision of lesion or tissue of bone, tibia and fibula",77.67
185532,04.73,Accessory-hypoglossal anastomosis,04.73
185607,79.35,"Open reduction of fracture with internal fixation, femur",79.35
185765,77.63,"Local excision of lesion or tissue of bone, radius and ulna",77.63
185947,08.34,Repair of blepharoptosis by other levator muscle techniques,08.34
186016,20.61,Fenestration of inner ear (initial),20.61
186187,35.33,Annuloplasty,35.33
186250,38.09,"Incision of vessel, lower limb veins",38.09
186330,10.6,Repair of laceration of conjunctiva,10.6
186341,23.11,Removal of residual root,23.11
186492,69.42,Closure of fistula of uterus,69.42
186508,35.95,Revision of corrective procedure on heart,35.95
186538,87.13,Temporomandibular contrast arthrogram,87.13
186602,26.91,Probing of salivary duct,26.91
186668,26.31,Partial sialoadenectomy,26.31
186687,77.96,"Total ostectomy, patella",77.96
186752,08.51,Canthotomy,08.51
186785,76.65,Segmental osteoplasty [osteotomy] of maxilla,76.65
186818,80.36,"Biopsy of joint structure, knee",80.36
187121,11.43,Cryotherapy of corneal lesion,11.43
187144,21.82,Closure of nasal fistula,21.82
187395,16.23,Biopsy of eyeball and orbit,16.23
187404,87.07,Contrast laryngogram,87.07
187431,61.42,Repair of scrotal fistula,61.42
187493,95.24,Electronystagmogram [ENG],95.24
187539,85.82,Split-thickness graft to breast,85.82
187642,40.54,Radical groin dissection,40.54
187844,14.74,Other mechanical vitrectomy,14.74
188021,11.6,Corneal transplant,11.6
188022,11.60,"Corneal transplant, not otherwise specified",11.60
188023,11.62,Other lamellar keratoplasty,11.62
188025,11.69,Other corneal transplant,11.69
188086,86.91,Excision of skin for graft,86.91
188119,56.91,Dilation of ureteral meatus,56.91
188167,80.18,"Other arthrotomy, foot and toe",80.18
188324,79.32,"Open reduction of fracture with internal fixation, radius and ulna",79.32
188899,65.76,Laparoscopic salpingo-oophoroplasty,65.76
189597,81.54,Total knee replacement,81.54
189763,65.92,Transplantation of ovary,65.92
190019,35.50,Repair of unspecified septal defect of heart with prosthesis,35.50
190041,65.95,Release of torsion of ovary,65.95
190060,80.6,Excision of semilunar cartilage of knee,80.6
190100,76.66,Total osteoplasty [osteotomy] of maxilla,76.66
190235,44.02,Highly selective vagotomy,44.02
190394,22.42,Frontal sinusectomy,22.42
190433,38.89,"Other surgical occlusion of vessels, lower limb veins",38.89
190504,80.16,"Other arthrotomy, knee",80.16
190505,80.46,"Division of joint capsule, ligament, or cartilage, knee",80.46
190880,64.92,Incision of penis,64.92
190897,79.38,"Open reduction of fracture with internal fixation, phalanges of foot",79.38
190972,55.85,Symphysiotomy for horseshoe kidney,55.85
191150,72.2,Mid forceps operation,72.2
191151,72.29,Other mid forceps operation,72.29
191186,78.75,"Osteoclasis, femur",78.75
191228,88.92,Magnetic resonance imaging of chest and myocardium,88.92
191236,66.69,Other partial salpingectomy,66.69
191261,03.21,Percutaneous chordotomy,03.21
191321,38.08,"Incision of vessel, lower limb arteries",38.08
191377,20.31,Electrocochleography,20.31
191426,11.1,Incision of cornea,11.1
191505,76.46,Other reconstruction of other facial bone,76.46
191538,57.7,Total cystectomy,57.7
191539,57.79,Other total cystectomy,57.79
191628,78.76,"Osteoclasis, patella",78.76
191652,95.23,Visual evoked potential [VEP],95.23
191711,20.42,Radical mastoidectomy,20.42
191821,57.84,Repair of other fistula of bladder,57.84
191956,81.11,Ankle fusion,81.11
192069,66.22,Bilateral endoscopic ligation and division of fallopian tubes,66.22
192282,02.2,Ventriculostomy,02.2
192291,02.21,Insertion or replacement of external ventricular drain [EVD],02.21
192459,57.71,Radical cystectomy,57.71
192516,03.53,Repair of vertebral fracture,03.53
192517,81.66,Percutaneous vertebral augmentation,81.66
192581,88.81,Cerebral thermography,88.81
192590,58.5,Release of urethral stricture,58.5
192675,77.22,"Wedge osteotomy, humerus",77.22
192704,35.02,"Closed heart valvotomy, mitral valve",35.02
192896,14.27,Destruction of chorioretinal lesion by implantation of radiation source,14.27
192960,79.12,"Closed reduction of fracture with internal fixation, radius and ulna",79.12
192993,77.82,"Other partial ostectomy, humerus",77.82
193061,99.94,Prostatic massage,99.94
193286,70.73,Repair of rectovaginal fistula,70.73
193392,31.63,Revision of laryngostomy,31.63
193522,18.31,Radical excision of lesion of external ear,18.31
193551,44.0,Vagotomy,44.0
193552,44.00,"Vagotomy, not otherwise specified",44.00
193553,44.03,Other selective vagotomy,44.03
193673,70.63,Vaginal construction with graft or prosthesis,70.63
193777,60.11,Closed [percutaneous] [needle] biopsy of prostate,60.11
193840,82.59,Other hand muscle transposition,82.59
193933,07.63,"Partial excision of pituitary gland, unspecified approach",07.63
194033,79.75,Closed reduction of dislocation of hip,79.75
194107,80.37,"Biopsy of joint structure, ankle",80.37
194166,59.4,Suprapubic sling operation,59.4
194268,09.8,Fistulization of lacrimal tract to nasal cavity,09.8
194346,95.21,Electroretinogram [ERG],95.21
194386,14.35,Repair of retinal tear by photocoagulation of unspecified type,14.35
194434,33.20,Thoracoscopic lung biopsy,33.20
194517,29.91,Dilation of pharynx,29.91
194561,80.27,"Arthroscopy, ankle",80.27
194585,13.11,Intracapsular extraction of lens by temporal inferior route,13.11
194596,96.52,Irrigation of ear,96.52
194680,30.3,Complete laryngectomy,30.3
194901,56.73,"Nephrocystanastomosis, not otherwise specified",56.73
194978,31.72,Closure of external fistula of trachea,31.72
195076,18.72,Reattachment of amputated ear,18.72
195120,84.25,Toe reattachment,84.25
195170,11.51,Suture of corneal laceration,11.51
195241,53.82,Repair of parasternal hernia,53.82
195265,19.11,Stapedectomy with incus replacement,19.11
195287,78.46,"Other repair or plastic operations on bone, patella",78.46
195361,09.71,Correction of everted punctum,09.71
195398,36.10,"Aortocoronary bypass for heart revascularization, not otherwise specified",36.10
195501,80.08,"Arthrotomy for removal of prosthesis without replacement, foot and toe",80.08
195691,76.0,Incision of facial bone without division,76.0
195692,76.09,Other incision of facial bone,76.09
195733,65.11,Aspiration biopsy of ovary,65.11
195787,16.62,Revision and reinsertion of ocular implant,16.62
195820,60.4,Retropubic prostatectomy,60.4
195879,76.62,Open osteoplasty [osteotomy] of mandibular ramus,76.62
195919,07.64,"Total excision of pituitary gland, transfrontal approach",07.64
195987,78.25,"Limb shortening procedures, femur",78.25
196026,01.28,Placement of intracerebral catheter(s) via burr hole(s),01.28
196134,13.2,Extracapsular extraction of lens by linear extraction technique,13.2
196277,35.14,Open heart valvuloplasty of tricuspid valve without replacement,35.14
196318,08.6,Reconstruction of eyelid with flaps or grafts,08.6
196319,08.69,Other reconstruction of eyelid with flaps or grafts,08.69
196333,87.16,Other x-ray of facial bones,87.16
196413,20.5,Other excision of middle ear,20.5
196414,20.59,Other excision of middle ear,20.59
196493,10.41,Repair of symblepharon with free graft,10.41
196573,07.72,Incision of pituitary gland,07.72
196648,19.54,Type IV tympanoplasty,19.54
196735,68.15,Closed biopsy of uterine ligaments,68.15
196752,25.2,Partial glossectomy,25.2
196854,15.5,Transposition of extraocular muscles,15.5
196888,89.16,Transillumination of newborn skull,89.16
197081,19.1,Stapedectomy,19.1
197082,19.19,Other stapedectomy,19.19
197299,96.53,Irrigation of nasal passages,96.53
197373,34.84,Other repair of diaphragm,34.84
197410,02.3,Extracranial ventricular shunt,02.3
197411,02.34,Ventricular shunt to abdominal cavity and organs,02.34
197412,02.39,Ventricular shunt to extracranial site NEC,02.39
197446,04.75,Revision of previous repair of cranial and peripheral nerves,04.75
197476,78.56,"Internal fixation of bone without fracture reduction, patella",78.56
197514,29.92,Division of glossopharyngeal nerve,29.92
197563,80.25,"Arthroscopy, hip",80.25
197737,08.36,Repair of blepharoptosis by other techniques,08.36
197855,38.24,Intravascular imaging of coronary vessel(s) by optical coherence tomography [OCT],38.24
198017,29.4,Plastic operation on pharynx,29.4
198038,25.02,Open biopsy of tongue,25.02
198054,29.5,Other repair of pharynx,29.5
198055,29.59,Other repair of pharynx,29.59
199076,27.53,Closure of fistula of mouth,27.53
199558,79.2,Open reduction of fracture without internal fixation,79.2
199559,79.20,"Open reduction of fracture without internal fixation, unspecified site",79.20
199560,79.22,"Open reduction of fracture without internal fixation, radius and ulna",79.22
199561,79.23,"Open reduction of fracture without internal fixation, carpals and metacarpals",79.23
199564,79.26,"Open reduction of fracture without internal fixation, tibia and fibula",79.26
199565,79.27,"Open reduction of fracture without internal fixation, tarsals and metatarsals",79.27
199567,79.29,"Open reduction of fracture without internal fixation, other specified bone",79.29
199624,25.91,Lingual frenotomy,25.91
199825,79.08,"Closed reduction of fracture without internal fixation, phalanges of foot",79.08
199948,12.85,Repair of scleral staphyloma with graft,12.85
200952,79.07,"Closed reduction of fracture without internal fixation, tarsals and metatarsals",79.07
