,concept_code_y,concept_name_y,icd
201324,77.57,Repair of claw toe,77.57
201427,55.6,Transplant of kidney,55.6
201428,55.69,Other kidney transplantation,55.69
201561,02.02,Elevation of skull fracture fragments,02.02
201633,16.01,Orbitotomy with bone flap,16.01
201821,79.04,"Closed reduction of fracture without internal fixation, phalanges of hand",79.04
202173,62.12,Open biopsy of testis,62.12
202194,60.61,Local excision of lesion of prostate,60.61
202228,63.81,Suture of laceration of vas deferens and epididymis,63.81
202503,22.11,Closed [endoscopic] [needle] biopsy of nasal sinus,22.11
202514,26.12,Open biopsy of salivary gland or duct,26.12
202530,65.13,Laparoscopic biopsy of ovary,65.13
202546,89.51,Rhythm electrocardiogram,89.51
202554,27.52,Suture of laceration of other part of mouth,27.52
202569,27.51,Suture of laceration of lip,27.51
202725,28.92,Excision of lesion of tonsil and adenoid,28.92
202741,70.8,Obliteration of vaginal vault,70.8
202779,19.21,Revision of stapedectomy with incus replacement,19.21
203780,24.12,Biopsy of alveolus,24.12
203824,34.05,Creation of pleuroperitoneal shunt,34.05
203968,49.95,Control of (postoperative) hemorrhage of anus,49.95
204511,11.63,Penetrating keratoplasty with autograft,11.63
204980,78.7,Osteoclasis,78.7
204981,78.70,"Osteoclasis, unspecified site",78.70
204982,78.71,"Osteoclasis, scapula, clavicle, and thorax [ribs and sternum]",78.71
204983,78.73,"Osteoclasis, radius and ulna",78.73
204984,78.77,"Osteoclasis, tibia and fibula",78.77
204985,78.79,"Osteoclasis, other bones",78.79
205026,12.72,Cyclocryotherapy,12.72
205691,72.4,Forceps rotation of fetal head,72.4
205848,50.22,Partial hepatectomy,50.22
206397,58.0,Urethrotomy,58.0
206459,32.27,"Bronchoscopic bronchial thermoplasty, ablation of airway smooth muscle",32.27
206508,00.85,"Resurfacing hip, total, acetabulum and femoral head",00.85
206796,54.93,Creation of cutaneoperitoneal fistula,54.93
207106,57.82,Closure of cystostomy,57.82
207378,78.78,"Osteoclasis, tarsals and metatarsals",78.78
207656,26.2,Excision of lesion of salivary gland,26.2
207657,26.29,Other excision of salivary gland lesion,26.29
207658,26.3,Sialoadenectomy,26.3
207659,26.30,"Sialoadenectomy, not otherwise specified",26.30
208234,79.42,"Closed reduction of separated epiphysis, radius and ulna",79.42
208682,86.03,Incision of pilonidal sinus or cyst,86.03
208952,62.61,Suture of laceration of testis,62.61
209068,33.48,Other repair and plastic operations on bronchus,33.48
209130,84.94,Insertion of sternal fixation device with rigid plates,84.94
209420,64.0,Circumcision,64.0
209908,60.0,Incision of prostate,60.0
210024,53.8,"Repair of diaphragmatic hernia, thoracic approach",53.8
210025,53.80,"Repair of diaphragmatic hernia with thoracic approach, not otherwise specified",53.80
210026,53.83,"Laparoscopic repair of diaphragmatic hernia, with thoracic approach",53.83
210027,53.84,"Other and open repair of diaphragmatic hernia, with thoracic approach",53.84
210340,81.95,Suture of capsule or ligament of other lower extremity,81.95
210467,10.1,Other incision of conjunctiva,10.1
210553,70.31,Hymenectomy,70.31
210588,21.84,Revision rhinoplasty,21.84
210633,30,Excision of larynx,30
210634,30.0,Excision or destruction of lesion or tissue of larynx,30.0
210635,30.2,Other partial laryngectomy,30.2
210743,88.21,Skeletal x-ray of shoulder and upper arm,88.21
210744,88.22,Skeletal x-ray of elbow and forearm,88.22
210745,88.23,Skeletal x-ray of wrist and hand,88.23
210746,88.24,"Skeletal x-ray of upper limb, not otherwise specified",88.24
210878,05.23,Lumbar sympathectomy,05.23
210990,27.56,Other skin graft to lip and mouth,27.56
211004,79.11,"Closed reduction of fracture with internal fixation, humerus",79.11
211026,04.3,Suture of cranial and peripheral nerves,04.3
211261,57.81,Suture of laceration of bladder,57.81
211751,16.92,Excision of lesion of orbit,16.92
211843,89.53,Vectorcardiogram (with ECG),89.53
212315,56.62,Revision of other cutaneous ureterostomy,56.62
212568,33.71,"Endoscopic insertion or replacement of bronchial valve(s), single lobe",33.71
212574,33.73,"Endoscopic insertion or replacement of bronchial valve(s), multiple lobes",33.73
212717,12.41,"Destruction of lesion of iris, nonexcisional",12.41
213114,00.87,"Resurfacing hip, partial, acetabulum",00.87
213651,57.8,Other repair of urinary bladder,57.8
213652,57.89,Other repair of bladder,57.89
213938,35.12,Open heart valvuloplasty of mitral valve without replacement,35.12
214024,67.32,Destruction of lesion of cervix by cauterization,67.32
214201,64.91,Dorsal or lateral slit of prepuce,64.91
214252,83.74,Reattachment of muscle,83.74
214418,16.0,Orbitotomy,16.0
214419,16.09,Other orbitotomy,16.09
214609,12.81,Suture of laceration of sclera,12.81
214771,56.95,Ligation of ureter,56.95
214965,79.85,Open reduction of dislocation of hip,79.85
215022,02.14,Choroid plexectomy,02.14
215112,14.72,Other removal of vitreous,14.72
215161,09.53,Incision of lacrimal sac,09.53
215227,22.41,Frontal sinusotomy,22.41
215248,68.51,Laparoscopically assisted vaginal hysterectomy (LAVH),68.51
215414,32.41,Thoracoscopic lobectomy of lung,32.41
215464,35.84,"Total correction of transposition of great vessels, not elsewhere classified",35.84
215628,09.0,Incision of lacrimal gland,09.0
215645,10.4,Conjunctivoplasty,10.4
215648,10.49,Other conjunctivoplasty,10.49
215678,09.73,Repair of canaliculus,09.73
215813,20.51,Excision of lesion of middle ear,20.51
215958,60.13,Closed [percutaneous] biopsy of seminal vesicles,60.13
215959,60.14,Open biopsy of seminal vesicles,60.14
216744,26.0,Incision of salivary gland or duct,26.0
217173,18.11,Otoscopy,18.11
217196,79.0,Closed reduction of fracture without internal fixation,79.0
217197,79.00,"Closed reduction of fracture without internal fixation, unspecified site",79.00
217198,79.02,"Closed reduction of fracture without internal fixation, radius and ulna",79.02
217199,79.03,"Closed reduction of fracture without internal fixation, carpals and metacarpals",79.03
217205,79.09,"Closed reduction of fracture without internal fixation, other specified bone",79.09
217508,05.25,Periarterial sympathectomy,05.25
217582,18.02,Incision of external auditory canal,18.02
217891,65.93,Manual rupture of ovarian cyst,65.93
217953,65.5,Bilateral oophorectomy,65.5
217954,65.51,Other removal of both ovaries at same operative episode,65.51
217955,65.52,Other removal of remaining ovary,65.52
218061,81.46,Other repair of the collateral ligaments,81.46
218088,01.32,Lobotomy and tractotomy,01.32
218110,80.76,"Synovectomy, knee",80.76
218489,55.87,Correction of ureteropelvic junction,55.87
218796,04.41,Decompression of trigeminal nerve root,04.41
219049,84.19,Abdominopelvic amputation,84.19
219899,88.75,Diagnostic ultrasound of urinary system,88.75
220000,86.82,Facial rhytidectomy,86.82
220035,04.05,Gasserian ganglionectomy,04.05
220164,14.52,Repair of retinal detachment with cryotherapy,14.52
220239,87.05,Contrast dacryocystogram,87.05
220315,77.77,"Excision of bone for graft, tibia and fibula",77.77
220327,77.78,"Excision of bone for graft, tarsals and metatarsals",77.78
220339,77.76,"Excision of bone for graft, patella",77.76
220351,77.75,"Excision of bone for graft, femur",77.75
220516,67.33,Destruction of lesion of cervix by cryosurgery,67.33
220607,35.41,Enlargement of existing atrial septal defect,35.41
220865,29.0,Pharyngotomy,29.0
221145,08.63,Reconstruction of eyelid with hair follicle graft,08.63
221245,34.09,Other incision of pleura,34.09
221257,66.96,Dilation of fallopian tube,66.96
221291,15.1,Operations on one extraocular muscle involving temporary detachment from globe,15.1
221292,15.19,Other operations on one extraocular muscle involving temporary detachment from globe,15.19
221708,37.20,Noninvasive programmed electrical stimulation [NIPS],37.20
221783,74.1,Low cervical cesarean section,74.1
221786,28.0,Incision and drainage of tonsil and peritonsillar structures,28.0
221974,59.6,Paraurethral suspension,59.6
222027,14.55,Repair of retinal detachment with photocoagulation of unspecified type,14.55
222136,88.66,Phlebography of femoral and other lower extremity veins using contrast material,88.66
222227,76.45,Other total ostectomy of other facial bone,76.45
222299,09.51,Incision of lacrimal punctum,09.51
222514,49.11,Anal fistulotomy,49.11
222532,18.12,Biopsy of external ear,18.12
222590,79.51,"Open reduction of separated epiphysis, humerus",79.51
222600,79.16,"Closed reduction of fracture with internal fixation, tibia and fibula",79.16
222639,09.83,Conjunctivorhinostomy with insertion of tube or stent,09.83
222667,84.17,Amputation above knee,84.17
222763,33.42,Closure of bronchial fistula,33.42
222815,80.05,"Arthrotomy for removal of prosthesis without replacement, hip",80.05
222926,93.46,Other skin traction of limbs,93.46
223068,22.5,Other nasal sinusotomy,22.5
223069,22.50,"Sinusotomy, not otherwise specified",22.50
223191,88.52,Angiocardiography of right heart structures,88.52
223300,37.32,Excision of aneurysm of heart,37.32
223320,15.7,Repair of injury of extraocular muscle,15.7
223361,76.41,Total mandibulectomy with synchronous reconstruction,76.41
223412,30.29,Other partial laryngectomy,30.29
223698,23.3,Restoration of tooth by inlay,23.3
223718,02.92,Repair of brain,02.92
223823,64.3,Amputation of penis,64.3
223854,08.86,Lower eyelid rhytidectomy,08.86
223876,56.75,Transureteroureterostomy,56.75
223935,78.0,Bone graft,78.0
223936,78.00,"Bone graft, unspecified site",78.00
223937,78.01,"Bone graft, scapula, clavicle, and thorax [ribs and sternum]",78.01
223938,78.03,"Bone graft, radius and ulna",78.03
223939,78.07,"Bone graft, tibia and fibula",78.07
223940,78.08,"Bone graft, tarsals and metatarsals",78.08
223941,78.09,"Bone graft, other bones",78.09
223942,84.52,Insertion of recombinant bone morphogenetic protein,84.52
224206,08.24,"Excision of major lesion of eyelid, full-thickness",08.24
224235,79.65,"Debridement of open fracture site, femur",79.65
224270,63.72,Ligation of spermatic cord,63.72
224315,01.31,Incision of cerebral meninges,01.31
224329,36.2,Heart revascularization by arterial implant,36.2
224330,36.3,Other heart revascularization,36.3
224331,36.39,Other heart revascularization,36.39
224360,07.53,Partial excision of pineal gland,07.53
224485,64.4,Repair and plastic operation on penis,64.4
224486,64.49,Other repair of penis,64.49
224537,55.4,Partial nephrectomy,55.4
224650,04.76,Repair of old traumatic injury of cranial and peripheral nerves,04.76
224775,21.02,Control of epistaxis by posterior (and anterior) packing,21.02
224871,66.11,Biopsy of fallopian tube,66.11
224896,53.81,Plication of the diaphragm,53.81
224957,58.47,Urethral meatoplasty,58.47
225007,76.01,Sequestrectomy of facial bone,76.01
225058,26.41,Suture of laceration of salivary gland,26.41
225112,38.81,"Other surgical occlusion of vessels, intracranial vessels",38.81
225146,09.91,Obliteration of lacrimal punctum,09.91
225239,26.4,Repair of salivary gland or duct,26.4
225369,07.14,"Biopsy of pituitary gland, transsphenoidal approach",07.14
225502,15.12,Advancement of one extraocular muscle,15.12
225524,50.12,Open biopsy of liver,50.12
225697,02.32,Ventricular shunt to circulatory system,02.32
225724,77.97,"Total ostectomy, tibia and fibula",77.97
225785,39.63,Cardioplegia,39.63
225795,01.23,Reopening of craniotomy site,01.23
225831,14.21,Destruction of chorioretinal lesion by diathermy,14.21
225945,29.31,Cricopharyngeal myotomy,29.31
225995,05.0,Division of sympathetic nerve or ganglion,05.0
226062,65.3,Unilateral oophorectomy,65.3
226063,65.39,Other unilateral oophorectomy,65.39
226164,35.03,"Closed heart valvotomy, pulmonary valve",35.03
226467,89.26,Gynecological examination,89.26
226650,27.73,Repair of uvula,27.73
226961,11.31,Transposition of pterygium,11.31
226999,12.88,Other scleral reinforcement,12.88
227083,74.0,Classical cesarean section,74.0
227110,49.42,Injection of hemorrhoids,49.42
227215,58.44,Reanastomosis of urethra,58.44
227267,78.72,"Osteoclasis, humerus",78.72
227341,84.09,Interthoracoscapular amputation,84.09
227379,34.6,Scarification of pleura,34.6
227428,20.93,Repair of oval and round windows,20.93
227473,89.13,Neurologic examination,89.13
227523,82.36,Other myectomy of hand,82.36
227692,89.56,Carotid pulse tracing with ECG lead,89.56
227777,12.65,Other scleral fistulization with iridectomy,12.65
227832,77.8,Other partial ostectomy,77.8
227833,77.80,"Other partial ostectomy, unspecified site",77.80
227834,77.81,"Other partial ostectomy, scapula, clavicle, and thorax [ribs and sternum]",77.81
227835,77.87,"Other partial ostectomy, tibia and fibula",77.87
227836,77.88,"Other partial ostectomy, tarsals and metatarsals",77.88
227837,77.89,"Other partial ostectomy, other bones",77.89
227915,57.12,Lysis of intraluminal adhesions with incision into bladder,57.12
227989,14.54,Repair of retinal detachment with laser photocoagulation,14.54
228002,14.26,Destruction of chorioretinal lesion by radiation therapy,14.26
228039,87.82,Gas contrast hysterosalpingogram,87.82
228120,62.5,Orchiopexy,62.5
228176,76.44,Total ostectomy of other facial bone with synchronous reconstruction,76.44
228205,79.63,"Debridement of open fracture site, carpals and metacarpals",79.63
228239,12.93,Removal or destruction of epithelial downgrowth from anterior chamber,12.93
228246,12.86,Other repair of scleral staphyloma,12.86
228311,37.4,Repair of heart and pericardium,37.4
228312,37.41,Implantation of prosthetic cardiac support device around the heart,37.41
228313,37.49,Other repair of heart and pericardium,37.49
228329,33.22,Fiber-optic bronchoscopy,33.22
228400,57.31,Cystoscopy through artificial stoma,57.31
228408,79.21,"Open reduction of fracture without internal fixation, humerus",79.21
228572,87.32,Other contrast bronchogram,87.32
228610,81.06,"Lumbar and lumbosacral fusion of the anterior column, anterior technique",81.06
228632,50.3,Lobectomy of liver,50.3
228655,04.42,Other cranial nerve decompression,04.42
228806,89.35,Transillumination of nasal sinuses,89.35
228911,07.61,"Partial excision of pituitary gland, transfrontal approach",07.61
228995,87.06,Contrast radiogram of nasopharynx,87.06
229154,16.51,Exenteration of orbit with removal of adjacent structures,16.51
229423,89.57,Apexcardiogram (with ECG lead),89.57
229432,04.71,Hypoglossal-facial anastomosis,04.71
229522,48.4,Pull-through resection of rectum,48.4
229523,48.40,"Pull-through resection of rectum, not otherwise specified",48.40
229524,48.42,Laparoscopic pull-through resection of rectum,48.42
229525,48.43,Open pull-through resection of rectum,48.43
229526,48.49,Other pull-through resection of rectum,48.49
229680,39.25,Aorta-iliac-femoral bypass,39.25
229747,49.12,Anal fistulectomy,49.12
230534,02.35,Ventricular shunt to urinary system,02.35
230556,55.21,Nephroscopy,55.21
230594,56.85,Ureteropexy,56.85
230730,67.0,Dilation of cervical canal,67.0
230821,38.39,"Resection of vessel with anastomosis, lower limb veins",38.39
230885,12.5,Facilitation of intraocular circulation,12.5
230886,12.59,Other facilitation of intraocular circulation,12.59
231143,33.5,Lung transplant,33.5
231144,33.50,"Lung transplantation, not otherwise specified",33.50
231202,35.26,Open and other replacement of pulmonary valve,35.26
231216,35.07,Endovascular replacement of pulmonary valve,35.07
231217,35.08,Transapical replacement of pulmonary valve,35.08
231299,12.55,Cyclodialysis,12.55
231369,22.64,Sphenoidectomy,22.64
231443,86.51,Replantation of scalp,86.51
231501,76.43,Other reconstruction of mandible,76.43
231617,80.75,"Synovectomy, hip",80.75
231860,12.44,Excision of lesion of ciliary body,12.44
231893,02.33,Ventricular shunt to thoracic cavity,02.33
231917,04.6,Transposition of cranial and peripheral nerves,04.6
231928,66.21,Bilateral endoscopic ligation and crushing of fallopian tubes,66.21
232220,14.4,Repair of retinal detachment with scleral buckling and implant,14.4
232221,14.5,Other repair of retinal detachment,14.5
232222,14.59,Other repair of retinal detachment,14.59
232283,19.55,Type V tympanoplasty,19.55
232322,81.57,Replacement of joint of foot and toe,81.57
232617,22.31,Radical maxillary antrotomy,22.31
232684,49.5,Division of anal sphincter,49.5
232685,49.59,Other anal sphincterotomy,49.59
232773,35.53,"Repair of ventricular septal defect with prosthesis, open technique",35.53
232774,35.55,"Repair of ventricular septal defect with prosthesis, closed technique",35.55
232862,72.3,High forceps operation,72.3
232863,72.39,Other high forceps operation,72.39
232892,33.49,Other repair and plastic operations on lung,33.49
233179,60.2,Transurethral prostatectomy,60.2
233180,60.29,Other transurethral prostatectomy,60.29
233206,36.1,Bypass anastomosis for heart revascularization,36.1
233208,36.17,Abdominal-coronary artery bypass,36.17
233209,36.19,Other bypass anastomosis for heart revascularization,36.19
233249,09.43,Probing of nasolacrimal duct,09.43
233268,33.93,Puncture of lung,33.93
233339,79.01,"Closed reduction of fracture without internal fixation, humerus",79.01
233492,60.6,Other prostatectomy,60.6
233493,60.69,Other prostatectomy,60.69
233561,36.12,(Aorto)coronary bypass of two coronary arteries,36.12
233823,79.14,"Closed reduction of fracture with internal fixation, phalanges of hand",79.14
233845,77.7,Excision of bone for graft,77.7
233846,77.70,"Excision of bone for graft, unspecified site",77.70
233847,77.71,"Excision of bone for graft, scapula, clavicle, and thorax [ribs and sternum]",77.71
233848,77.79,"Excision of bone for graft, other bones",77.79
233904,80.97,"Other excision of joint, ankle",80.97
233950,95.43,Audiological evaluation,95.43
234245,49.47,Evacuation of thrombosed hemorrhoids,49.47
234302,12.66,Postoperative revision of scleral fistulization procedure,12.66
234366,15.11,Recession of one extraocular muscle,15.11
234434,34.91,Thoracentesis,34.91
234521,04.91,Neurectasis,04.91
234576,21.62,Fracture of the turbinates,21.62
234616,19.2,Revision of stapedectomy,19.2
234617,19.29,Other revision of stapedectomy,19.29
234884,81.13,Subtalar fusion,81.13
234962,75.50,"Repair of current obstetric laceration of uterus, not otherwise specified",75.50
234963,75.52,Repair of current obstetric laceration of corpus uteri,75.52
234982,81.21,Arthrodesis of hip,81.21
235066,76.95,Other manipulation of temporomandibular joint,76.95
235129,80.95,"Other excision of joint, hip",80.95
235203,82.22,Excision of lesion of muscle of hand,82.22
