,concept_code_y,concept_name_y,opcs
9,14.53,Repair of retinal detachment with xenon arc photocoagulation,14.53
64,12.87,Scleral reinforcement with graft,12.87
217,10.42,Reconstruction of conjunctival cul-de-sac with free graft,10.42
257,14.34,Repair of retinal tear by laser photocoagulation,14.34
319,88.82,Ocular thermography,88.82
557,12.83,"Revision of operative wound of anterior segment, not elsewhere classified",12.83
588,13.5,Other extracapsular extraction of lens,13.5
589,13.59,Other extracapsular extraction of lens,13.59
708,10.32,Destruction of lesion of conjunctiva,10.32
709,10.33,Other destructive procedures on conjunctiva,10.33
748,89.11,Tonometry,89.11
803,14.32,Repair of retinal tear by cryotherapy,14.32
863,16.4,Enucleation of eyeball,16.4
864,16.41,Enucleation of eyeball with synchronous implant into Tenon's capsule with attachment of muscles,16.41
865,16.42,Enucleation of eyeball with other synchronous implant,16.42
866,16.49,Other enucleation of eyeball,16.49
1290,13.1,Intracapsular extraction of lens,13.1
1291,13.19,Other intracapsular extraction of lens,13.19
1423,14.71,"Removal of vitreous, anterior approach",14.71
1504,14.41,Scleral buckling with implant,14.41
1592,13.3,Extracapsular extraction of lens by simple aspiration (and irrigation) technique,13.3
1659,13.64,Discission of secondary membrane [after cataract],13.64
1671,12.43,"Destruction of lesion of ciliary body, nonexcisional",12.43
1702,95.13,Ultrasound study of eye,95.13
1733,95.11,Fundus photography,95.11
1899,10.0,Removal of embedded foreign body from conjunctiva by incision,10.0
1995,14.33,Repair of retinal tear by xenon arc photocoagulation,14.33
2070,11.71,Keratomileusis,11.71
2184,12.39,Other iridoplasty,12.39
3039,12.22,Biopsy of iris,12.22
3090,11.21,Scraping of cornea for smear or culture,11.21
3181,14.49,Other scleral buckling,14.49
3426,11.5,Repair of cornea,11.5
3427,11.59,Other repair of cornea,11.59
3450,11.7,Other reconstructive and refractive surgery on cornea,11.7
3451,11.79,Other reconstructive and refractive surgery on cornea,11.79
3500,12.61,Trephination of sclera with iridectomy,12.61
3530,16.31,Removal of ocular contents with synchronous implant into scleral shell,16.31
3564,12.11,Iridotomy with transfixion,12.11
3635,10.21,Biopsy of conjunctiva,10.21
3696,12.64,Trabeculectomy ab externo,12.64
4110,13.66,Mechanical fragmentation of secondary membrane [after cataract],13.66
4160,10.44,Other free graft to conjunctiva,10.44
4260,12.73,Cyclophotocoagulation,12.73
4314,12.53,Goniotomy with goniopuncture,12.53
4335,12.52,Goniotomy without goniopuncture,12.52
4354,12.71,Cyclodiathermy,12.71
4422,12.74,"Diminution of ciliary body, not otherwise specified",12.74
4471,12.82,Repair of scleral fistula,12.82
4481,12.91,Therapeutic evacuation of anterior chamber,12.91
4497,12.14,Other iridectomy,12.14
4570,14.22,Destruction of chorioretinal lesion by cryotherapy,14.22
4626,16.82,Repair of rupture of eyeball,16.82
4658,16.3,Evisceration of eyeball,16.3
4659,16.39,Other evisceration of eyeball,16.39
4677,16.93,"Excision of lesion of eye, unspecified structure",16.93
4732,12.62,Thermocauterization of sclera with iridectomy,12.62
4744,12.40,"Removal of lesion of anterior segment of eye, not otherwise specified",12.40
4819,12.12,Other iridotomy,12.12
4958,11.61,Lamellar keratoplasty with autograft,11.61
4973,95.25,Electromyogram of eye [EMG],95.25
4984,10.43,Other reconstruction of conjunctival cul-de-sac,10.43
4995,11.74,Thermokeratoplasty,11.74
5043,13.42,Mechanical phacofragmentation and aspiration of cataract by posterior route,13.42
5058,10.31,Excision of lesion or tissue of conjunctiva,10.31
5104,11.3,Excision of pterygium,11.3
5105,11.39,Other excision of pterygium,11.39
5347,09.82,Conjunctivocystorhinostomy,09.82
5512,12.21,Diagnostic aspiration of anterior chamber of eye,12.21
5580,11.76,Epikeratophakia,11.76
5605,11.32,Excision of pterygium with corneal graft,11.32
6205,14.23,Destruction of chorioretinal lesion by xenon arc photocoagulation,14.23
6404,11.64,Other penetrating keratoplasty,11.64
7047,14.73,Mechanical vitrectomy by anterior approach,14.73
7147,12.13,Excision of prolapsed iris,12.13
7391,12.54,Trabeculotomy ab externo,12.54
7414,11.22,Biopsy of cornea,11.22
7437,13.71,"Insertion of intraocular lens prosthesis at time of cataract extraction, one-stage",13.71
7531,12.63,Iridencleisis and iridotasis,12.63
7550,12.35,Coreoplasty,12.35
7690,12.42,Excision of lesion of iris,12.42
7744,14.24,Destruction of chorioretinal lesion by laser photocoagulation,14.24
7745,14.25,Destruction of chorioretinal lesion by photocoagulation of unspecified type,14.25
7783,96.51,Irrigation of eye,96.51
7856,11.75,Radial keratotomy,11.75
7901,16.21,Ophthalmoscopy,16.21
7939,11.53,Repair of corneal laceration or wound with conjunctival flap,11.53
8055,14.51,Repair of retinal detachment with diathermy,14.51
8132,10.6,Repair of laceration of conjunctiva,10.6
8176,11.43,Cryotherapy of corneal lesion,11.43
8266,14.74,Other mechanical vitrectomy,14.74
8292,11.6,Corneal transplant,11.6
8293,11.60,"Corneal transplant, not otherwise specified",11.60
8294,11.62,Other lamellar keratoplasty,11.62
8296,11.69,Other corneal transplant,11.69
8434,11.1,Incision of cornea,11.1
8540,14.27,Destruction of chorioretinal lesion by implantation of radiation source,14.27
8631,95.21,Electroretinogram [ERG],95.21
8655,14.35,Repair of retinal tear by photocoagulation of unspecified type,14.35
8678,13.11,Intracapsular extraction of lens by temporal inferior route,13.11
8722,11.51,Suture of corneal laceration,11.51
8733,13.2,Extracapsular extraction of lens by linear extraction technique,13.2
8855,12.85,Repair of scleral staphyloma with graft,12.85
8921,11.63,Penetrating keratoplasty with autograft,11.63
8934,12.72,Cyclocryotherapy,12.72
9070,10.1,Other incision of conjunctiva,10.1
9129,12.41,"Destruction of lesion of iris, nonexcisional",12.41
9223,12.81,Suture of laceration of sclera,12.81
9282,14.72,Other removal of vitreous,14.72
9364,10.4,Conjunctivoplasty,10.4
9367,10.49,Other conjunctivoplasty,10.49
9507,14.52,Repair of retinal detachment with cryotherapy,14.52
9586,14.55,Repair of retinal detachment with photocoagulation of unspecified type,14.55
9644,09.83,Conjunctivorhinostomy with insertion of tube or stent,09.83
9833,14.21,Destruction of chorioretinal lesion by diathermy,14.21
9920,11.31,Transposition of pterygium,11.31
9934,12.88,Other scleral reinforcement,12.88
9965,12.65,Other scleral fistulization with iridectomy,12.65
9990,14.54,Repair of retinal detachment with laser photocoagulation,14.54
10003,14.26,Destruction of chorioretinal lesion by radiation therapy,14.26
10020,12.93,Removal or destruction of epithelial downgrowth from anterior chamber,12.93
10027,12.86,Other repair of scleral staphyloma,12.86
10145,12.5,Facilitation of intraocular circulation,12.5
10146,12.59,Other facilitation of intraocular circulation,12.59
10210,12.55,Cyclodialysis,12.55
10242,12.44,Excision of lesion of ciliary body,12.44
10277,14.4,Repair of retinal detachment with scleral buckling and implant,14.4
10278,14.5,Other repair of retinal detachment,14.5
10279,14.59,Other repair of retinal detachment,14.59
10393,12.66,Postoperative revision of scleral fistulization procedure,12.66
